url,url_hash,title,seendate,domain,language,sourcecountry,query_keyword,query_group,collect_date
https://gcaptain.com/hms-dragon-transits-suez-canal-ahead-of-potential-hormuz-security-mission/,72bedb6972bd45a385158e11d9ba351d,HMS Dragon Transits Suez Canal Ahead of Potential Hormuz Security Mission,20260520T014500Z,gcaptain.com,English,United States,Suez Canal,D1_초크포인트,2026-05-20
https://www.thehindu.com/news/national/a-gooseberry-and-a-tear-the-other-crucial-straits-of-the-indian-ocean/article70998231.ece,38014f8cdfc3b9931d4a92cfb9336ef8,A Gooseberry and a Tear : The other crucial Straits of the Indian Ocean,20260520T104500Z,thehindu.com,English,India,Suez Canal,D1_초크포인트,2026-05-20
https://www.egyptindependent.com/fm-regional-escalation-threatens-global-trade-energy-flows/,c638b8547a886a13a49c74aa314bdbeb,"FM : regional escalation threatens global trade , energy flows",20260520T104500Z,egyptindependent.com,English,Egypt,Suez Canal,D1_초크포인트,2026-05-20
https://indianexpress.com/article/opinion/columns/the-uae-saudi-rivalry-trump-abraham-accords-meaningless-10699278/,ea715ff3bbc7e6b36b85ddd56d682d1f,The Abraham Accords Are Dead : How the Israel - UAE Axis Is Redrawing the Middle East,20260520T091500Z,indianexpress.com,English,India,Suez Canal,D1_초크포인트,2026-05-20
https://www.egyptindependent.com/gradual-decrease-in-temperatures-across-egypt-on-wednesday/,b184f07dd0f67c3400788e8c786157a4,Gradual decrease in temperatures across Egypt on Wednesday,20260520T104500Z,egyptindependent.com,English,Egypt,Suez Canal,D1_초크포인트,2026-05-20
https://english.ahram.org.eg/News/563615.aspx,4daedd9454f16e1d81b007753224bfc7,"El - Sisi urges national unity , warns regional war could impact global economy - Politics - Egypt",20260520T124500Z,english.ahram.org.eg,English,Egypt,Suez Canal,D1_초크포인트,2026-05-20
https://www.defenseone.com/ideas/2026/05/why-iran-war-breaking-useuropean-strategic-alliance/413640/,28ddb9055d510ea5ba13dbb1aba8ed0d,Why the Iran war is breaking the US ‑ European strategic alliance,20260520T000000Z,defenseone.com,English,United States,Suez Canal,D1_초크포인트,2026-05-20
https://www.rawstory.com/gimenez-trump-cuba/,0c7b8ad02d0af4fbdddbd4d207aa25a3,GOP rep warns Cuba may strike US with drones as he urges Trump against cutting a deal,20260520T194500Z,rawstory.com,English,United States,Panama Canal,D1_초크포인트,2026-05-20
https://www.abc.net.au/news/2026-05-21/us-indict-raul-castro-cuba-doj/106704164,01eff2d55c3c3d308585a7ca6f62aab4,Former Cuban president Raul Castro indicted by US,20260520T180000Z,abc.net.au,English,Australia,Panama Canal,D1_초크포인트,2026-05-20
https://www.canberratimes.com.au/story/9250851/us-charges-ex-cuban-president-raul-castro-with-murder/,fd30e10facd92cf41720fd473ddca64b,US charges ex - Cuban president Raul Castro with murder,20260520T194500Z,canberratimes.com.au,English,Australia,Panama Canal,D1_초크포인트,2026-05-20
https://www.hindustantimes.com/world-news/us-news/raul-castros-niece-has-a-warning-for-trump-as-murder-charges-revealed-with-a-mention-of-brother-fidel-castro-101779297315649.html,7ee66f1f1232303db109c5f467604287,Ex - Cuban leader Raul Castro niece has a warning for Trump as murder charges revealed,20260520T180000Z,hindustantimes.com,English,India,Panama Canal,D1_초크포인트,2026-05-20
https://peakoil.com/publicpolicy/crude-oil-is-going-the-long-way-around-the-world-as-countries-scramble-to-plug-hormuz-supply-hole,c758bc5dbb20c599000dc812483ea47a,Crude oil is going the long way around the world as countries scramble to plug Hormuz supply hole,20260520T011500Z,peakoil.com,English,United States,Panama Canal,D1_초크포인트,2026-05-20
https://www.theage.com.au/world/north-america/us-brings-criminal-charges-against-former-cuban-president-raul-castro-20260521-p5zz9c.html,a28be864ad4cc08a37a2a29c1e40815b,US brings criminal charges against former Cuban president Raul Castro,20260520T200000Z,theage.com.au,English,Australia,Panama Canal,D1_초크포인트,2026-05-20
https://www.brisbanetimes.com.au/world/north-america/us-brings-criminal-charges-against-former-cuban-president-raul-castro-20260521-p5zz9c.html,2ac8dbe58cd88d2ab81ebd74f8e999a7,US brings criminal charges against former Cuban president Raul Castro,20260520T194500Z,brisbanetimes.com.au,English,Australia,Panama Canal,D1_초크포인트,2026-05-20
https://www.ynetnews.com/article/skakq00i1gx,0e4769d945f45ddecee8efe9e45da720,US indicts former Cuban president Raúl Castro in 1996 aircraft shootdown case,20260520T201500Z,ynetnews.com,English,Israel,Panama Canal,D1_초크포인트,2026-05-20
https://www.internazionale.it/ultime-notizie-reuters/2026/05/20/former-cuban-president-raul-castro-charged-with-murder-in-us-2,a698ffaaca1cb51fb1fbd0ce8e13adb9,Former Cuban President Raul Castro charged with murder in US,20260520T191500Z,internazionale.it,English,Italy,Panama Canal,D1_초크포인트,2026-05-20
https://www.moneycontrol.com/world/former-cuban-president-raul-castro-charged-with-murder-in-us-article-13925692.html,2b258e463e0645ca26a7d51baeb96b66,Former Cuban President Raul Castro charged with murder in US,20260520T180000Z,moneycontrol.com,English,India,Panama Canal,D1_초크포인트,2026-05-20
https://www.dailykos.com/stories/2026/5/20/800041986/community/gop-representative-mike-lawer-wants-to-go-down-with-the-trumptanic/,9f0d5b3cd124e4d6d895c8437fd34aaa,GOP Representative Mike Lawer Wants to Go Down With the  Trumptanic  ,20260520T203000Z,dailykos.com,English,United States,Panama Canal,D1_초크포인트,2026-05-20
https://www.singletonargus.com.au/story/9250851/us-charges-ex-cuban-president-raul-castro-with-murder/,8ab14ed8aae78b1d12ac29b73e078182,US charges ex - Cuban president Raul Castro with murder,20260520T194500Z,singletonargus.com.au,English,Australia,Panama Canal,D1_초크포인트,2026-05-20
https://www.sconeadvocate.com.au/story/9250851/us-charges-ex-cuban-president-raul-castro-with-murder/,82624679bc5e99b0ea77307d592bd26c,US charges ex - Cuban president Raul Castro with murder,20260520T191500Z,sconeadvocate.com.au,English,Australia,Panama Canal,D1_초크포인트,2026-05-20
https://www.crookwellgazette.com.au/story/9250851/us-charges-ex-cuban-president-raul-castro-with-murder/,5bf4aafee695f83ed9b93e5824d8222c,US charges ex - Cuban president Raul Castro with murder,20260520T191500Z,crookwellgazette.com.au,English,Australia,Panama Canal,D1_초크포인트,2026-05-20
https://www.maitlandmercury.com.au/story/9250851/us-charges-ex-cuban-president-raul-castro-with-murder/,c2d16534f6762a381f3c3755a68e89ed,US charges ex - Cuban president Raul Castro with murder,20260520T203000Z,maitlandmercury.com.au,English,Australia,Panama Canal,D1_초크포인트,2026-05-20
https://townhall.com/columnists/victordavishanson/2026/05/20/america-the-real-crouching-tiger-hidden-dragon-n2676412,11c1d6e098f15660bd263c077daf05fc,"America : The Real Crouching Tiger , Hidden Dragon",20260520T201500Z,townhall.com,English,United States,Panama Canal,D1_초크포인트,2026-05-20
https://www.hellenicshippingnews.com/cmb-tech-announces-q1-2026-results/,b1fc598b12da38d4962f6afd376c4906,CMB . TECH announces Q1 2026 results | Hellenic Shipping News Worldwide,20260520T003000Z,hellenicshippingnews.com,English,China,Panama Canal,D1_초크포인트,2026-05-20
https://www.mdjonline.com/news/national/the-latest-us-indicts-former-cuban-president-ra-l-castro-over-1996-downing-of-planes/article_c169cfef-4142-5871-8237-0aa15be4b8c3.html,5294fcbd2090060e7656f98e1cf1697c,The Latest : US indicts former Cuban President Raúl Castro over 1996 downing of planes,20260520T200000Z,mdjonline.com,English,United States,Panama Canal,D1_초크포인트,2026-05-20
https://focustaiwan.tw/politics/202605200010,6d22f7105ccec8e9e50672a0078a9d1c,Taiwan hopes U . S . arms sales to continue amid uncertainty : Lai,20260520T091500Z,focustaiwan.tw,English,Taiwan,Taiwan Strait,D1_초크포인트,2026-05-20
https://focustaiwan.tw:443/politics/202605200010,170af6aca6d7b4040ad8291f35a37e2e,Taiwan hopes U . S . arms sales to continue amid uncertainty : Lai,20260520T050000Z,focustaiwan.tw,English,Taiwan,Taiwan Strait,D1_초크포인트,2026-05-20
https://www.arabnews.com/node/2644252/world,225275ade8da0ab4029fc99c8df88296,"If they spoke , Taiwan president would tell Trump China was undermining stability",20260520T074500Z,arabnews.com,English,Saudi Arabia,Taiwan Strait,D1_초크포인트,2026-05-20
http://europe.chinadaily.com.cn/a/202605/20/WS6a0db61ea310d6866eb49c8a.html,808f9a7e16c1d745bba998eff5995397,PLA vows to thwart  Taiwan independence  provocations,20260520T144500Z,europe.chinadaily.com.cn,English,China,Taiwan Strait,D1_초크포인트,2026-05-20
https://www.yahoo.com/news/articles/taiwans-future-cannot-decided-external-021937986.html,7deeb3f2c679d6587976d1961396422a,"If they spoke , Taiwan president would tell Trump China was undermining stability",20260520T050000Z,yahoo.com,English,United States,Taiwan Strait,D1_초크포인트,2026-05-20
https://www.globalsecurity.org/wmd/library/news/taiwan/2026/taiwan-260519-cna04.htm,d05a88c4a36b99b2adb9726fe8308d62,Taiwan  cautiously optimistic  about U . S . arms sales : Minister,20260520T134500Z,globalsecurity.org,English,Syria,Taiwan Strait,D1_초크포인트,2026-05-20
https://www.dw.com/en/taiwans-lai-rejects-china-pressure-pledges-stronger-defense/a-77223363,3ef939503bfa0eba1705e8aa9469defe,"Taiwan Lai rejects China pressure , pledges strong defense",20260520T054500Z,dw.com,English,Germany,Taiwan Strait,D1_초크포인트,2026-05-20
https://www.internazionale.it/ultime-notizie-reuters/2026/05/20/if-they-spoke-taiwan-president-would-tell-trump-china-was-undermining-stability,d488c7410b34b5b073b7b8aff19786d4,"If they spoke , Taiwan president would tell Trump China was undermining stability",20260520T044500Z,internazionale.it,English,Italy,Taiwan Strait,D1_초크포인트,2026-05-20
https://www.bloomberg.com:443/news/articles/2026-05-20/taiwan-s-president-vows-peace-after-trump-aired-worry-about-war,d74c4192cbf276b5ac3a9d92502d4d81,Taiwan President Vows Peace After Trump Aired Worry About War,20260520T071500Z,bloomberg.com,English,United States,Taiwan Strait,D1_초크포인트,2026-05-20
https://www.newsweek.com/trump-risks-china-anger-plan-call-taiwan-president-11973857,ac6282bf10a5d6de2a6b80839529ad11,Trump Risks China Anger With Plan To Call Taiwan President,20260520T203000Z,newsweek.com,English,United States,Taiwan Strait,D1_초크포인트,2026-05-20
http://www.china.org.cn/2026-05/20/content_118504467.shtml,efc1d2dcde14734553118789eb0538eb,Mainland says Lai Ching - te separatist remarks reveal  weak and deceitful  nature,20260520T070000Z,china.org.cn,English,China,Taiwan Strait,D1_초크포인트,2026-05-20
https://www.globalsecurity.org/wmd/library/news/taiwan/2026/taiwan-260519-pdo03.htm,146c6a6f1188a70a70c556480f1bc388,Mainland says Lai Ching - te separatist remarks reveal  weak and deceitful  nature,20260520T134500Z,globalsecurity.org,English,Syria,Taiwan Strait,D1_초크포인트,2026-05-20
https://www.taipeitimes.com/News/front/archives/2026/05/21/2003857699,d2faaa85ad65a8212740b0e0e65182de,Trump says he will speak with Taiwanese President Lai on arms sale,20260520T170000Z,taipeitimes.com,English,Taiwan,Taiwan Strait,D1_초크포인트,2026-05-20
https://www.seattletimes.com/nation-world/taiwans-lai-says-he-would-tell-trump-he-hopes-to-continue-arm-purchases-if-given-a-chance/,dafac32d8f29d3218267a68167a026bc,"Taiwan Lai says he would tell Trump he hopes to continue arm purchases , if given a chance",20260520T053000Z,seattletimes.com,English,United States,Taiwan Strait,D1_초크포인트,2026-05-20
https://focustaiwan.tw/politics/202605200008,81fa22f32cb097652c0b48f87c50b2fc,Taiwan future not to be decided by  external force : President Lai,20260520T043000Z,focustaiwan.tw,English,Taiwan,Taiwan Strait,D1_초크포인트,2026-05-20
https://focustaiwan.tw:443/politics/202605200008,6283fd23c8b74c40e19a844b3c564bbe,Taiwan future not to be decided by  external force : President Lai,20260520T043000Z,focustaiwan.tw,English,Taiwan,Taiwan Strait,D1_초크포인트,2026-05-20
https://www.asiaone.com/asia/taiwans-future-cannot-be-decided-external-forces-president-says,4e9db691c701d05e0ce3173ce4c5288a,"Taiwan future cannot be decided by  external force , president says",20260520T034500Z,asiaone.com,English,Singapore,Taiwan Strait,D1_초크포인트,2026-05-20
https://www.winnipegfreepress.com/world/2026/05/19/taiwans-lai-says-he-would-tell-trump-he-hopes-to-continue-arm-purchases-if-given-a-chance,dab4a6dfae017141133f30030fc721f0,"Taiwan Lai says he would tell Trump he hopes to continue arm purchases , if given a chance – Winnipeg Free Press",20260520T051500Z,winnipegfreepress.com,English,Canada,Taiwan Strait,D1_초크포인트,2026-05-20
https://lancasteronline.com/news/world/taiwans-lai-says-he-would-tell-trump-he-hopes-to-continue-arm-purchases-if-given/article_6303eb19-4cd1-5c49-bd31-a2992f179cd5.html,15f6712866119e4a6d58638aba797c32,"Taiwan Lai says he would tell Trump he hopes to continue arm purchases , if given a chance",20260520T054500Z,lancasteronline.com,English,United States,Taiwan Strait,D1_초크포인트,2026-05-20
https://abcnews.com/International/wireStory/taiwans-lai-trump-hopes-continue-arm-purchases-chance-133139182,5b904a5175cb7a67687ea756ec8a0faf,Taiwan Lai says he would tell Trump he hopes to continue arm purchases,20260520T060000Z,abcnews.com,English,United States,Taiwan Strait,D1_초크포인트,2026-05-20
https://www.nbcnews.com/world/asia/taiwans-future-cannot-decided-external-forces-president-says-rcna346033,db80c1d51e74c31aa13a2e5223e56d93,"Taiwan future cannot be decided by  external forces , president says",20260520T054500Z,nbcnews.com,English,United States,Taiwan Strait,D1_초크포인트,2026-05-20
https://www.dailyexcelsior.com/taiwans-lai-says-he-would-tell-trump-he-hopes-to-continue-arms-purchases-from-us/,9fd135316b0d558729e28a8b9c8b24ca,Taiwan Lai says he would tell Trump he  hopes to continue arms purchases from US,20260520T074500Z,dailyexcelsior.com,English,India,Taiwan Strait,D1_초크포인트,2026-05-20
https://www.sun-sentinel.com/2026/05/20/us-mobile-rocket-system-mount-fuji/,e7a3d25a0e9860492d002db99c232c24,US test fires mobile rocket system near Mount Fuji in drill,20260520T191500Z,sun-sentinel.com,English,United States,Taiwan Strait,D1_초크포인트,2026-05-20
https://isp.netscape.com:443/news/world/story/0001/20260520/d52867fbbb34e66f414fb4a45929f7fc,95c3591600d2285e915c8e8ab72f8334,Taiwan Lai says he would tell Trump he hopes to continue arms purchases from the US,20260520T071500Z,isp.netscape.com,English,United States,Taiwan Strait,D1_초크포인트,2026-05-20
https://www.dailycamera.com/2026/05/20/us-mobile-rocket-system-mount-fuji/,3e605f292b3badf22505f2e9845139c5,US test fires mobile rocket system near Mount Fuji in drill,20260520T171500Z,dailycamera.com,English,United States,Taiwan Strait,D1_초크포인트,2026-05-20
https://www.dailypress.com/2026/05/20/us-mobile-rocket-system-mount-fuji/,d11a2ea6e84a3bf15c9f26fd4f7412f4,US test fires mobile rocket system near Mount Fuji in drill,20260520T181500Z,dailypress.com,English,United States,Taiwan Strait,D1_초크포인트,2026-05-20
https://www.news-gazette.com/news/nation-world/taiwans-lai-says-hed-tell-trump-he-hopes-to-continue-arms-purchases-from-us-if/article_1dba8040-8445-51fb-a196-6d898e40371e.html,e749da4c66c500ee0d826e6239a7e41e,"Taiwan Lai says hed tell Trump he hopes to continue arms purchases from US , if given a chance",20260520T111500Z,news-gazette.com,English,United States,Taiwan Strait,D1_초크포인트,2026-05-20
https://www.winknews.com/news/international/taiwans-lai-says-he-would-tell-trump-he-hopes-to-continue-arm-purchases-if-given/article_cc7a98dd-ccc5-522d-9406-cf1937a9474b.html,62aa9fd912663eafd3aae420460355fa,"Taiwan Lai says he would tell Trump he hopes to continue arm purchases , if given a chance",20260520T081500Z,winknews.com,English,United States,Taiwan Strait,D1_초크포인트,2026-05-20
https://www.taipeitimes.com/News/editorials/archives/2026/05/21/2003857688,380b9f03cde912c33c1824ccfc3dc9f3,The US has not abandoned Taiwan - Taipei Times,20260520T170000Z,taipeitimes.com,English,Taiwan,Taiwan Strait,D1_초크포인트,2026-05-20
https://focustaiwan.tw:443/politics/202605200009,7e3195128ba1c19f9d6894eb2df76ad1,Full text of President Lai address on 2nd anniversary of taking office,20260520T043000Z,focustaiwan.tw,English,Taiwan,Taiwan Strait,D1_초크포인트,2026-05-20
https://focustaiwan.tw/politics/202605200009,55f63f6120c0be009fbdbdcdaa3096ae,Full text of President Lai address on 2nd anniversary of taking office,20260520T043000Z,focustaiwan.tw,English,Taiwan,Taiwan Strait,D1_초크포인트,2026-05-20
https://english.aawsat.com/world/5275227-taiwan-leader-says-%E2%80%98foreign-forces%E2%80%99-cannot-decide-island%E2%80%99s-future,621217b17cde255bc0f65e5c23645ee8,Taiwan Leader Says  Foreign Force Cannot Decide Island Future,20260520T091500Z,english.aawsat.com,English,Syria,Taiwan Strait,D1_초크포인트,2026-05-20
https://focustaiwan.tw:443/politics/202605200018,572fd4a7a95fed404c1a9c429ee6a0cd,"Lai , KMT trade barbs over cross - strait policy differences",20260520T091500Z,focustaiwan.tw,English,Taiwan,Taiwan Strait,D1_초크포인트,2026-05-20
https://focustaiwan.tw/politics/202605200018,bd4a4d530228aaf2eec4334d2b415f25,"Lai , KMT trade barbs over cross - strait policy differences",20260520T091500Z,focustaiwan.tw,English,Taiwan,Taiwan Strait,D1_초크포인트,2026-05-20
https://www.taipeitimes.com/News/taiwan/archives/2026/05/21/2003857708,eb811243b86764127c32ebe4dc0e88dc,Opposition blames Lai for Taiwan issues,20260520T170000Z,taipeitimes.com,English,Taiwan,Taiwan Strait,D1_초크포인트,2026-05-20
https://english.news.cn/20260520/6a8ed6370f8f4f9491a7ed3c992b26bb/c.html,f8512ecc1bec1d0368e0cad4d7f5a120,Xinhua Commentary : Japan meddling in South China Sea lays bare its hidden agenda - Xinhua,20260520T041500Z,english.news.cn,English,,Taiwan Strait,D1_초크포인트,2026-05-20
https://www.ksat.com/news/world/2026/05/20/taiwans-lai-says-he-would-tell-trump-he-hopes-to-continue-arms-purchases-from-the-us/,7a9fc75ddc6fb34877a5e0d74ab8d91b,Taiwan Lai says he would tell Trump he hopes to continue arms purchases from the US,20260520T080000Z,ksat.com,English,United States,Taiwan Strait,D1_초크포인트,2026-05-20
http://www.middleeaststar.com/news/279062585/xinhua-commentary-japan-meddling-in-south-china-sea-lays-bare-its-hidden-agenda,2ce4bd9a5ae152a3158137fa9cc1efce,Xinhua Commentary : Japan meddling in South China Sea lays bare its hidden agenda,20260520T041500Z,middleeaststar.com,English,Syria,Taiwan Strait,D1_초크포인트,2026-05-20
http://www.pakistantelegraph.com/news/279062585/xinhua-commentary-japan-meddling-in-south-china-sea-lays-bare-its-hidden-agenda,7bb54a90f1c6425b3b98db2b885b3b7a,Xinhua Commentary : Japan meddling in South China Sea lays bare its hidden agenda,20260520T033000Z,pakistantelegraph.com,English,Pakistan,Taiwan Strait,D1_초크포인트,2026-05-20
http://www.taiwansun.com/news/279062585/xinhua-commentary-japan-meddling-in-south-china-sea-lays-bare-its-hidden-agenda,f4fbda34a25bee1886e239421945899f,Xinhua Commentary : Japan meddling in South China Sea lays bare its hidden agenda,20260520T033000Z,taiwansun.com,English,China,Taiwan Strait,D1_초크포인트,2026-05-20
http://www.shanghainews.net/news/279062585/xinhua-commentary-japan-meddling-in-south-china-sea-lays-bare-its-hidden-agenda,cea8480ec03a5be8f5d086a54324ff59,Xinhua Commentary : Japan meddling in South China Sea lays bare its hidden agenda,20260520T024500Z,shanghainews.net,English,China,Taiwan Strait,D1_초크포인트,2026-05-20
http://www.laosnews.net/news/279062585/xinhua-commentary-japan-meddling-in-south-china-sea-lays-bare-its-hidden-agenda,768004a25c3b9e4d1d23e13cf4ebe58d,Xinhua Commentary : Japan meddling in South China Sea lays bare its hidden agenda,20260520T031500Z,laosnews.net,English,United States,Taiwan Strait,D1_초크포인트,2026-05-20
http://www.bruneinews.net/news/279062585/xinhua-commentary-japan-meddling-in-south-china-sea-lays-bare-its-hidden-agenda,8a394e6263861301c842bb4fa4686e21,Xinhua Commentary : Japan meddling in South China Sea lays bare its hidden agenda,20260520T043000Z,bruneinews.net,English,Malaysia,Taiwan Strait,D1_초크포인트,2026-05-20
http://www.japanherald.com/news/279062585/xinhua-commentary-japan-meddling-in-south-china-sea-lays-bare-its-hidden-agenda,77b75a459a47215fb4806715ce268a3e,Xinhua Commentary : Japan meddling in South China Sea lays bare its hidden agenda,20260520T044500Z,japanherald.com,English,Japan,Taiwan Strait,D1_초크포인트,2026-05-20
http://www.philippinetimes.com/news/279062585/xinhua-commentary-japan-meddling-in-south-china-sea-lays-bare-its-hidden-agenda,0fdc59bc4c2b19ca1289ce367c29790e,Xinhua Commentary : Japan meddling in South China Sea lays bare its hidden agenda,20260520T051500Z,philippinetimes.com,English,Philippines,Taiwan Strait,D1_초크포인트,2026-05-20
http://www.asiabulletin.com/news/279062585/xinhua-commentary-japan-meddling-in-south-china-sea-lays-bare-its-hidden-agenda,317aebaedfd96711d1fd4d459cec4fce,Xinhua Commentary : Japan meddling in South China Sea lays bare its hidden agenda,20260520T050000Z,asiabulletin.com,English,China,Taiwan Strait,D1_초크포인트,2026-05-20
http://www.malaysiasun.com/news/279062585/xinhua-commentary-japan-meddling-in-south-china-sea-lays-bare-its-hidden-agenda,7095f14c66b7f36661a334ca7aa140c1,Xinhua Commentary : Japan meddling in South China Sea lays bare its hidden agenda,20260520T053000Z,malaysiasun.com,English,Malaysia,Taiwan Strait,D1_초크포인트,2026-05-20
https://www.wsls.com/news/world/2026/05/20/taiwans-lai-says-he-would-tell-trump-he-hopes-to-continue-arm-purchases-if-given-a-chance/,9f3bcc091dc58658067462505334796c,Taiwan Lai says he would tell Trump he hopes to continue arms purchases from the US,20260520T074500Z,wsls.com,English,United States,Taiwan Strait,D1_초크포인트,2026-05-20
https://www.wsbradio.com/news/world/taiwans-lai-says-he/PX34QZ6JG456VFZIGD5TDIRP2E/,13eb6e2f4ec17d6c1fba6b1cbe035521,Taiwan Lai calls US arms sales essential for peace,20260520T091500Z,wsbradio.com,English,United States,Taiwan Strait,D1_초크포인트,2026-05-20
https://www.idahopress.com/news/world/taiwans-lai-says-he-would-tell-trump-he-hopes-to-continue-arms-purchases-from-the/article_089725ba-c5a1-5e43-8a0a-90164964a50b.html,394696ca085443590df1d0a76154507d,Taiwan Lai says he would tell Trump he hopes to continue arms purchases from the US,20260520T093000Z,idahopress.com,English,United States,Taiwan Strait,D1_초크포인트,2026-05-20
https://www.durangoherald.com/articles/taiwans-lai-says-he-would-tell-trump-he-hopes-to-continue-arms-purchases-from-the-us/,df0b4a31429aabf06898837e4fc35074,Taiwan Lai says he would tell Trump he hopes to continue arms purchases from the US,20260520T080000Z,durangoherald.com,English,United States,Taiwan Strait,D1_초크포인트,2026-05-20
https://www.yoursourceone.com/news/national_news/taiwans-lai-says-he-would-tell-trump-he-hopes-to-continue-arm-purchases-if-given/article_a664b03b-d84e-5a64-825e-8d6ed7a317e7.html,31ed8b8dad2705c00d230590adae6c3b,"Taiwan Lai says he would tell Trump he hopes to continue arm purchases , if given a chance",20260520T060000Z,yoursourceone.com,English,,Taiwan Strait,D1_초크포인트,2026-05-20
https://whbl.com/2026/05/19/taiwans-future-cannot-be-decided-by-external-forces-president-says/,350f46857825bf537b5ab94217c4fc36,"Taiwan future cannot be decided by  external force , president says",20260520T043000Z,whbl.com,English,United States,Taiwan Strait,D1_초크포인트,2026-05-20
https://www.leadertelegram.com/news/nation-world/taiwans-lai-says-he-would-tell-trump-he-hopes-to-continue-arms-purchases-from-the/article_1eadd4a0-1060-53df-b2eb-45a2d8c7c610.html,cb3f587cb4448a3f2a3e7206ac1dc8f8,Taiwan Lai says he would tell Trump he hopes to continue arms purchases from the US,20260520T080000Z,leadertelegram.com,English,United States,Taiwan Strait,D1_초크포인트,2026-05-20
https://www.canoncitydailyrecord.com/2026/05/20/us-mobile-rocket-system-mount-fuji/,2a7012ec42e826fc0e04028f3a17c82f,US test fires mobile rocket system near Mount Fuji in drill,20260520T171500Z,canoncitydailyrecord.com,English,United States,Taiwan Strait,D1_초크포인트,2026-05-20
https://www.eptrail.com/2026/05/20/us-mobile-rocket-system-mount-fuji/,02a4e8bd86632323f6dad3bb6e138a4a,US test fires mobile rocket system near Mount Fuji in drill,20260520T180000Z,eptrail.com,English,United States,Taiwan Strait,D1_초크포인트,2026-05-20
https://www.rfa.org:443/english/southchinasea/2026/05/19/xi-trump-taiwan-five-year-plan/,50f9b29c9e856e055f17f583d2ea1ca9,Xi - Trump talks cast fresh spotlight on Taiwan as part of China maritime strategy – Radio Free Asia,20260520T003000Z,rfa.org,English,China,Taiwan Strait,D1_초크포인트,2026-05-20
https://www.rfa.org/english/southchinasea/2026/05/19/xi-trump-taiwan-five-year-plan/,7514752c9be637e1d8f4fe47429c1653,Xi - Trump talks cast fresh spotlight on Taiwan as part of China maritime strategy – Radio Free Asia,20260520T020000Z,rfa.org,English,China,Taiwan Strait,D1_초크포인트,2026-05-20
https://dominicanrepublicpost.com/taiwans-president-says-future-will-not-be-decided-by-external-forces/,43137651e9b0cce21ebd508b1a16d026,"Taiwan president says future will not be decided by  external force - Dominican Republic Post – Caribbean News , Business , Travel & Culture",20260520T100000Z,dominicanrepublicpost.com,English,United States,Taiwan Strait,D1_초크포인트,2026-05-20
