url_hash,title,url,seendate,domain,language,sourcecountry,query_keyword,query_group,collect_date,kg_entities,kg_match_count,relevance,topic,category
33e12573659d801cd9935573299c4d55,Cargo ship attacked near Strait of Hormuz with all crew reported safe,https://www.foxnews.com/world/cargo-ship-attacked-small-craft-near-strait-hormuz-uk-maritime-agency-says,20260503T191500Z,foxnews.com,English,United States,Strait of Hormuz,D1_초크포인트,2026-05-03,,0,HIGH,Hormuz cargo attack,1_Security
550e5dcaa33089dc2c4790afb6557bc2,U . S . hits crude oil export record as war keeps Strait of Hormuz closed,https://www.upi.com/Top_News/US/2026/05/03/american-oil-exports-increase-as-hormuz-remains-blocked/1191777824128/,20260503T191500Z,upi.com,English,United States,Strait of Hormuz,D1_초크포인트,2026-05-03,,0,HIGH,Hormuz closure impact,3_Freight
8c88e8c800cc2984f2177321997aa8bb,Ship is attacked near Strait of Hormuz as Iran reviews US response to latest proposal,https://www.sun-sentinel.com/2026/05/03/ship-is-attacked-near-strait-of-hormuz-as-iran-reviews-us-response-to-latest-proposal/,20260503T191500Z,sun-sentinel.com,English,United States,Strait of Hormuz,D1_초크포인트,2026-05-03,,0,HIGH,Hormuz vessel attack,1_Security
c00c4a5eeccdf59531327ee5f8e84a16,"Large Cargo Ship Near Hormuz Reports Being Attacked , In First Escalation Since April 22",https://www.zerohedge.com/geopolitical/large-cargo-ship-near-hormuz-reports-being-attacked-first-escalation-april-22,20260503T191500Z,zerohedge.com,English,United States,Strait of Hormuz,D1_초크포인트,2026-05-03,,0,HIGH,Ship attack Hormuz,1_Security
1f35b1a3b93cf2d26bde82dfeee264d9,Ship near Strait of Hormuz says it was attacked as Iran reviews US response to peace proposal,https://www.adn.com/nation-world/2026/05/03/ship-near-strait-of-hormuz-says-it-was-attacked-as-iran-reviews-us-response-to-peace-proposal/,20260503T190000Z,adn.com,English,United States,Strait of Hormuz,D1_초크포인트,2026-05-03,,0,HIGH,Hormuz ship attack,1_Security
a8bfae8d81c49343091e66b199193e8c,UK military Maritime Trade Operations center says a bulk carrier near Strait of Hormuz reports being attacked | International,https://www.winknews.com/news/international/uk-military-s-maritime-trade-operations-center-says-a-bulk-carrier-near-strait-of-hormuz/article_c4d84433-0933-5235-969e-369835a818ba.html,20260503T190000Z,winknews.com,English,United States,Strait of Hormuz,D1_초크포인트,2026-05-03,,0,HIGH,Hormuz bulk carrier attack,1_Security
ad501299e3a698ae3598253805f54522,US is oil supplier of last resort as Hormuz disruptions worsen,https://www.businesstimes.com.sg/international/us-oil-supplier-last-resort-hormuz-disruptions-worsen,20260503T190000Z,businesstimes.com.sg,English,Singapore,crude oil,D2_품목,2026-05-03,,0,HIGH,Hormuz disruption,1_Security
9110262c2e2648d0841911b6d8845681,Bulk Carrier Attacked Off Iran Coast,https://athens-times.com/attack-on-bulk-carrier-by-multiple-small-vessels-off-irans-coast/,20260503T184500Z,athens-times.com,English,Greece,bulk carrier,D4_운송,2026-05-03,,0,HIGH,Vessel Attack Iran,1_Security
94d151710e011c1101ada4b6a2ad1289,Iran attacks cargo ship in Strait of Hormuz,https://nypost.com/2026/05/03/world-news/iran-attacks-cargo-ship-in-strait-of-hormuz/,20260503T180000Z,nypost.com,English,United States,Strait of Hormuz,D1_초크포인트,2026-05-03,,0,HIGH,Hormuz attack,1_Security
f12a95f410f9c4280f1964d06f693cfe,"Attack on vessel near Hormuz raises maritime security concerns , says united kingdom military",https://www.orissapost.com/attack-on-vessel-near-hormuz-raises-maritime-security-concerns-says-uk-military/,20260503T180000Z,orissapost.com,English,India,bulk carrier,D4_운송,2026-05-03,,0,HIGH,Hormuz Security,1_Security
965a153c11be68b88f18e92c3f3117db,18 Pinoy seafarers in Manila after refusing Hormuz passage,https://www.philstar.com/headlines/2026/05/04/2525527/18-pinoy-seafarers-manila-after-refusing-hormuz-passage,20260503T174500Z,philstar.com,English,Philippines,Strait of Hormuz,D1_초크포인트,2026-05-03,,0,HIGH,Hormuz passage refusal,1_Security
5da923fcc34fd46f1c61b8fdd2c0e0a7,UK military says a bulk carrier near Strait of Hormuz reports being attacked,https://www.wccbcharlotte.com/2026/05/03/uk-military-says-a-bulk-carrier-near-strait-of-hormuz-reports-being-attacked/,20260503T174500Z,wccbcharlotte.com,English,United States,bulk carrier,D4_운송,2026-05-03,,0,HIGH,Hormuz Attack,1_Security
af9050a5c59944a566544fc475f48f48,US petrol prices hit four - year high as Strait of Hormuz remains shut,https://www.modernghana.com/news/1490259/us-petrol-prices-hit-four-year-high-as-strait-of.html,20260503T171500Z,modernghana.com,English,Ghana,Strait of Hormuz,D1_초크포인트,2026-05-03,,0,HIGH,Hormuz closure impact,5_EconFinance
b39dd5f078f616e2592373c8e0ae43eb,Bulk carrier near Strait of Hormuz reports being attacked as Iran makes new peace proposal,https://www.9news.com/article/news/nation-world/attack-on-iran/iran-ceasefire-war-proposal-end-war-united-states-president-trump/507-28f99c78-9030-4e36-9e93-7738d6b18d3d,20260503T171500Z,9news.com,English,United States,Strait of Hormuz,D1_초크포인트,2026-05-03,,0,HIGH,Hormuz vessel attack,1_Security
7a5be3daf8a631b969bea3352aa69eb6,"Bulk carrier attacked near Strait of Hormuz , united kingdom military reports",https://www.wnep.com/article/news/nation-world/attack-on-iran/bulk-carrier-attack-strait-of-hormuz-iran-war-ukmto-british-military-incident-report/507-cb37c5b2-d3a3-46a8-bcb5-6b6cde39b9b0,20260503T170000Z,wnep.com,English,United States,Strait of Hormuz,D1_초크포인트,2026-05-03,,0,HIGH,Hormuz vessel attack,1_Security
411ce9a68f1e05e8cf844d5c30a52ea6,OPEC+ agrees third oil output quota hike since Hormuz closure,https://asia.nikkei.com/spotlight/iran-tensions/iran-war/opec-agrees-third-oil-output-quota-hike-since-hormuz-closure,20260503T170000Z,asia.nikkei.com,English,Japan,Strait of Hormuz,D1_초크포인트,2026-05-03,,0,HIGH,OPEC+ quota hike,5_EconFinance
d0e1b361c597a118192ef8c79ebbfcca,UK military says bulk carrier near Strait of Hormuz reports being attacked,https://www.lancashiretelegraph.co.uk/news/national/26075115.uk-military-says-bulk-carrier-near-strait-hormuz-reports-attacked/,20260503T170000Z,lancashiretelegraph.co.uk,English,United Kingdom,Strait of Hormuz,D1_초크포인트,2026-05-03,,0,HIGH,Hormuz bulk carrier attack,1_Security
f62dc661f05847347aae670f582dd94f,A cargo ship near Strait of Hormuz reports being attacked as Iran makes new peace proposal,https://isp.netscape.com:443/news/world/story/0001/20260503/454006a0a9bb19a45a2f299c0869cefb,20260503T170000Z,isp.netscape.com,English,United States,Strait of Hormuz,D1_초크포인트,2026-05-03,,0,HIGH,Hormuz ship attack,1_Security
2c5a3755a8a827ac68f5e6e897ca1fe9,A bulk carrier near Strait of Hormuz reports being attacked as Iran makes new peace proposal,https://www.witn.com/2026/05/03/iran-presses-an-end-war-within-30-days-trump-expresses-doubts/,20260503T164500Z,witn.com,English,United States,Strait of Hormuz,D1_초크포인트,2026-05-03,,0,HIGH,Hormuz vessel attack,1_Security
c052fd28ceb822eca7286a8ca8ca0f9c,New law will set conditions for transit through Strait of Hormuz : Deputy speaker,https://www.presstv.ir/Detail/2026/05/03/767976/New-law-will-set-conditions-for-transit-through-Strait-of-Hormuz-Deputy-speaker,20260503T164500Z,presstv.ir,English,Iran,Strait of Hormuz,D1_초크포인트,2026-05-03,,0,HIGH,Hormuz transit regulation,1_Security
247c307c79daf3c316b2089fe29d4ab1,US becomes oil supplier of last resort as Hormuz disruptions escalate,https://www.straitstimes.com/world/united-states/us-becomes-oil-supplier-of-last-resort-as-hormuz-disruptions-escalate,20260503T163000Z,straitstimes.com,English,Singapore,crude oil,D2_품목,2026-05-03,,0,HIGH,Hormuz disruption,1_Security
b664917fbc36a9ce81f39bc53991f811,US – Iran Talks Deadlocked : Will Trump Accept Tehran 14 - Point Peace Deal to End War and Reopen Strait of Hormuz ? ,https://gulfnews.com/world/mena/will-trump-accept-iran-s-14-point-deal-as-talks-stall-1.500527609,20260503T161500Z,gulfnews.com,English,United Arab Emirates,Strait of Hormuz,D1_초크포인트,2026-05-03,,0,HIGH,Hormuz strait reopening,1_Security
813ae6c587b4bfad7a816c079addf111,Bulker Comes Under Attack in Strait of Hormuz,https://shipandbunker.com/news/emea/974117-bulker-comes-under-attack-in-strait-of-hormuz,20260503T161500Z,shipandbunker.com,English,Singapore,Strait of Hormuz,D1_초크포인트,2026-05-03,,0,HIGH,Bulker attack Hormuz,1_Security
8bec9285339616f5962f2f168ed5578f,America crude oil port sees record - high traffic as world flocks to Texas while Strait of Hormuz is suffocated by Iran,https://www.dailymail.com/news/article-15786461/america-crude-oil-port-texas-strait-hormuz-iran.html,20260503T161500Z,dailymail.com,English,United States,crude oil,D2_품목,2026-05-03,,0,HIGH,Hormuz strait congestion,3_Freight
d1e8db137671ef2efae56b2c48c954ec,Attack on vessel reported near Strait of Hormuz,http://www.bignewsnetwork.com/news/279027411/attack-on-vessel-reported-near-strait-of-hormuz,20260503T161500Z,bignewsnetwork.com,English,United States,bulk carrier,D4_운송,2026-05-03,,0,HIGH,Hormuz Attack,1_Security
99cc1f8319a0bcc96bb21b022c9b0089,OPEC+ Agrees Third Oil Output Quota Hike Since Hormuz Closure  | Peak Oil News and Message Boards,https://peakoil.com/business/opec-agrees-third-oil-output-quota-hike-since-hormuz-closure,20260503T153000Z,peakoil.com,English,United States,crude oil,D2_품목,2026-05-03,,0,HIGH,Hormuz closure impact,5_EconFinance
df5ebbab1ea9d333aaa670336d67421c,OPEC+ hikes oil production quotas but stays mum on UAE pull - out,https://www.digitaljournal.com/world/opec-hikes-oil-production-quotas-but-stays-mum-on-uae-pull-out/article,20260503T150000Z,digitaljournal.com,English,United States,Strait of Hormuz,D1_초크포인트,2026-05-03,,0,HIGH,OPEC+ quota hike,5_EconFinance
2867ca7e235b574499cce5c4db9f17d3,"Ukraine hits key Russian oil - loading port , 3  shadow fleet  tankers",https://www.bostonglobe.com/2026/05/03/world/ukraine-hits-key-russian-oil-loading-port-3-shadow-fleet-tankers/,20260503T143000Z,bostonglobe.com,English,United States,fleet,D4_운송,2026-05-03,,0,HIGH,Oil Port Attack,1_Security
d8bd892ca183f127647a3e80a7097457,Iranian supertanker carrying oil worth USD 220 million evades US blockade,https://www.newindianexpress.com/world/2026/May/03/iranian-supertanker-carrying-oil-worth-usd-220-million-evades-us-blockade,20260503T133000Z,newindianexpress.com,English,India,Strait of Malacca,D1_초크포인트,2026-05-03,,0,HIGH,Iranian tanker blockade evasion,1_Security
279b6ff8376a4d8e5f2aa855b798e19a,"This is how Iran manages to move oil despite the US blockade : False data , covert flags",https://www.theweek.in/news/middle-east/2026/05/03/this-is-how-iran-manages-to-move-oil-despite-the-us-blockade-false-data-covert-flags.html,20260503T133000Z,theweek.in,English,India,crude oil,D2_품목,2026-05-03,,0,HIGH,Iran oil blockade,1_Security
b432bdbcbb8698e9ff88ea0572d873f3,MSC launches truck and feeder service to bypass Strait of Hormuz,https://news.az/news/msc-launches-truck-and-feeder-service-to-bypass-strait-of-hormuz,20260503T131500Z,news.az,English,Azerbaijan,container,D2_품목,2026-05-03,,0,HIGH,Hormuz bypass route,7_Shipping
0b58d79c537d7fc71a5d5270b9360943,OPEC+ agrees to third oil output quota hike since Hormuz closure,https://www.theglobeandmail.com/world/article-opec-agrees-third-oil-output-quota-hike-since-hormuz-closure/,20260503T130000Z,theglobeandmail.com,English,Canada,Strait of Hormuz,D1_초크포인트,2026-05-03,,0,HIGH,OPEC+ quota hike,5_EconFinance
89384911adf0f7aeb2c4103903574904,TankerTrackers . com : Iranian oil supertanker manages to evade the U . S . Navy,https://news.am/en/news/1032123,20260503T130000Z,news.am,English,Armenia,Strait of Malacca,D1_초크포인트,2026-05-03,,0,HIGH,Iranian tanker blockade evasion,1_Security
075ef8ea73692853fe4ad313873edd37,"India - bound LPG carrier , with 18 Indians aboard , crosses Hormuz , likely to arrive in Vizag on ... ",https://article.wn.com/view/2026/05/03/Indiabound_LPG_carrier_with_18_Indians_aboard_crosses_Hormuz/,20260503T120000Z,article.wn.com,English,United States,Strait of Hormuz,D1_초크포인트,2026-05-03,,0,HIGH,LPG carrier Hormuz,7_Shipping
59fd3805eff65e07fa610eee1aa3ce7a,"Korea weighs Hormuz mission options led by US , united kingdom - France coalitions",https://www.koreatimes.co.kr/foreignaffairs/20260503/korea-weighs-hormuz-mission-options-led-by-us-uk-france-coalitions,20260503T120000Z,koreatimes.co.kr,English,South Korea,Strait of Hormuz,D1_초크포인트,2026-05-03,,0,HIGH,Korea Hormuz mission,1_Security
168f5581d7453d7f42942db6ba16a519,Ukraine destroys two shadow fleet oil tankers [ VIDEO ] ,https://www.azernews.az/region/257900.html,20260503T114500Z,azernews.az,English,Azerbaijan,fleet,D4_운송,2026-05-03,,0,HIGH,Shadow fleet tanker,1_Security
f4bbea883155c6b8e5f2a3fcf5abda0c,Sarv Shakti becomes first India - linked LPG tanker to cross Hormuz amid blockade,https://www.siasat.com/sarv-shakti-becomes-first-india-linked-lpg-tanker-to-cross-hormuz-amid-blockade-3464102/,20260503T113000Z,siasat.com,English,India,Strait of Hormuz,D1_초크포인트,2026-05-03,,0,HIGH,Hormuz transit blockade,7_Shipping
bee23691dd17363978f29946279b6e70,Iran humiliates US as  HUGE  supertanker breaks blockade carrying 1 . 9 million barrels bound for China,https://www.bankingnews.gr/diethni/articles/872548/iran-humiliates-us-as-huge-supertanker-breaks-blockade-carrying-1-9-million-barrels-bound-for-china,20260503T113000Z,bankingnews.gr,English,Greece,Strait of Malacca,D1_초크포인트,2026-05-03,,0,HIGH,Iranian tanker blockade evasion,1_Security
cd3d58e940d7b20e64691b5663598435,"OPEC+ set to agree third oil output quota hike since Hormuz closure , sources say",https://www.thehindubusinessline.com/news/world/opec-set-to-agree-third-oil-output-quota-hike-since-hormuz-closure-sources-say/article70934716.ece,20260503T110000Z,thehindubusinessline.com,English,India,crude oil,D2_품목,2026-05-03,,0,HIGH,OPEC+ output Hormuz,10_OtherIndustry
a3a2bd808e0078728c84e56f724e00e9,"Hormuz Blockade Depletes Reserves , Sparks Oil Crisis Fears  | Peak Oil News and Message Boards",https://peakoil.com/production/hormuz-blockade-depletes-reserves-sparks-oil-crisis-fears,20260503T104500Z,peakoil.com,English,United States,crude oil,D2_품목,2026-05-03,,0,HIGH,Hormuz blockade oil crisis,1_Security
266cee9d054882b7778def09bb6b2cbe,Kuwait exports zero barrels of oil for first time in 35 years,http://www.arabherald.com/news/279026994/kuwait-exports-zero-barrels-of-oil-for-first-time-in-35-years-monitor,20260503T104500Z,arabherald.com,English,Syria,crude oil,D2_품목,2026-05-03,,0,HIGH,Kuwait oil exports,4_PortCargo
604ae26514eee24b12eff17ce99d1768,Ukraine hits key Russian oil - loading port and 2  shadow fleet  tankers – Winnipeg Free Press,https://www.winnipegfreepress.com/world/2026/05/03/ukraine-hits-key-russian-oil-loading-port-and-2-shadow-fleet-tankers,20260503T100000Z,winnipegfreepress.com,English,Canada,fleet,D4_운송,2026-05-03,,0,HIGH,Russian oil port attack,1_Security
555036a43c2406fdc9f7caa03518a98a,"OPEC+ set to approve third supply increase since Hormuz disruption , sources say",https://economictimes.indiatimes.com/industry/energy/oil-gas/opec-set-to-approve-third-supply-increase-since-hormuz-disruption-sources-say/articleshow/130729692.cms,20260503T091500Z,economictimes.indiatimes.com,English,India,crude oil,D2_품목,2026-05-03,,0,HIGH,OPEC+ supply Hormuz,10_OtherIndustry
f242dea387e4f519828bdd035f4dc2d7,"Iranian Supertanker  HUGE  Evades US Navy Blockade , Delivers $220 Million Crude Oil Cargo to Asia - Pacific",https://openthemagazine.com/world/iranian-supertanker-huge-slips-past-us-navy-delivers-220-million-oil-cargo-to-asia-pacific,20260503T091500Z,openthemagazine.com,English,India,crude oil,D2_품목,2026-05-03,,0,HIGH,Iranian tanker Hormuz blockade,1_Security
b764af291b6b9a4ce36eaad793fe1e77,Iranian super tanker slips past US blockade with $220 million oil cargo,https://timesofindia.indiatimes.com/world/middle-east/iranian-super-tanker-slips-past-us-blockade-with-220-million-oil-cargo/articleshow/130728054.cms,20260503T081500Z,timesofindia.indiatimes.com,English,India,Strait of Hormuz,D1_초크포인트,2026-05-03,,0,HIGH,Tanker blockade evasion,1_Security
4dd07c8482965ca3f76e2476a721bfe0,"Iran tanker evades US blockade , reaches Asia Pacific , report says",https://www.middleeasteye.net/live-blog/live-blog-update/iran-tanker-evades-us-blockade-reaches-asia-pacific-report-says,20260503T073000Z,middleeasteye.net,English,Israel,crude oil,D2_품목,2026-05-03,,0,HIGH,Iran oil transit,1_Security
7c977c69f518406da680a0d718904694,"OPEC+ agrees to oil output quota hike amid Hormuz blockade , Kuwait oil exports zero",https://www.prokerala.com/news/articles/a1758125.html,20260503T071500Z,prokerala.com,English,India,Strait of Hormuz,D1_초크포인트,2026-05-03,,0,HIGH,Hormuz blockade oil,1_Security
b869c78005eb69ac36022fc80864beef,"Iranian supertanker carrying $220M of oil evades US blockade , says tracker",https://aa.com.tr/en/us-israel-iran-war/iranian-supertanker-carrying-220m-of-oil-evades-us-blockade-says-tracker/3925359,20260503T071500Z,aa.com.tr,English,Turkey,Strait of Malacca,D1_초크포인트,2026-05-03,,0,HIGH,Iranian tanker blockade evasion,1_Security
5dfe08e825124597fa51a2791e007629,"Iranian supertanker  HUGE  bypasses US blockade with USD 220 million oil cargo , says TankerTrackers",http://www.vietnamtribune.com/news/279026740/iranian-supertanker-huge-bypasses-us-blockade-with-usd-220-million-oil-cargo-says-tankertrackers,20260503T071500Z,vietnamtribune.com,English,Vietnam,Strait of Malacca,D1_초크포인트,2026-05-03,,0,HIGH,Iranian tanker blockade evasion,1_Security
3aa293122803f646a049d6b0a7c26d0b,"Gas Hits $4 . 43 , Surges 61 % Since December As Strait Of Hormuz Uncertainty Drives Fuel Prices Higher - Spi",https://www.benzinga.com/markets/commodities/26/05/52238058/gas-hits-4-43-strait-of-hormuz-uncertainty-drives-fuel-prices-higher,20260503T070000Z,benzinga.com,English,United States,Strait of Hormuz,D1_초크포인트,2026-05-03,,0,HIGH,Fuel price surge Hormuz,5_EconFinance
fdf29b1b05190cbe0351ca8e5c4464d2,"Iranian Super Tanker Evades US Blockade , Reaches Asia - Pacific",https://udaipurkiran.com/iranian-super-tanker-evades-us-blockade-reaches-asia-pacific/,20260503T061500Z,udaipurkiran.com,English,India,Strait of Malacca,D1_초크포인트,2026-05-03,,0,HIGH,Iranian tanker blockade evasion,1_Security
00a9940303db7fa7bf488d6b7512b657,World Largest Container Carrier Plans Route Avoiding Hormuz  | Peak Oil News and Message Boards,https://peakoil.com/production/worlds-largest-container-carrier-plans-route-avoiding-hormuz,20260503T061500Z,peakoil.com,English,United States,container,D2_품목,2026-05-03,,0,HIGH,Container carrier Hormuz avoidance,7_Shipping
98a64239e079eb903376e9e0a302c29b,No vessel can transit Strait of Hormuz without Iran permission : Iran army,https://www.orissapost.com/no-vessel-can-transit-strait-of-hormuz-without-irans-permission-irans-army/,20260503T060000Z,orissapost.com,English,India,Strait of Hormuz,D1_초크포인트,2026-05-03,,0,HIGH,Hormuz transit restriction,1_Security
372f3969c166ebbbef9c62f211db840c,US - Iran war has brought Malacca Strait into sharper focus,https://www.smh.com.au/world/asia/the-iran-war-has-brought-another-vital-shipping-lane-into-sharper-focus-20260429-p5zsc1.html,20260503T054500Z,smh.com.au,English,Australia,crude oil,D2_품목,2026-05-03,,0,HIGH,Malacca Strait geopolitical risk,1_Security
be96184f57d3bcf8a104431f5e289730,"US Warns Shipping Firms Over Hormuz Payments , Sanctions Threatened",https://www.el-balad.com/17002932,20260503T030000Z,el-balad.com,English,Egypt,petrochemical,D2_품목,2026-05-03,,0,HIGH,Hormuz sanctions enforcement,1_Security
b2cda203c22fcb9319110fee24405efe,Kuwait did not export crude oil in April for first time in 30 Years : Report,http://www.arabherald.com/news/279026476/kuwait-did-not-export-crude-oil-in-april-for-first-time-in-30-years-report,20260503T013000Z,arabherald.com,English,Syria,crude oil,D2_품목,2026-05-03,,0,HIGH,Kuwait oil export halt,4_PortCargo
43c40fbd4f929b5d7f606749b7962604,"Oil Prices Hit Wartime High as Iran Conflict Escalates : Brent Crude Surges Past $126 , Gas Prices Soar to $6 in California Amid Strait of Hormuz Blockade – NaturalNews . com",https://www.naturalnews.com/2026-05-02-oil-prices-hit-wartime-high-iran-conflict-escalates.html,20260503T010000Z,naturalnews.com,English,United States,Strait of Hormuz,D1_초크포인트,2026-05-03,,0,HIGH,Oil price surge Hormuz,5_EconFinance
365bf60f4218c82fefa929636b971154,Opec+ Agrees June Oil Output Hike as Hormuz Disrupts - Pakistan Today,https://www.pakistantoday.com.pk/2026/05/03/opec-agrees-third-oil-output-quota-hike-since-hormuz-closure,20260503T191500Z,pakistantoday.com.pk,English,Pakistan,Strait of Hormuz,D1_초크포인트,2026-05-03,,0,MEDIUM,OPEC+ output Hormuz,5_EconFinance
8d4cba68424507f15eb5cb0088c81763,  Taiwan Is Not for Sale : Tense files shadow Trump – Xi meeting,https://www.albawaba.com/news/taiwan-not-sale-tense-files-shadow-trump-1626692,20260503T191500Z,albawaba.com,English,Israel,rare earth,D2_품목,2026-05-03,,0,MEDIUM,Taiwan strait tension,1_Security
4eebcc0bce5f0e15c16c00ab1c318a75,Iran proposes an end to war within 30 days,https://www.wpxi.com/news/local/iran-proposes-an-end-war-within-30-days-trump-expresses-doubts/L36PHRVGUNBS3CVI4QZOG7Y7MA/,20260503T190000Z,wpxi.com,English,United States,Strait of Hormuz,D1_초크포인트,2026-05-03,,0,MEDIUM,Iran peace proposal,1_Security
ce3d12100cf7e24db6771ecf37ce6ddd,Iran war is accelerating America decline in Southeast Asia,https://www.sott.net/article/506087-Iran-war-is-accelerating-Americas-decline-in-Southeast-Asia,20260503T190000Z,sott.net,English,United States,disruption,D6_교란행위,2026-05-03,,0,MEDIUM,Iran-US tensions,1_Security
d433059adc5a07d5050cdaeee132ffb8,Iran conflict pushes US gas prices to all - time record highs this summer,https://www.foxbusiness.com/politics/national-average-gas-price-reaches-4-45-before-summer-driving-season,20260503T184500Z,foxbusiness.com,English,United States,Strait of Hormuz,D1_초크포인트,2026-05-03,,0,MEDIUM,US gas price surge,5_EconFinance
cf23f4b4c481f85c0e24d8babbe89615,Ukraine hits Russian tankers as both countries fire hundreds of drones in deadly spree,https://www.thejournal.ie/ukraine-and-russia-7030501-May2026/,20260503T184500Z,thejournal.ie,English,Ireland,fleet,D4_운송,2026-05-03,,0,MEDIUM,Tanker Strikes,1_Security
316bc8e17fd71fc7676591c23937a921,Iran weighs US response to peace plan after warning against military action,https://www.kten.com/news/iran-weighs-us-response-to-peace-plan-after-warning-against-military-action/article_4a2dc39b-9af2-5a21-8212-67eddc209151.html,20260503T184500Z,kten.com,English,United States,embargo,D6_교란행위,2026-05-03,,0,MEDIUM,Iran-US tensions,1_Security
7ede063e3907503a61573fe60fbae57e,"Russia , Saudi Arabia , other OPEC+ countries raising oil production for  market stability  ",https://wlos.com/news/nation-world/opec-countries-raising-oil-production-in-support-of-market-stability,20260503T180000Z,wlos.com,English,United States,Strait of Hormuz,D1_초크포인트,2026-05-03,,0,MEDIUM,OPEC production increase,5_EconFinance
9a9eb72903fb1767cd48dcaef23adc71,Kuwait : Oil Production Expected to Reach 2 . 628 Million bpd in June,https://english.aawsat.com/business/5269190-kuwait-oil-production-expected-reach-2628-million-bpd-june,20260503T180000Z,english.aawsat.com,English,Syria,Strait of Hormuz,D1_초크포인트,2026-05-03,,0,MEDIUM,Kuwait oil production,10_OtherIndustry
9a01e4daa6b2f0f9ee9d5d9c88df8f0e,OPEC Members Plan Modest Rise in Output,https://www.newser.com/story/388448/opec-members-plan-modest-rise-in-output.html,20260503T180000Z,newser.com,English,United States,Strait of Hormuz,D1_초크포인트,2026-05-03,,0,MEDIUM,OPEC output increase,5_EconFinance
6f4a264f9979dc93ae7e121cb87ee597,Are oil companies profiting from high prices amid the Iran war ? ,https://finance.yahoo.com/sectors/energy/articles/oil-companies-profiting-high-prices-205940173.html,20260503T180000Z,finance.yahoo.com,English,United States,Strait of Hormuz,D1_초크포인트,2026-05-03,,0,MEDIUM,Oil price profiteering,5_EconFinance
b9a36a7b42fe8b830e84df62b8e06c18,Iran says it is reviewing US response to proposal to end war,https://www.ynetnews.com/article/bjlelbrcwg,20260503T180000Z,ynetnews.com,English,Israel,Strait of Hormuz,D1_초크포인트,2026-05-03,,0,MEDIUM,Iran proposal review,1_Security
079d804613b3c114fd0cb49fa92e43a4,Iran says US military operation  impossible  as Trump mulls peace proposal,https://www.mtdemocrat.com/news/national/iran-says-us-military-operation-impossible-as-trump-mulls-peace-proposal/article_5665c501-e825-5199-9931-701db80a988a.html,20260503T180000Z,mtdemocrat.com,English,United States,Strait of Hormuz,D1_초크포인트,2026-05-03,,0,MEDIUM,Iran-US tensions,1_Security
8252bdc72ef566411e3d62f4525adb29,China orders companies to ignore US sanctions on oil refineries,https://news.az/news/china-orders-companies-to-ignore-us-sanctions-on-oil-refineries,20260503T180000Z,news.az,English,Azerbaijan,petrochemical,D2_품목,2026-05-03,,0,MEDIUM,China sanctions defiance,1_Security
e0ca753ae0af8863d9164fdf1761f701,Kyiv hits Russian oil sites as eight killed in both countries,https://www.elkharttruth.com/news/national/kyiv-hits-russian-oil-sites-as-eight-killed-in-both-countries/article_32e6ffc7-5c75-502f-9f83-401e3b918417.html,20260503T180000Z,elkharttruth.com,English,United States,fleet,D4_운송,2026-05-03,,0,MEDIUM,Energy infrastructure attack,10_OtherIndustry
