url_hash,title,url,seendate,domain,language,sourcecountry,query_keyword,query_group,collect_date,kg_entities,kg_match_count,relevance,topic,category
1d0f77c18e354cd41e1fc136be495b3b,"US warns Iran Hormuz blockade may be its  last act  after Russia , China veto UN resolution",https://aa.com.tr/en/middle-east/us-warns-irans-hormuz-blockade-may-be-its-last-act-after-russia-china-veto-un-resolution/3896533,20260407T191500Z,aa.com.tr,English,Turkey,Strait of Hormuz,D1_초크포인트,2026-04-07,,0,HIGH,Hormuz blockade threat,1_Security
606a74b38233cab75c1762a6d5efd13a,Russia and China veto UN resolution on Strait of Hormuz reopening,https://www.chroniclelive.co.uk/news/world-news/russia-china-veto-un-resolution-33729674,20260407T191500Z,chroniclelive.co.uk,English,United Kingdom,Strait of Hormuz,D1_초크포인트,2026-04-07,,0,HIGH,Hormuz closure geopolitics,1_Security
51c49b0b93d79df0a696a190890c41fc,Russia and China veto UN Security Council vote on Strait of Hormuz,https://www.gazetaexpress.com/en/Russia-and-China-veto-UN-Security-Council-vote-on-Strait-of-Hormuz/,20260407T191500Z,gazetaexpress.com,English,Kosovo,Strait of Hormuz,D1_초크포인트,2026-04-07,,0,HIGH,Russia China veto Hormuz,1_Security
922155792456614fe33a958ee333799b,"Fertilizer Prices Are Surging , and Food Costs Could Be Next . Why the Iran Energy Shock Runs Much Deeper Than Your Gas Bill",https://www.fool.com/investing/2026/04/07/fertilizer-prices-are-surging-and-food-costs-could/?source=iedfolrf0000001,20260407T191500Z,fool.com,English,United States,natural gas,D2_품목,2026-04-07,,0,HIGH,Fertilizer price surge,10_OtherIndustry
a5b04f8872c472e065b400e52cfc7f1d,U . S . strikes Kharg Island as Trump threatens to wipe out Iran bridges and power plants,https://www.wcsufm.org/latest-from-npr/2026-04-07/u-s-strikes-kharg-island-as-trump-threatens-to-wipe-out-irans-bridges-and-power-plants,20260407T191500Z,wcsufm.org,English,United States,Persian Gulf,D1_초크포인트,2026-04-07,,0,HIGH,US strikes Kharg Island,1_Security
e911f91d5f0172a0631d8ad8d32f08e6,Trump Threats Of Annihilating Iran Come With Promise To Seize Oil As  Spoils Of War  ,https://indiawest.com/trumps-threats-of-annihilating-iran-come-with-promise-to-seize-oil-as-spoils-of-war/,20260407T191500Z,indiawest.com,English,India,Iran military,D7_행위자,2026-04-07,,0,HIGH,Iran oil seizure threat,1_Security
beb13682b03fa395ee17f1149d2c8ef7,"Trump bizarre new plan for the Strait of Hormuz has the world reeling , he declares  were the winner  but the cost could be catastrophic",https://attackofthefanboy.com/politics/trumps-bizarre-new-plan-for-the-strait-of-hormuz-has-the-world-reeling-he-declares-were-the-winner-but-the-cost-could-be-catastrophic/,20260407T190000Z,attackofthefanboy.com,English,Japan,Strait of Hormuz,D1_초크포인트,2026-04-07,,0,HIGH,Hormuz passage threat,1_Security
ae82cd7633d7835bc3d0388b4d911367,"World News : Fuel prices could keep rising for months even if Hormuz reopens , US EIA says","https://www.gdnonline.com:443/Details/1380745/Fuel-prices-could-keep-rising-for-months-even-if-Hormuz-reopens,-US-EIA-says",20260407T190000Z,gdnonline.com,English,United States,Strait of Hormuz,D1_초크포인트,2026-04-07,,0,HIGH,Fuel price outlook,5_EconFinance
d9993956bd71c1a0c6cc48659607485d,Trial by Fire : Fuel Tanker Explosions Imperil Critical Bridge Over Panama Canal,https://hotair.com/tree-hugging-sister/2026/04/07/trial-by-fire-fuel-tanker-explosions-imperil-critical-bridge-over-panama-canal-n3813639,20260407T190000Z,hotair.com,English,United States,Panama Canal,D1_초크포인트,2026-04-07,,0,HIGH,Panama Canal disruption,1_Security
64a5f7a592280d03d2db5224aff2415b,Iran vows to take control of key Bab el - Mandeb Strait amid Trump annihilation threat,https://nypost.com/2026/04/07/world-news/iran-vows-to-take-control-of-key-bab-el-mandeb-strait-amid-trump-annihilation-threat/,20260407T184500Z,nypost.com,English,United States,Strait of Hormuz,D1_초크포인트,2026-04-07,,0,HIGH,Iran Bab el-Mandeb control,1_Security
12cce036e987ed8b571090c652fb10d4,"Iran war : IOC , BPCL , HPCL may have lost Rs 6 / litre on diesel in Q4",https://economictimes.indiatimes.com/industry/energy/oil-gas/iran-war-ioc-bpcl-hpcl-may-have-lost-rs-6/litre-on-diesel-in-q4/articleshow/130094759.cms,20260407T184500Z,economictimes.indiatimes.com,English,India,crude oil,D2_품목,2026-04-07,,0,HIGH,Korea refiner losses,10_OtherIndustry
2b1390a30c578ddbf62a4bbfb732590a,Bridge over Panama Canal closed after a truck explosion kills 1 person – Winnipeg Free Press,https://www.winnipegfreepress.com/business/2026/04/07/bridge-over-panama-canal-closed-after-a-truck-explosion-kills-1-person,20260407T184500Z,winnipegfreepress.com,English,Canada,Panama Canal,D1_초크포인트,2026-04-07,,0,HIGH,Panama Canal disruption,1_Security
8702b64cea5af599c08ddcda22286545,Iran war news : Fuel prices could rise after Strait of Hormuz reopens,https://www.bnnbloomberg.ca/business/2026/04/07/fuel-prices-could-keep-rising-for-months-after-strait-of-hormuz-reopens-us-eia-says/,20260407T183000Z,bnnbloomberg.ca,English,Canada,Strait of Hormuz,D1_초크포인트,2026-04-07,,0,HIGH,Hormuz strait reopening,1_Security
d63465ede09082cc0ff6285433357de4,"After Hormuz , Will Iran Close Another Key Strait ? ",https://www.gulte.com/world/404827/after-hormuz-will-iran-close-another-key-strait,20260407T174500Z,gulte.com,English,India,Strait of Hormuz,D1_초크포인트,2026-04-07,,0,HIGH,Strait closure risk,1_Security
d765aab27b3ecbfbabb0eb695fc9d9a6,"Stopgap measures arent enough to halt rising prices as the world scrambles for more oil | News , Sports , Jobs",https://www.heraldextra.com/top-headlines/2026/apr/07/stopgap-measures-arent-enough-to-halt-rising-prices-as-the-world-scrambles-for-more-oil/,20260407T174500Z,heraldextra.com,English,United States,Persian Gulf,D1_초크포인트,2026-04-07,,0,HIGH,Global oil price surge,5_EconFinance
f9add787be5e8e3e9a2ce3939eccc60b,"China , Russia veto UNSC resolution to open Strait of Hormuz by force",https://tribune.com.pk/story/2601541/china-russia-veto-unsc-resolution-to-open-strait-of-hormuz-by-force,20260407T173000Z,tribune.com.pk,English,Pakistan,Strait of Hormuz,D1_초크포인트,2026-04-07,,0,HIGH,China Russia veto Hormuz,1_Security
90a9320031afda02a259124e07ef694e,"Russia , China Veto UN Resolution On Reopening Strait Of Hormuz Amid West Asia War",https://www.freepressjournal.in/world/russia-china-veto-un-resolution-on-reopening-strait-of-hormuz-amid-west-asia-war,20260407T171500Z,freepressjournal.in,English,India,Strait of Hormuz,D1_초크포인트,2026-04-07,,0,HIGH,Hormuz diplomatic deadlock,1_Security
1d1771141d1bdbab045fd07407b61295,"Russia , China veto UN resolution aimed at reopening Hormuz strait",https://www.dailysabah.com/world/russia-china-veto-un-resolution-aimed-at-reopening-hormuz-strait/news,20260407T171500Z,dailysabah.com,English,Turkey,Strait of Hormuz,D1_초크포인트,2026-04-07,,0,HIGH,Hormuz diplomatic deadlock,1_Security
6b38e0f28040091ca62cbd68227a1c9e,Huge explosion at Panama Canal Bridge of the Americas leaves one dead and multiple injured,https://www.independent.co.uk/news/world/americas/panama-canal-bridge-of-americas-explosion-b2952852.html,20260407T171500Z,independent.co.uk,English,United Kingdom,Panama Canal,D1_초크포인트,2026-04-07,,0,HIGH,Panama Canal disruption,1_Security
a070d7cf17200516f22edfe33fabce1f,Russia and China veto UN resolution on Strait of Hormuz before Trump deadline,https://www.dailystar.co.uk/news/world-news/russia-china-veto-un-resolution-36981068,20260407T170000Z,dailystar.co.uk,English,United Kingdom,Strait of Hormuz,D1_초크포인트,2026-04-07,,0,HIGH,Hormuz diplomatic deadlock,1_Security
bd469dd92685bb18df22805b3461f06d,"US - Israeli strikes hit Iran Kharg island , bridges , key highway and railway",https://www.naharnet.com:443/stories/en/319386-us-israeli-strikes-hit-iran-s-kharg-island-bridges-key-highway-and-railway,20260407T170000Z,naharnet.com,English,Syria,terminal,D3_인프라,2026-04-07,,0,HIGH,US-Israeli strikes Iran,1_Security
84904a30f9dab2e38f3f1a73e9edef4f,VIDEO : Massive Explosion at the Panama Canal Amid Tension with China,https://pjmedia.com/sarah-anderson/2026/04/07/massive-explosion-at-the-panama-canal-amid-tension-with-china-n4951534,20260407T170000Z,pjmedia.com,English,United States,Panama Canal,D1_초크포인트,2026-04-07,,0,HIGH,Panama Canal disruption,1_Security
5d03fbb8879819eab7dd77abc56331d9,US hits military targets on Iran Kharg Island,https://www.marinecorpstimes.com/news/pentagon-congress/2026/04/07/us-hits-military-targets-on-irans-kharg-island/,20260407T164500Z,marinecorpstimes.com,English,United States,terminal,D3_인프라,2026-04-07,,0,HIGH,US strikes Iran,1_Security
a805edf12d7f2b5a1985dccf07acc0a3,Russia and China veto watered - down UN resolution aimed at reopening the Strait of Hormuz,https://www.news4jax.com/news/politics/2026/04/07/un-to-vote-on-watered-down-resolution-to-open-the-strait-of-hormuz-russia-and-china-are-key/,20260407T163000Z,news4jax.com,English,United States,Strait of Hormuz,D1_초크포인트,2026-04-07,,0,HIGH,Hormuz reopening negotiation,1_Security
3d5fda3da66975dfe231c27784f58266,Russia and China BLOCK reopening of Strait of Hormuz in dramatic UN vote,https://www.mirror.co.uk/news/world-news/russia-china-strait-hormuz-iran-36980914,20260407T163000Z,mirror.co.uk,English,United Kingdom,Strait of Hormuz,D1_초크포인트,2026-04-07,,0,HIGH,Hormuz diplomatic blockade,1_Security
417d2185ad9efb06caf19304afff6595,China and Russia veto UN resolution to reopen the Strait of Hormuz,https://www.kens5.com/article/news/nation-world/attack-on-iran/china-russia-veto-reopen-strait-of-hormuz-united-nations/507-dc1526e3-9f4d-422c-9da6-06dddc06c8fc,20260407T163000Z,kens5.com,English,United States,Strait of Hormuz,D1_초크포인트,2026-04-07,,0,HIGH,Hormuz closure geopolitics,1_Security
c3d5fbce0dcb582927d5d40dbbc2de80,"Strait of Hormuz : Iran war latest : Last hope gone ? Russia , China exercise veto against UN resolution at reopening of Strait of Hormuz",https://economictimes.indiatimes.com/news/international/us/iran-war-latest-last-hope-gone-russia-china-exercise-veto-against-un-resolution-at-reopening-of-strait-of-hormuz/articleshow/130091534.cms,20260407T163000Z,economictimes.indiatimes.com,English,India,Strait of Hormuz,D1_초크포인트,2026-04-07,,0,HIGH,Hormuz closure geopolitics,1_Security
a102eeb5e550e9428a3be24e4a4b7185,"Strait of Hormuz , head of the International Energy Agency : Situation more serious than in 1973 , 1979 and 2022",https://www.gazetaexpress.com/en/Strait-of-Hormuz-head-of-the-International-Energy-Agency-situation-more-serious-than-1973-1979-and-2022/,20260407T163000Z,gazetaexpress.com,English,Kosovo,Strait of Hormuz,D1_초크포인트,2026-04-07,,0,HIGH,Hormuz disruption severity,1_Security
3a26e409b9d6820af9a79823dbb4685c,Tracking Trump threats and deadlines to reopen the Strait of Hormuz,https://www.foxnews.com/politics/timeline-trumps-escalating-deadlines-on-iran-and-the-strait-hormuz,20260407T163000Z,foxnews.com,English,United States,Strait of Hormuz,D1_초크포인트,2026-04-07,,0,HIGH,Hormuz passage threat,1_Security
ac63012420683a1bbf25cd964ec3e412,IEA : World faces most unprecedented energy crisis – Shafaqna English | International Shia News & Fatwas,https://en.shafaqna.com/445815/iea-world-faces-most-unprecedented-energy-crisis/,20260407T163000Z,en.shafaqna.com,English,Saudi Arabia,Strait of Hormuz,D1_초크포인트,2026-04-07,,0,HIGH,Energy crisis,10_OtherIndustry
afabe600cf4c52280e1697b72e7c77a3,US Israeli Attack On Iran Kharg Island | US - Israeli strikes hit Iran Kharg island : media,https://www.thedailystar.net/news/world/us-israel-war-iran/news/us-israeli-strikes-hit-irans-kharg-island-media-4145831,20260407T163000Z,thedailystar.net,English,Bangladesh,terminal,D3_인프라,2026-04-07,,0,HIGH,Iran infrastructure attack,1_Security
e211fac9ad358b57662943045d5135d3,US - Israeli strikes hit Iran Kharg island : media,https://www.bssnews.net/international/375458,20260407T163000Z,bssnews.net,English,Bangladesh,terminal,D3_인프라,2026-04-07,,0,HIGH,Iran infrastructure attack,1_Security
a049372b284f0a61a2839a59bd9f0fd6,Nymex Overview : Petroleum Futures Prices Climbing as Hopes Fade for Deal With Iran -- OPIS,https://www.marketscreener.com/news/nymex-overview-petroleum-futures-prices-climbing-as-hopes-fade-for-deal-with-iran-opis-ce7e51d3d088f623,20260407T163000Z,marketscreener.com,English,,crude oil,D2_품목,2026-04-07,,0,HIGH,Oil prices Iran,5_EconFinance
72f9180d74d91559390d5acf1e00d7e6,US strikes Iran Kharg Island in Persian Gulf as Trump deadline looms,https://www.washingtonexaminer.com/watch/2553876/,20260407T163000Z,washingtonexaminer.com,English,United States,Persian Gulf,D1_초크포인트,2026-04-07,,0,HIGH,US strikes Iran Kharg Island,1_Security
4348bf00ce122dc7a729d2c5ccade226,Global Oil Price hits $115 per barrel amid US - Israeli Strikes on Iran Kharg Island,https://pakobserver.net/global-oil-price-hits-115-per-barrel-amid-us-israeli-strikes-on-irans-kharg-island/,20260407T163000Z,pakobserver.net,English,Pakistan,Persian Gulf,D1_초크포인트,2026-04-07,,0,HIGH,Oil price spike Kharg attack,5_EconFinance
1b7a847bce5255309b126e7b524d621d,"Iran has attacked Saudi Arabia Jubail petrochemical complex , IRGC says",https://www.yahoo.com/news/articles/iran-attacked-saudi-petrochemical-complex-095638414.html,20260407T163000Z,yahoo.com,English,United States,petrochemical,D2_품목,2026-04-07,,0,HIGH,Iran Saudi attack,10_OtherIndustry
f1d66e76eb518efaa3aec4d9a72057da,What Is The Significance Of Al Jubail ? Saudi Arabia Industrial Hub Powering 7 % Of GDP Comes Under Iranian Attack,https://www.newsx.com/world/what-is-the-significance-of-al-jubail-saudi-arabias-industrial-hub-powering-7-of-gdp-comes-under-iranian-attack-195370/,20260407T161500Z,newsx.com,English,India,petrochemical,D2_품목,2026-04-07,,0,HIGH,Jubail hub significance,10_OtherIndustry
59b3ae5a3479b1d1b38f0832f59be28d,"Russia , China veto UN resolution to reopen Strain of Hormuz",https://www.ocregister.com/2026/04/07/un-strait-of-hormuz-resolution/,20260407T160000Z,ocregister.com,English,United States,Strait of Hormuz,D1_초크포인트,2026-04-07,,0,HIGH,Hormuz diplomatic deadlock,1_Security
f5789e722dbba0cb0aa7940e07db8382,Russia and China veto watered - down UN resolution aimed at reopening the Strain of Hormuz,https://www.clickondetroit.com/news/politics/2026/04/07/un-to-vote-on-watered-down-resolution-to-open-the-strait-of-hormuz-russia-and-china-are-key/,20260407T160000Z,clickondetroit.com,English,United States,Strait of Hormuz,D1_초크포인트,2026-04-07,,0,HIGH,Hormuz reopening negotiation,1_Security
af65b3b98f15956b55a29d73590232e5,US strikes Iran Kharg Island as Trump threatens  whole civilization  - AL - MONITOR : The Middle Eastʼs leading independent since 2012,https://www.al-monitor.com/originals/2026/04/us-strikes-irans-kharg-island-trump-threatens-whole-civilization,20260407T160000Z,al-monitor.com,English,Israel,Strait of Hormuz,D1_초크포인트,2026-04-07,,0,HIGH,US-Iran military,1_Security
1bf73505094b8f588792d6dd00cc6056,Explosions rock Iran Kharg Island after US - Israeli strikes : Media,https://aa.com.tr/en/middle-east/explosions-rock-iran-s-kharg-island-after-us-israeli-strikes-media/3896128,20260407T160000Z,aa.com.tr,English,Turkey,terminal,D3_인프라,2026-04-07,,0,HIGH,Iran infrastructure attack,1_Security
c8216ea171019ae7fdffba6f908fd14e,Timeline : Developments after Trump initial Hormuz deadline to Iran,https://aa.com.tr/en/middle-east/timeline-developments-after-trump-s-initial-hormuz-deadline-to-iran/3896385,20260407T160000Z,aa.com.tr,English,Turkey,Persian Gulf,D1_초크포인트,2026-04-07,,0,HIGH,Hormuz strait blockade threat,1_Security
01302da23560772d260809cc10a4baa6,Markets Wary As Hormuz Deadline Looms,https://www.finanznachrichten.de/nachrichten-2026-04/68138391-markets-wary-as-hormuz-deadline-looms-020.htm,20260407T154500Z,finanznachrichten.de,English,Germany,crude oil,D2_품목,2026-04-07,,0,HIGH,Hormuz deadline,1_Security
5dfb36e3a5535c835c63a95b7075b286,U . S . Strikes Iranian Military Targets in Kharg Island as Trump Deadline Approaches,https://legalinsurrection.com/2026/04/u-s-strikes-iranian-military-targets-in-kharg-island-as-trumps-deadline-approaches/,20260407T154500Z,legalinsurrection.com,English,United States,Persian Gulf,D1_초크포인트,2026-04-07,,0,HIGH,Iran oil infrastructure attack,1_Security
c7c9bba0d40327f97c0da0f522491c37,Iran attack on Saudi Arabia giant Jubail petrochem complex adds to global supply risk,https://seekingalpha.com/news/4572992-irans-attack-on-saudi-arabias-giant-jubail-petrochem-complex-adds-to-global-supply-risk,20260407T153000Z,seekingalpha.com,English,United States,crude oil,D2_품목,2026-04-07,,0,HIGH,Iran attack supply risk,10_OtherIndustry
60f4084f9095566b69929fad3d7f7c55,UN to vote on watered - down resolution to open the Strait of Hormuz,https://www.baltimoresun.com/2026/04/07/un-strait-of-hormuz-resolution/,20260407T151500Z,baltimoresun.com,English,United States,Strait of Hormuz,D1_초크포인트,2026-04-07,,0,HIGH,Hormuz reopening negotiation,1_Security
5aba30a075c0a390e3884b3191215bff,Iran promises regional war in response to Trump threat :  Restraint has come to an end  ,https://www.rawstory.com/iran-war-2676674050/,20260407T151500Z,rawstory.com,English,United States,Strait of Hormuz,D1_초크포인트,2026-04-07,,0,HIGH,Iran regional war,1_Security
7bc4279be3a27794bb1b9d8bfd6b24f2,US markets fall and oil prices jump again as Trump deadline for Iran to reopen oil route nears,https://www.stcatharinesstandard.ca/business/asian-shares-are-mixed-ahead-of-trumps-deadline-for-iran-to-reopen-oil-route/article_074aa648-9576-59e5-b89b-9b9767721388.html,20260407T150000Z,stcatharinesstandard.ca,English,Canada,Brent crude,D5_시장지표,2026-04-07,,0,HIGH,Hormuz oil route closure,1_Security
86cb21c89fa6f9d8b353656ef6b7e512,FinancialContent - Crudewatch 2026 : Oil Rockets to $110 as Trump Deadline Looms over Strait of Hormuz Blockade,https://markets.financialcontent.com/stocks/article/marketminute-2026-4-7-crudewatch-2026-oil-rockets-to-110-as-trump-deadline-looms-over-strait-of-hormuz-blockade,20260407T144500Z,markets.financialcontent.com,English,United States,Persian Gulf,D1_초크포인트,2026-04-07,,0,HIGH,Oil price surge Hormuz blockade,5_EconFinance
790f1652fb61ef8a27869c3a3f1ddedc,"Container Vessel Hit by Projectile South of Iran Kish Island , Crew Safe , UKMTO Says",https://gcaptain.com/container-vessel-hit-by-projectile-south-of-irans-kish-island-crew-safe-ukmto-says/,20260407T144500Z,gcaptain.com,English,United States,container,D2_품목,2026-04-07,,0,HIGH,Vessel Attack,1_Security
bb37b56f43d22369d9bf2b859da99f62,UN to vote on watered - down resolution to open the Strait of Hormuz . Russia and China are key,https://www.seattletimes.com/business/un-to-vote-on-watered-down-resolution-to-open-the-strait-of-hormuz-russia-and-china-are-key/,20260407T143000Z,seattletimes.com,English,United States,Strait of Hormuz,D1_초크포인트,2026-04-07,,0,HIGH,Hormuz reopening negotiation,1_Security
9037c8eca1fbab5f0ca02843c3ec4e71,Dow drops over 200 points as Iran deal doubts grow ahead of Trump deadline ; oil tops $110,https://www.moneycontrol.com/world/dow-drops-over-200-points-as-iran-deal-doubts-grow-ahead-of-trump-deadline-oil-tops-110-article-13882670.html,20260407T143000Z,moneycontrol.com,English,India,Strait of Hormuz,D1_초크포인트,2026-04-07,,0,HIGH,Oil price surge,5_EconFinance
c36bf04889fadff05149b15a8e6b4174,West Asia Conflict : GAIL inks long - term charter party agreement for LNG carrier,https://www.thehindubusinessline.com/companies/west-asia-conflict-gail-inks-long-term-charter-party-agreement-for-lng-carrier/article70834720.ece,20260407T143000Z,thehindubusinessline.com,English,India,natural gas,D2_품목,2026-04-07,,0,HIGH,India LNG carrier charter,7_Shipping
8eeb59a38f81648f773fb3fad750e03d,"U . S ., Israel Strike Iran Oil Export Hubs Ahead of Trump Deadline",https://oilprice.com/Energy/Energy-General/US-Israel-Strike-Irans-Oil-Export-Hubs-Ahead-of-Trump-Deadline.html,20260407T143000Z,oilprice.com,English,United States,Persian Gulf,D1_초크포인트,2026-04-07,,0,HIGH,US Israel oil hub strikes,1_Security
74b42b0aeaa436183348c5180e65515c,BREAKING : US Pounds Kharg Island Ahead of Trump Deadline ; Update : Fractures ? ,https://hotair.com/ed-morrissey/2026/04/07/breaking-us-pounds-kharg-island-ahead-of-trumps-deadline-n3813638,20260407T143000Z,hotair.com,English,United States,blockade,D6_교란행위,2026-04-07,,0,HIGH,Kharg Island attack,1_Security
b98a32d0fc399f0369daddd5f9feb916,Stopgap measures arent enough to halt rising prices as the world scrambles for more oil,https://isp.netscape.com:443/pf/story/0001/20260407/cbb0d63ed7242b15a0e16586719a4aa1,20260407T141500Z,isp.netscape.com,English,United States,Persian Gulf,D1_초크포인트,2026-04-07,,0,HIGH,Global oil price surge,5_EconFinance
a31f4aa22aec1a8c2916a92e956d570b,"Remaining Malaysian ships to transit Strait of Hormuz in stages , says Iranian ambassador",https://www.theborneopost.com/2026/04/07/remaining-malaysian-ships-to-transit-strait-of-hormuz-in-stages-says-iranian-ambassador/,20260407T140000Z,theborneopost.com,English,Malaysia,Strait of Hormuz,D1_초크포인트,2026-04-07,,0,HIGH,Hormuz transit resumption,7_Shipping
a2fa60fcb10e071015e4cf4da27bd4e5,"Trump Strikes Kharg Island , Oil Surges Past $115 Is $130 Next ? - United States Oil Fund ( ARCA : USO ) ",https://www.benzinga.com/markets/commodities/26/04/51677688/iran-kharg-island-strikes-oil-price-130-trump-2026,20260407T140000Z,benzinga.com,English,United States,Persian Gulf,D1_초크포인트,2026-04-07,,0,HIGH,Kharg Island strike oil surge,5_EconFinance
7597b6fb989d06a9ca66199c7beca4fd,Container Ship Damage Near Iran Coast Raises 3 Questions About Gulf Risk,https://www.el-balad.com/16904976,20260407T140000Z,el-balad.com,English,Egypt,container,D2_품목,2026-04-07,,0,HIGH,Container ship damage Iran,1_Security
2b0f417cb5c4c7cbb5c2b6a858ea911f,Trump threatens strikes if Iran misses deadline to reopen Strait of Hormuz,https://www.retailgazette.co.uk/blog/2026/04/us-deadline-strait-of-hormuz/,20260407T140000Z,retailgazette.co.uk,English,United Kingdom,grain,D2_품목,2026-04-07,,0,HIGH,Hormuz strait threat,1_Security
9395dd485dff9bc7d62bde9b3722c957,"  If you start a war , you wont be able to finish it : Iran envoy warns US against targeting infrastructure",https://www.tribuneindia.com/news/world/if-you-start-a-war-you-wont-be-able-to-finish-it-iran-envoy-warns-us-against-targeting-infrastructure/,20260407T134500Z,tribuneindia.com,English,India,Iran military,D7_행위자,2026-04-07,,0,HIGH,Iran infrastructure threat,1_Security
d4539e7b132b38b05e0ec81deb6be2a9,"  New phase of war begin : Iran escalates missile threat , says  all previous strikes are multiplied by two  ",https://www.moneycontrol.com/world/new-phase-of-war-begins-iran-escalates-missile-threat-says-all-previous-strikes-are-multiplied-by-two-article-13882599.html,20260407T130000Z,moneycontrol.com,English,India,Persian Gulf,D1_초크포인트,2026-04-07,,0,HIGH,Iran missile escalation,1_Security
4318119886e172bb4095d84ddf1ff281,"US strikes Iran oil - critical Kharg Island , regime threatens  restraint is over  ",https://nypost.com/2026/04/07/world-news/us-strikes-irans-oil-critical-kharg-island-regime-threatens-restraint-is-over/,20260407T130000Z,nypost.com,English,United States,Persian Gulf,D1_초크포인트,2026-04-07,,0,HIGH,Kharg Island oil strike,1_Security
8684232ac73c684d026877b06360b7cc,Iran Kharg Island Attacked Amid US Ultimatum Deadline,https://www.newkerala.com/news/a/irans-critical-oil-hub-kharg-island-comes-under-579.htm,20260407T130000Z,newkerala.com,English,India,Persian Gulf,D1_초크포인트,2026-04-07,,0,HIGH,Kharg Island attack,1_Security
884e26957c9356f7ea2388c28ac73553,"Iran says it struck energy and industrial infrastructure in Israel , UAE and Kuwait",https://www.middleeasteye.net/live-blog/live-blog-update/iran-says-it-struck-energy-and-industrial-infrastructure-israel-uae-and,20260407T130000Z,middleeasteye.net,English,Israel,petrochemical,D2_품목,2026-04-07,,0,HIGH,Iran energy strikes,10_OtherIndustry
9ec5d38b721c4c6b75bec1d60a4d4a50,"Iranian strikes hit Saudi Arabia industrial hub , trigger fires in Jubail",https://pakobserver.net/iranian-strikes-hit-saudi-arabias-industrial-hub-trigger-fires-in-jubail/,20260407T130000Z,pakobserver.net,English,Pakistan,petrochemical,D2_품목,2026-04-07,,0,HIGH,Iran Saudi attack,10_OtherIndustry
2aa8cb857b8efdf2f8fadaf24e0c8bd9,"  Restraint Is Over … Neither Bases Nor Energy Will Remain : Iran Warns Of Strikes On U . S ., Allie Infrastructure",https://www.freepressjournal.in/world/restraint-is-over-neither-bases-nor-energy-will-remain-iran-warns-of-strikes-on-us-allies-infrastructure,20260407T124500Z,freepressjournal.in,English,India,terminal,D3_인프라,2026-04-07,,0,HIGH,Iran military threat,1_Security
f685225bb70364a86ea2f6ec079d53cd,"Gulf Official : Iran Reverses Course , Bars Oil Tankers Through Hormuz Strait After Israel Strikes Petrochemical Complex",https://www.haaretz.com/middle-east-news/iran/2026-04-07/ty-article/.premium/source-iran-bars-tankers-from-hormuz-strait-after-israeli-petrochemical-strikes/0000019d-66c8-d68a-a39d-67fba00b0000,20260407T124500Z,haaretz.com,English,Israel,petrochemical,D2_품목,2026-04-07,,0,HIGH,Hormuz tanker blockade,1_Security
49dc4e869f5e349a64ca409539e7324d,Baltic Dry Index climbs to 2095 up 29 points | Hellenic Shipping News Worldwide,https://www.hellenicshippingnews.com/baltic-dry-index-climbs-to-2095-up-29-points/,20260407T124500Z,hellenicshippingnews.com,English,China,iron ore,D2_품목,2026-04-07,,0,HIGH,Freight rate surge,3_Freight
