url_hash,title,url,seendate,domain,language,sourcecountry,query_keyword,query_group,collect_date,kg_entities,kg_match_count,relevance,topic,category
1e925eddc0e39f263b5cf4eca45f8ad9,US directs 28 vessels to turn around under Iran port blockade : CENTCOM,https://www.middleeastmonitor.com/20260421-us-directs-28-vessels-to-turn-around-under-iran-port-blockade-centcom/,20260421T194500Z,middleeastmonitor.com,English,Israel,vessel,D4_운송,2026-04-21,,0,HIGH,Iran port blockade,1_Security
83710403eb548c4a55ffd4c1391f654c,Doubts Over Talks Between Iran and US After Violence in Strait of Hormuz,https://www.kxl.com/doubts-over-talks-between-iran-and-us-after-violence-in-strait-of-hormuz/,20260421T194500Z,kxl.com,English,United States,Brent crude,D5_시장지표,2026-04-21,,0,HIGH,"Iran-US talks, Hormuz violence",1_Security
3ae15310762d88e334932ef477897d46,"US Seizes Tanker Carrying Iranian Oil in Bay of Bengal , Turns Back Dozens of Ships in Strait of Hormuz",https://redstate.com/bobhoge/2026/04/21/us-seizes-tanker-carrying-iranian-oil-in-bay-of-bengal-turns-back-dozens-of-ships-in-strait-of-hormuz-n2201526,20260421T191500Z,redstate.com,English,United States,vessel,D4_운송,2026-04-21,,0,HIGH,Hormuz tanker seizure,1_Security
2a7d1743b0e358bf82fa4cc7e80c0bc2,U . S . forces board sanctioned oil tanker,https://www.oann.com/newsroom/u-s-forces-board-sanctioned-oil-tanker/,20260421T191500Z,oann.com,English,United States,tanker,D4_운송,2026-04-21,,0,HIGH,Tanker seizure,1_Security
9aa640f87bca8e3b2937822fd84c87d5,"Brent crude rises above USD 90 amid uncertainty over US - Iran talks , expected Pakistan meeting yet to take off",https://aninews.in/news/business/brent-crude-rises-above-usd-90-amid-uncertainty-over-us-iran-talks-expected-pakistan-meeting-yet-to-take-off20260421235132/,20260421T190000Z,aninews.in,English,India,Brent crude,D5_시장지표,2026-04-21,,0,HIGH,"Brent crude, Hormuz uncertainty",5_EconFinance
7f09128b07a4c58b54f8defb2b66dbc5,"Iran war could push world into a food  catastrophe , UN agency warns - National",https://globalnews.ca/news/11810510/global-food-catastrophe-iran-war/,20260421T181500Z,globalnews.ca,English,Canada,Strait of Hormuz,D1_초크포인트,2026-04-21,,0,HIGH,Iran war food crisis,10_OtherIndustry
6a42847590ab72b2cfe660160f229b9e,"Strait of Hormuz blockade : India , China alternate oil supply cushion fades as Russian crude on water runs low",https://timesofindia.indiatimes.com/business/india-business/strait-of-hormuz-blockade-india-chinas-alternate-oil-supply-cushion-fades-as-russian-crude-on-water-runs-low/articleshow/130421948.cms,20260421T171500Z,timesofindia.indiatimes.com,English,India,Strait of Hormuz,D1_초크포인트,2026-04-21,,0,HIGH,Hormuz blockade impact,1_Security
6c8a036da843288d467f0f5a91f254d0,Xi says for first time Strait of Hormuz should be reopened,https://article.wn.com/view/2026/04/21/Xi_says_for_first_time_Strait_of_Hormuz_should_be_reopened/,20260421T171500Z,article.wn.com,English,United States,Strait of Hormuz,D1_초크포인트,2026-04-21,,0,HIGH,Hormuz reopening call,1_Security
a504010f25432aab8d337073909863bb,Utah farmers feel economic strain as Iran war drives up fertilizer costs,https://www.ksl.com:443/article/news/business/utah-farmers-feel-economic-strain-as-iran-war-drives-up-fertilizer-costs/51485657,20260421T171500Z,ksl.com,English,United States,Strait of Hormuz,D1_초크포인트,2026-04-21,,0,HIGH,Fertilizer cost surge,10_OtherIndustry
435f1dc941fae235d9c55e2e72b3c76c,"U . S . Military Stops and Boards M / T Tifani , Tanker Carrying Iranian Oil , Pentagon Says",https://article.wn.com/view/2026/04/21/US_Military_Stops_and_Boards_M_T_Tifani_Tanker_Carrying_Iran/,20260421T171500Z,article.wn.com,English,United States,Strait of Hormuz,D1_초크포인트,2026-04-21,,0,HIGH,Tanker seizure Hormuz,1_Security
776a219921e1a1ec1a53f0f49911b565,Iran likely grip on Hormuz as part of deal spreads panic in Gulf,https://article.wn.com/view/2026/04/21/Irans_likely_grip_on_Hormuz_as_part_of_deal_spreads_panic_in/,20260421T171500Z,article.wn.com,English,United States,Strait of Hormuz,D1_초크포인트,2026-04-21,,0,HIGH,Iran Hormuz control,1_Security
983050961373c2f52990fe30cef8d996,Hormuz Is Already Escalating . U . S . Policy Still Isnt Catching Up,https://www.realclearworld.com/articles/2026/04/21/hormuz_is_already_escalating_us_policy_still_isnt_catching_up_1177996.html,20260421T171500Z,realclearworld.com,English,United States,shipping,D4_운송,2026-04-21,,0,HIGH,Hormuz escalation policy,1_Security
e6faaa34e1de30cc5f71e55c98449bf1,"Prabowo , Albanese discuss export of 250 , 000 tons of urea to Australia",https://en.antaranews.com/news/413196/prabowo-albanese-discuss-export-of-250000-tons-of-urea-to-australia,20260421T171500Z,en.antaranews.com,English,Indonesia,fertilizer,D2_품목,2026-04-21,,0,HIGH,Urea export disruption,10_OtherIndustry
317c61631bbc255c8e4013b8a3685fe9,"US forces board sanctioned vessel without incident , Pentagon says",https://article.wn.com/view/2026/04/21/US_forces_board_sanctioned_vessel_without_incident_Pentagon_/,20260421T171500Z,article.wn.com,English,United States,tanker,D4_운송,2026-04-21,,0,HIGH,US vessel boarding,1_Security
1fdd523ccfe1ff0a4bba5544fb8f9d8c,US seizes 2nd Iranian vessel in intl waters as truce deadline nears,https://article.wn.com/view/2026/04/21/US_seizes_2nd_Iranian_vessel_in_intl_waters_as_truce_deadlin/,20260421T171500Z,article.wn.com,English,United States,tanker,D4_운송,2026-04-21,,0,HIGH,US Iranian vessel seizure,1_Security
e6587457cf459a50ac371edcc29ac13d,US says it intercepted sanctioned oil vessel in Asia - Pacific,https://www.spacewar.com/afp/260421141617.gdu8vpw5.html,20260421T171500Z,spacewar.com,English,Iraq,Strait of Malacca,D1_초크포인트,2026-04-21,,0,HIGH,Sanctioned oil seizure,1_Security
f37382a6441f7236ca2bd674ef009f7d,"World Experiencing Its Worst Energy Crisis In History Due To Iran War , IEA Head Says",https://www.ibtimes.com/world-experiencing-its-worst-energy-crisis-history-due-iran-war-iea-head-says-3801644,20260421T170000Z,ibtimes.com,English,United States,Brent crude,D5_시장지표,2026-04-21,,0,HIGH,"Global energy crisis, Iran war",1_Security
4dd7dd0a81a69cd9b2ea06fd9d3dc0ab,Strait of Hormuz : US - Iran will end up with great deal - Trump,https://dailypost.ng/2026/04/21/strait-of-hormuz-us-iran-will-end-up-with-great-deal-trump/,20260421T170000Z,dailypost.ng,English,Nigeria,blockade,D6_교란행위,2026-04-21,,0,HIGH,"Hormuz strait, US-Iran deal",1_Security
54960548d5516146e6441fc26caebf02,Pakistan army chief tells Trump blockade of Iran hampering efforts to resume talks,https://www.globalsecurity.org/wmd/library/news/iran/2026/04/iran-260420-presstv09.htm,20260421T164500Z,globalsecurity.org,English,Syria,blockade,D6_교란행위,2026-04-21,,0,HIGH,"Iran blockade, Hormuz talks",1_Security
4fcb2024c680bb665d038c88e6e63c2e,"US warship allowed to pass through Malacca Strait , Navy says , amid Iran war concerns - Asia & Pacific",https://www.thejakartapost.com/world/2026/04/21/us-warship-allowed-to-pass-through-malacca-strait-navy-says-amid-iran-war-concerns.html,20260421T164500Z,thejakartapost.com,English,Indonesia,Strait of Malacca,D1_초크포인트,2026-04-21,,0,HIGH,Malacca Strait transit,7_Shipping
e08aefdef4b3d17fd0e3824fc42d800a,Russia Forced to Slash Oil Production After Ukrainian Strikes – Reuters,https://www.themoscowtimes.com/2026/04/21/russia-forced-to-slash-oil-production-after-ukrainian-strikes-reuters-a92560,20260421T151500Z,themoscowtimes.com,English,Russia,pipeline,D3_인프라,2026-04-21,,0,HIGH,Russian oil production,10_OtherIndustry
bd58b5f02dcacd6abe74a51bf01f5bb9,Tiny Iran - Linked Tanker Tests US Blockade With Arabian Sea Move,https://www.livemint.com/news/world/tiny-iran-linked-tanker-tests-us-blockade-with-arabian-sea-move-11776783160783.html,20260421T151500Z,livemint.com,English,India,Persian Gulf,D1_초크포인트,2026-04-21,,0,HIGH,Iran tanker blockade,1_Security
3032dd9cde9c2d8e124c3f510c123d5b,Iran Dark Fleet Vessels Slip Through Blockade -- - 2 - ,https://www.marketscreener.com/news/iran-dark-fleet-vessels-slip-through-blockade-2-ce7f59dbda8cf526,20260421T151500Z,marketscreener.com,English,,iron ore,D2_품목,2026-04-21,,0,HIGH,Iran tanker blockade,1_Security
ab2f8a9d2d06e32169643a755fe46ebc,"Trump says he does not want to extend truce as expiry nears , US seizes tanker",https://www.yahoo.com/news/articles/us-seizes-tanker-in-international-waters-as-iran-truce-deadline-nears-121424159.html,20260421T143000Z,yahoo.com,English,United States,tanker,D4_운송,2026-04-21,,0,HIGH,US tanker seizure Iran,1_Security
d76233a786f73a479fc4eed70041576a,Strait of Hormuz Closed Again After U . S . Maintains Blockade of Iranian Ports – NaturalNews . com,https://www.naturalnews.com/2026-04-21-hormuz-closed-again-after-us-maintains-blockade.html,20260421T141500Z,naturalnews.com,English,United States,Strait of Hormuz,D1_초크포인트,2026-04-21,,0,HIGH,Hormuz closure,1_Security
8ba392894c891295c23868b2298d0180,War is causing the biggest energy crisis in history : IEA,https://www.omanobserver.om/article/1188290/business/energy/war-is-causing-the-biggest-energy-crisis-in-history-iea,20260421T141500Z,omanobserver.om,English,Oman,natural gas,D2_품목,2026-04-21,,0,HIGH,Energy crisis IEA,10_OtherIndustry
0ade5762b1f0e380e52be6cb8c7bb87e,US forces board sanctioned oil tanker amid uncertainty over talks,https://article.wn.com/view/2026/04/21/US_forces_board_sanctioned_oil_tanker_amid_uncertainty_over_/,20260421T141500Z,article.wn.com,English,United States,tanker,D4_운송,2026-04-21,,0,HIGH,US tanker seizure,1_Security
fccf9cbcba104fd850e205089585c4fd,US seizes tanker in international waters as Iran truce deadline nears,https://www.thecitizen.co.tz/tanzania/news/international/us-seizes-tanker-in-international-waters-as-iran-truce-deadline-nears-5431152,20260421T133000Z,thecitizen.co.tz,English,Tanzania,tanker,D4_운송,2026-04-21,,0,HIGH,US tanker seizure,1_Security
2f382304c76f45c380fd791a717a50cc,"US forces board a sanctioned oil tanker in the Indian Ocean , the Pentagon says",https://mynorthwest.com/national/us-forces-board-a-sanctioned-oil-tanker-in-the-indian-ocean-the-pentagon-says/4230361,20260421T133000Z,mynorthwest.com,English,United States,tanker,D4_운송,2026-04-21,,0,HIGH,Tanker seizure,1_Security
c14135810f1bbfdf7872ce309fc8a075,Iran says tanker  Silly City  enters waters despite US naval blockade,https://www.moneycontrol.com/world/iran-says-tanker-silly-city-enters-waters-despite-us-naval-blockade-article-13895314.html,20260421T123000Z,moneycontrol.com,English,India,Strait of Hormuz,D1_초크포인트,2026-04-21,,0,HIGH,Hormuz tanker transit,1_Security
108c505c941cb03b82b6bbb13990e634,Crude oil prices jump from $63 to $116 amid West Asia crisis ; fuel supply remains stable : Petroleum Ministry,https://aninews.in/news/business/crude-oil-prices-jump-from-63-to-116-amid-west-asia-crisis-fuel-supply-remains-stable-petroleum-ministry20260421162908/,20260421T111500Z,aninews.in,English,India,natural gas,D2_품목,2026-04-21,,0,HIGH,Oil price surge,5_EconFinance
b6cec5409dd0bf13c3ce65d1b8fafeb8,"Tehran says Iranian oil tanker entered territorial waters despite US  warnings , threats  ",https://aa.com.tr/en/middle-east/tehran-says-iranian-oil-tanker-entered-territorial-waters-despite-us-warnings-threats/3913251,20260421T111500Z,aa.com.tr,English,Turkey,tanker,D4_운송,2026-04-21,,0,HIGH,Iranian tanker Hormuz,1_Security
b6b77835b1aa962e3794c58a830184a1,US - Israel War On Iran Creates Biggest Energy Crisis In,https://www.marinelink.com/news/usisrael-war-iran-creates-biggest-energy-538273,20260421T104500Z,marinelink.com,English,United States,natural gas,D2_품목,2026-04-21,,0,HIGH,Iran energy crisis,1_Security
6471a59b0bd7e6d1a5f46deb1058cdc3,Three Ships Including an Iranian Vessel Attempt Hormuz Transits,https://gcaptain.com/three-ships-including-an-iranian-vessel-attempt-hormuz-transits/,20260421T101500Z,gcaptain.com,English,United States,Persian Gulf,D1_초크포인트,2026-04-21,,0,HIGH,Hormuz transit,7_Shipping
4f119828809111ae7a17ab8ede1eaea0,Iranian tanker crosses into country waters with military support,https://www.trend.az/iran/4177105.html,20260421T101500Z,trend.az,English,Azerbaijan,tanker,D4_운송,2026-04-21,,0,HIGH,Iranian tanker transit,1_Security
8320732701136b33fa106c63d28bb897,"Iran parliament speaker : no talks under threat , warns of  new cards  if war resumes – Middle East Monitor",https://www.middleeastmonitor.com/20260421-iran-parliament-speaker-no-talks-under-threat-warns-of-new-cards-if-war-resumes/,20260421T101500Z,middleeastmonitor.com,English,Israel,blockade,D6_교란행위,2026-04-21,,0,HIGH,"Iran parliament, no talks under threat",1_Security
293adcd87ca36521f6b19e44018183a5,Captain stranded in the Strait of Hormuz speaks out on being trapped as missile and strikes occur around ships,https://www.abc.net.au/news/2026-04-21/stranded-in-the-strait-of-hormuz/106587880,20260421T093000Z,abc.net.au,English,Australia,Strait of Hormuz,D1_초크포인트,2026-04-21,,0,HIGH,Hormuz vessel stranded,1_Security
2abf2f3c7abb03b3ea37ee1fa5c9081d,"US warship passed through Malacca Strait , says Indonesian Navy",https://www.straitstimes.com/asia/se-asia/us-warship-passes-through-malacca-strait-indonesian-navy-says,20260421T093000Z,straitstimes.com,English,Singapore,Strait of Malacca,D1_초크포인트,2026-04-21,,0,HIGH,Malacca Strait passage,7_Shipping
c5f1a0edffad2e465d09e021ac5f492a,Iranian cargo ship  defies US blockade  in Strait of Hormuz amid oil price fears,https://www.dailystar.co.uk/news/latest-news/iranian-cargo-ship-defies-blockade-37045676,20260421T081500Z,dailystar.co.uk,English,United Kingdom,Strait of Hormuz,D1_초크포인트,2026-04-21,,0,HIGH,Hormuz transit risk,1_Security
dd481a4295c3a6a41ce81d63bfc0cd45,"US , Iran ceasefire nears expiry as Hormuz tensions cloud talks",http://africa.chinadaily.com.cn/a/202604/21/WS69e70e21a310d6866eb44a20.html,20260421T081500Z,africa.chinadaily.com.cn,English,China,Strait of Hormuz,D1_초크포인트,2026-04-21,,0,HIGH,Hormuz ceasefire tensions,1_Security
103e9998dfbb3cfa61e23f9dfe4a8460,UN agency prepares Hormuz evacuation plan for hundreds of ships,https://economictimes.indiatimes.com/industry/energy/oil-gas/un-agency-prepares-hormuz-evacuation-plan-for-hundreds-of-ships/articleshow/130411282.cms,20260421T081500Z,economictimes.indiatimes.com,English,India,Persian Gulf,D1_초크포인트,2026-04-21,,0,HIGH,Hormuz evacuation plan,1_Security
f7ae25b5a3eb769eae7f0e441ba91182,Iran pulling Hormuz  lever  to maximum in US standoff,https://dunyanews.tv/en/World/947083-iran-pulling-hormuz-lever-to-maximum-in-us-standoff,20260421T073000Z,dunyanews.tv,English,Pakistan,Strait of Hormuz,D1_초크포인트,2026-04-21,,0,HIGH,Hormuz leverage standoff,1_Security
e0f6c19267efe8db0d59748033629252,US seizes Iran - bound ship from China in Arabian Sea,https://www.wsws.org/en/articles/2026/04/21/jvzy-a21.html,20260421T073000Z,wsws.org,English,United States,Persian Gulf,D1_초크포인트,2026-04-21,,0,HIGH,Iran tanker seizure,1_Security
e9431f448a3c7d41244ed1ef8755c026,Iranian Foreign Ministry condemns US seizure of cargo ship in Gulf of Oman,https://aa.com.tr/en/americas/iranian-foreign-ministry-condemns-us-seizure-of-cargo-ship-in-gulf-of-oman/3912853,20260421T070000Z,aa.com.tr,English,Turkey,vessel,D4_운송,2026-04-21,,0,HIGH,Iran cargo seizure,1_Security
da312c2cf738f9d81d859e3a695757bb,"US Seizes Iranian Ship , Iran Talks in Doubt Amid Rising Tensions",https://dailypioneer.com/news/us-seizes-iranian-ship-as-trump-pushes-for-peace,20260421T070000Z,dailypioneer.com,English,India,seizure,D6_교란행위,2026-04-21,,0,HIGH,Iranian ship seizure,1_Security
42deb4fdc24487e1144e2ad2150f3a89,"Iran urges UN action over  barbarou US seizure , says crew families threatened",https://www.middleeasteye.net/live-blog/live-blog-update/iran-urges-un-action-over-barbarous-us-seizure-says-crew-families,20260421T064500Z,middleeasteye.net,English,Israel,vessel,D4_운송,2026-04-21,,0,HIGH,Iran US seizure,1_Security
c92382d8514b3fba3b7573f7d6cf7fae,India in touch with Iranian authorities for safe exit of its ships through Strait of Hormuz : MEA,https://kashmirreader.com/2026/04/21/india-in-touch-with-iranian-authorities-for-safe-exit-of-its-ships-through-strait-of-hormuz-mea/,20260421T063000Z,kashmirreader.com,English,India,Persian Gulf,D1_초크포인트,2026-04-21,,0,HIGH,Hormuz strait passage,1_Security
d62cd1c76b3497b421382bafc9dbe132,"Middle East crisis live : Iran weighs Pakistan talks with US , and claims it has  new cards for battlefield  | US - Israel war on Iran",https://www.theguardian.com/world/live/2026/apr/21/iran-war-live-news-updates-trump-us-hormuz-oil-middle-east-talks,20260421T054500Z,theguardian.com,English,United Kingdom,blockade,D6_교란행위,2026-04-21,,0,HIGH,Iran-US Middle East crisis,1_Security
bcfbe83ad6ad2bc39b0f598df99d8211,Iran Warns Us :  Prepared to reveal new cards on the battlefield : Iran big warning to US as ceasefire deadline looms,https://timesofindia.indiatimes.com/world/middle-east/prepared-to-reveal-new-cards-on-the-battlefield-irans-big-warning-to-us-as-ceasefire-deadline-looms/articleshow/130407786.cms,20260421T054500Z,timesofindia.indiatimes.com,English,India,blockade,D6_교란행위,2026-04-21,,0,HIGH,"Iran military warning, ceasefire",1_Security
f0bd051abad42a0b98a99203b17640e3,USS Abraham Lincoln enforcing naval blockade near Iranian ports ; Receives supplies during vertical replenishment : CENTCOM,https://aninews.in/news/world/us/uss-abraham-lincoln-enforcing-naval-blockade-near-iranian-ports-receives-supplies-during-vertical-replenishment-centcom20260421083454/,20260421T043000Z,aninews.in,English,India,carrier,D4_운송,2026-04-21,,0,HIGH,Naval blockade Iran,1_Security
00d3c535408ca5aed7739d0f6ebcc288,Strait of Hormuz Crisis Deepens : US Redirects 27 Vessels Amid Iran Blockade and Rising Maritime Tensions,https://gulfnews.com/world/mena/strait-of-hormuz-crisis-us-forces-say-27-vessels-redirected-amid-iran-blockade-1.500513672,20260421T041500Z,gulfnews.com,English,United Arab Emirates,shipping,D4_운송,2026-04-21,,0,HIGH,Hormuz crisis blockade,1_Security
85bdbacaad43383e0fcb4f405c8ae934,US has turned back 27 ships since start of Strait of Hormuz blockade,https://www.businesstimes.com.sg/international/us-has-turned-back-27-ships-start-strait-hormuz-blockade,20260421T031500Z,businesstimes.com.sg,English,Singapore,vessel,D4_운송,2026-04-21,,0,HIGH,Hormuz blockade,1_Security
af196e8cb1069b4412545e19210a30c7,Citi sees oil at $110 if Hormuz disruption lasts another month,https://www.moneycontrol.com/world/citi-sees-oil-at-110-if-hormuz-disruption-lasts-another-month-article-13894595.html,20260421T031500Z,moneycontrol.com,English,India,shipping,D4_운송,2026-04-21,,0,HIGH,Hormuz disruption oil,5_EconFinance
10078cd48b6ba158a1acc5bee967eb1b,Iran says wont accept talks under  shadow  of threat : prepared to reveal new cards on the battlefield,https://www.moneycontrol.com/world/iran-won-t-accept-talks-under-shadow-of-threat-prepared-to-reveal-new-cards-on-battlefield-article-13894616.html,20260421T031500Z,moneycontrol.com,English,India,blockade,D6_교란행위,2026-04-21,,0,HIGH,"Iran military threat, ceasefire",1_Security
77a6d97fea135ba37a224e15219059d8,"Bath - built ship fires on , seizes Iranian - flagged cargo ship",https://www.centralmaine.com/2026/04/20/bath-built-ship-fires-on-seizes-iranian-flagged-cargo-ship/,20260421T021500Z,centralmaine.com,English,United States,fleet,D4_운송,2026-04-21,,0,HIGH,Iranian cargo seizure,1_Security
3dbfbd81754278e5f6bdb475198b4523,Iran Reverses Decision to Reopen Strait of Hormuz Amid US Standoff,https://dailypioneer.com/news/iran-reverses-hormuz-move-keeps-strait-closed-over-us-blockade,20260421T020000Z,dailypioneer.com,English,India,Strait of Hormuz,D1_초크포인트,2026-04-21,,0,HIGH,Hormuz reopening reversal,1_Security
743aa6827c8961d609d2b5c074ea6025,"Dual Iran , US blockades have traffic in Strait of Hormuz crippled again",https://nationalpost.com/news/world/israel-middle-east/us-iran-strait-of-hormuz-traffic-crippled-again,20260421T014500Z,nationalpost.com,English,Canada,container,D2_품목,2026-04-21,,0,HIGH,Hormuz strait blockade,1_Security
8f9664321b14d746671ef30c824d29e0,Iranian cargo ship defies Trump blockade to transit Strait of Hormuz,https://www.express.co.uk/news/world/2196371/iranian-cargo-ship-transiting-strait,20260421T010000Z,express.co.uk,English,United Kingdom,Strait of Hormuz,D1_초크포인트,2026-04-21,,0,HIGH,Hormuz blockade,1_Security
11f2871e9f41f6e0e016cf3ac87436d5,"Trump , Iran and the Strait of Hormuz : here what happened overnight",https://www.scmp.com/news/china/diplomacy/article/3350798/trump-iran-and-strait-hormuz-heres-what-happened-overnight,20260421T010000Z,scmp.com,English,China,Strait of Hormuz,D1_초크포인트,2026-04-21,,0,HIGH,Hormuz overnight developments,1_Security
4988c316a3ab2bea2f6963a6901b6b7e,"In bid to bypass Hormuz chokepoint , Gulf countries scramble to ramp up infra",https://indianexpress.com/article/business/in-bid-to-bypass-hormuz-chokepoint-gulf-countries-scramble-to-ramp-up-infra-10647175/,20260421T003000Z,indianexpress.com,English,India,Strait of Hormuz,D1_초크포인트,2026-04-21,,0,HIGH,Hormuz bypass infrastructure,3_Freight
093d57dbe90c2b3bc57078df8f02a749,Iran Strait of Hormuz blockade threatens global energy catastrophe – NaturalNews . com,https://www.naturalnews.com/2026-04-20-iran-strait-hormuz-blockade-global-energy-catastrophe.html,20260421T000000Z,naturalnews.com,English,United States,Strait of Hormuz,D1_초크포인트,2026-04-21,,0,HIGH,Hormuz energy threat,1_Security
b71e92855617be0f641360d6eef87979,"OPEC+ : Market stabilizer , or a structural drag on the global economy ? ",https://finance.yahoo.com/sectors/energy/articles/opec-market-stabilizer-structural-drag-193052035.html,20260421T200000Z,finance.yahoo.com,English,United States,shortage,D6_교란행위,2026-04-21,,0,MEDIUM,OPEC+ Economics,5_EconFinance
ab0995bcac3469ac3a8745fd72abce5b,Saipem sees earnings growth as Strait of Hormuz closure clouds future,https://www.upstreamonline.com/finance/saipem-sees-earnings-growth-as-strait-of-hormuz-closure-clouds-future/2-1-1978498,20260421T200000Z,upstreamonline.com,English,United States,closure,D6_교란행위,2026-04-21,,0,MEDIUM,Hormuz closure risk,1_Security
d898a31c2637d7c89987710f4dce0aad,Hard - line Iranian Revolutionary Guard commander emerges as key player,https://www.washingtonexaminer.com/policy/defense/4535550/iran-revolutionary-guard-oversight-negotiations-end-war-trump/,20260421T200000Z,washingtonexaminer.com,English,United States,vessel,D4_운송,2026-04-21,,0,MEDIUM,Iran military leadership,1_Security
7f899f22bf6101e29b7074e6736462c8,Trump wants the war with Iran to end . Does Iran ? ,https://www.vox.com/politics/486281/iran-hormuz-nuclear-ceasefire,20260421T200000Z,vox.com,English,United States,blockade,D6_교란행위,2026-04-21,,0,MEDIUM,Iran-US war negotiations,1_Security
b9835cdc7142689768450ca731ef21b1,"Iran rejects talks with U . S . under pressure and aimed at surrender , senior Iranian official says",https://www.marketscreener.com/news/iran-rejects-talks-with-u-s-under-pressure-and-aimed-at-surrender-senior-iranian-official-says-ce7f59dbdf8df02d,20260421T200000Z,marketscreener.com,English,,container ship,D4_운송,2026-04-21,,0,MEDIUM,Iran US tensions,1_Security
4f95b5dd0a930faac578c47c1fca52c9,Vance Trip to Islamabad on Hold as U . S . Says Iran Failed to Respond to Its Terms,https://article.wn.com/view/2026/04/21/Vance_s_Trip_to_Islamabad_on_Hold_as_US_Says_Iran_Failed_to__p/,20260421T194500Z,article.wn.com,English,United States,delay,D6_교란행위,2026-04-21,,0,MEDIUM,Iran-US diplomacy,1_Security
71845af78e372710f0fdabc70923253f,War On Iran : – All Signs Point To Escalation – Moon of Alabama,https://www.moonofalabama.org/2026/04/war-on-iran-signs-point-to-escalation.html/comment-page-6,20260421T194500Z,moonofalabama.org,English,Syria,container,D2_품목,2026-04-21,,0,MEDIUM,Iran-US conflict,1_Security
b71a19be98dd6cd31c4c094a907d418c,More fertiliser pledged under government insurance deal,https://www.perthnow.com.au/news/politics/more-fertiliser-pledged-under-government-insurance-deal-c-22174139,20260421T194500Z,perthnow.com.au,English,Australia,closure,D6_교란행위,2026-04-21,,0,MEDIUM,Fertilizer supply,10_OtherIndustry
5281cf657b9a46d6363303cc41c6dc14,Wheat Futures Higher With All Eyes on Iran Talks -- Daily Grain Highlights,https://www.marketscreener.com/news/wheat-futures-higher-with-all-eyes-on-iran-talks-daily-grain-highlights-ce7f59dbdf8bf32d,20260421T194500Z,marketscreener.com,English,,fertilizer,D2_품목,2026-04-21,,0,MEDIUM,Grain price volatility,10_OtherIndustry
1970b923e19c9e246dfa415bf8f389af,US dollar climbs as uncertainty grows over Iran ceasefire,https://www.marketscreener.com/news/us-dollar-climbs-as-uncertainty-grows-over-iran-ceasefire-ce7f59dbdf8bf023,20260421T194500Z,marketscreener.com,English,,tanker,D4_운송,2026-04-21,,0,MEDIUM,Iran ceasefire,5_EconFinance
5c556b867e6a54a2694054f46e4c6f1a,Oil Spike Peaked ? Hormuz Could Pull WTI To $75 - United States Oil Fund ( ARCA : USO ) ,https://www.benzinga.com/markets/commodities/26/04/51950927/exclusive-oil-spike-already-peaked-one-signal-could-pull-wti-back-to-75-says-expert,20260421T193000Z,benzinga.com,English,United States,Strait of Hormuz,D1_초크포인트,2026-04-21,,0,MEDIUM,Oil price forecast,5_EconFinance
fd016d2abfdcd060c07a8024b4af5935,"Vance trip to Pakistan for Iran talks is on hold , NYT reports",https://www.cnbc.com/2026/04/21/trump-vance-iran-war-pakistan.html,20260421T193000Z,cnbc.com,English,United States,delay,D6_교란행위,2026-04-21,,0,MEDIUM,Iran-US diplomacy,1_Security
