url_hash,title,url,seendate,domain,language,sourcecountry,query_keyword,query_group,collect_date,kg_entities,kg_match_count,relevance,topic,category
9b4e2788aefbd0e7cc045303adb215fa,"Houthis Enter Iran War , Threaten Bab al - Mandeb Strait in Strikes on Israel - Geopolitics",https://naija247news.com/houthis-enter-iran-war-threaten-bab-al-mandeb-strait-in-strikes-on-israel/,20260330T001500Z,naija247news.com,English,Nigeria,Gulf of Aden,D1_초크포인트,2026-03-29,,0,HIGH,Houthi Bab el-Mandeb threat,1_Security
5a6de7e57bc87cfc106844c59e1ad17a,"Strikes continue as Houthis join Iran war , US troops arrive",https://www.unionleader.com/news/military/strikes-continue-as-houthis-join-iran-war-us-troops-arrive/article_36243ffa-e034-4d2e-9aac-758cc0dd79f6.html,20260330T001500Z,unionleader.com,English,United States,canal,D3_인프라,2026-03-29,,0,HIGH,Houthi strikes Red Sea,1_Security
55721ed46211bfafd9eebfa8f6f5951c,Oil prices climb after Iran warns against US ground invasion,https://www.cnn.com/2026/03/29/business/oil-prices-iran-war,20260329T234500Z,cnn.com,English,United States,Strait of Hormuz,D1_초크포인트,2026-03-29,,0,HIGH,Oil price surge,10_OtherIndustry
7089ba48f8f5cc2264ef292635b93707,Petrochemical facility struck in northern Iran,https://www.thehindu.com/news/international/petrochemical-facility-struck-in-northern-iran/article70800849.ece,20260329T234500Z,thehindu.com,English,India,natural gas,D2_품목,2026-03-29,,0,HIGH,Iran infrastructure attack,1_Security
2ebd68235eb13969798c5a9173e72614,Starmer to meet business leaders amid Hormuz blockade,https://www.echo-news.co.uk/news/national/25978230.starmer-meet-business-leaders-amid-hormuz-blockade/,20260329T224500Z,echo-news.co.uk,English,United Kingdom,Strait of Hormuz,D1_초크포인트,2026-03-29,,0,HIGH,Hormuz blockade,1_Security
3faec11a75bb15732632f3e190bf3c47,Houthi missile attack on Israel stokes Red Sea shipping fears | Hellenic Shipping News Worldwide,https://www.hellenicshippingnews.com/houthi-missile-attack-on-israel-stokes-red-sea-shipping-fears/,20260329T224500Z,hellenicshippingnews.com,English,China,Suez Canal,D1_초크포인트,2026-03-29,,0,HIGH,Red Sea shipping disruption,1_Security
b3f20488a0fc2bb631a002832a1bd20f,US warns of potential threats in the Bab al ‑ Mandeb Strait | Hellenic Shipping News Worldwide,https://www.hellenicshippingnews.com/us-warns-of-potential-threats-in-the-bab-al%E2%80%91mandeb-strait/,20260329T224500Z,hellenicshippingnews.com,English,China,Cape of Good Hope,D1_초크포인트,2026-03-29,,0,HIGH,Bab al-Mandeb threat,1_Security
8975d511d1d5acb0eb8a72eecb90c1bd,Ukraine Sustains Unrelenting Nightly Attacks on Russia Baltic Oil Ports,https://maritime-executive.com/article/ukraine-sustains-unrelenting-nightly-attacks-on-russia-s-baltic-oil-ports,20260329T224500Z,maritime-executive.com,English,United States,terminal,D3_인프라,2026-03-29,,0,HIGH,Baltic oil port attacks,1_Security
32ab9ddb84cbc66151ab60ececf71b4e,"Russian tanker nears Cuba , defying US oil blockade",https://www.voiceofalexandria.com/news/national/russian-tanker-nears-cuba-defying-us-oil-blockade/article_c82ca481-0553-5db7-ae08-04b6d42f9075.html,20260329T224500Z,voiceofalexandria.com,English,United States,tanker,D4_운송,2026-03-29,,0,HIGH,Russian tanker blockade,1_Security
7e8898c15e55bc897952fab88e401c53,  We were paraded as smuggler : Captain Vijay Kumar recount ordeal after being detained by Iranian Navy,http://www.calcuttanews.net/news/278951862/we-were-paraded-as-smugglers-captain-vijay-kumar-recount-ordeal-after-being-detained-by-iranian-navy,20260329T224500Z,calcuttanews.net,English,India,vessel,D4_운송,2026-03-29,,0,HIGH,Iranian Navy detention,1_Security
ec931d9ba230e4aa986903596fe4b666,"Iran Allowing 20 More Ships Through Strait Of Hormuz , Pakistan Says",https://www.zerohedge.com/geopolitical/iran-allowing-20-more-ships-through-strait-hormuz-pakistan-says,20260329T221500Z,zerohedge.com,English,United States,Strait of Hormuz,D1_초크포인트,2026-03-29,,0,HIGH,Hormuz strait access,1_Security
ecb50e25bf8d6bd4cbc008b895a1feb5,The maritime passages with a chokehold on the global economy,http://www.bruneinews.net/news/278951464/the-maritime-passages-with-a-chokehold-on-the-global-economy,20260329T220000Z,bruneinews.net,English,Malaysia,Strait of Malacca,D1_초크포인트,2026-03-29,,0,HIGH,Maritime chokepoint economy,1_Security
ba8d59ee80d9e698fda44dd347b33b84,War in Iran sparks a global fertilizer shortage and threatens food prices,https://hayspost.com/posts/9bc81339-3276-49e8-b2d3-2ea7c8d4a260,20260329T220000Z,hayspost.com,English,United States,fertilizer,D2_품목,2026-03-29,,0,HIGH,Iran war fertilizer shortage,1_Security
c69aed26db909f4207a418ab11452633,"EU - led mission urges ships linked to US , Israel to avoid waters near Yemen",https://www.presstv.ir/Detail/2026/03/29/766039/EU-led-mission-urges-ships-linked-to-US-Israel-to-avoid-waters-near-Yemen,20260329T211500Z,presstv.ir,English,Iran,Gulf of Aden,D1_초크포인트,2026-03-29,,0,HIGH,Yemen shipping warning,1_Security
8a346a85176fc718d85d6854c244c6d3,"Live updates : ASX set to fall after Wall Street tanks , oil price under pressure as Houthis enter the war",https://www.abc.net.au/news/2026-03-30/asx-markets-business-news-live-updates/106509200,20260329T210000Z,abc.net.au,English,Australia,Strait of Hormuz,D1_초크포인트,2026-03-29,,0,HIGH,Houthi disruption oil,1_Security
cb3d95cb4ceecc62023fbec099f89427,Iran war escalation enters fifth week as Houthi enter the fray and strikes intensify,https://calgaryherald.com:443/news/world/israel-middle-east/iran-war-escalation-enters-fifth-week-as-houthi-enter-the-fray-and-strikes-intensify/wcm/d81653ae-ef67-44bf-9ae4-5c86e79205e1,20260329T210000Z,calgaryherald.com,English,Canada,pipeline,D3_인프라,2026-03-29,,0,HIGH,Iran-Houthi escalation,1_Security
150c61bafa5024074f76871a2c62eaa6,Sanctioned oil tanker enters united kingdom waters day after government crackdown threat | Hellenic Shipping News Worldwide,https://www.hellenicshippingnews.com/sanctioned-oil-tanker-enters-uk-waters-day-after-government-crackdown-threat/,20260329T210000Z,hellenicshippingnews.com,English,China,tanker,D4_운송,2026-03-29,,0,HIGH,Sanctioned tanker transit,1_Security
893558dc04c10c7f515e9c87cc6dba99,"Iran signals tighter control , possible tolls for Strait of Hormuz",https://www.dailysabah.com/business/economy/iran-signals-tighter-control-possible-tolls-for-strait-of-hormuz,20260329T201500Z,dailysabah.com,English,Turkey,Strait of Hormuz,D1_초크포인트,2026-03-29,,0,HIGH,Hormuz toll threat,1_Security
7bf762c307850866b6f090320c84f987,Bab al - Mandeb Strait faces disruption risk as Iran war escalates,https://www.aa.com.tr/en/middle-east/bab-al-mandeb-strait-faces-disruption-risk-as-iran-war-escalates/3884128,20260329T201500Z,aa.com.tr,English,Turkey,Strait of Hormuz,D1_초크포인트,2026-03-29,,0,HIGH,Bab al-Mandeb disruption,1_Security
0cd166f19fceb016511072c2923413e1,Iran - backed Houthis enter the monthlong war and could further threaten global shipping,https://www.thv11.com/article/news/nation-world/iran-backed-houthis-enter-the-monthlong-war-and-could-further-threaten-global-shipping/616-1dbb5bec-4856-4eb0-b67d-454862acc1c9,20260329T201500Z,thv11.com,English,United States,Persian Gulf,D1_초크포인트,2026-03-29,,0,HIGH,Houthi shipping threat,1_Security
6c3ed9ca089cb8c70461e3023a7b54da,Indian Seafarers Detained by Iranian Navy Share Harrowing Ordeal,https://www.newkerala.com/news/a/we-paraded-as-smugglers-captain-vijay-kumar-recount-979.htm,20260329T201500Z,newkerala.com,English,India,vessel,D4_운송,2026-03-29,,0,HIGH,Iranian naval detention,1_Security
3d74338beb04fd25bdeec9b388677326,US - Israeli strikes cut power across Tehran and Karaj,https://www.albawaba.com/news/us-israeli-strikes-cut-power-across-1624550,20260329T201500Z,albawaba.com,English,Israel,disruption,D6_교란행위,2026-03-29,,0,HIGH,Iran infrastructure attack,1_Security
bdde5d5043be1e281767d527362046b3,Manila Bulletin - A Houthi missile attack on Israel stokes fears of renewed Red Sea shipping strikes,https://mb.com.ph/2026/03/30/a-houthi-missile-attack-on-israel-stokes-fears-of-renewed-red-sea-shipping-strikes,20260329T200000Z,mb.com.ph,English,Philippines,Strait of Hormuz,D1_초크포인트,2026-03-29,,0,HIGH,Red Sea shipping strikes,1_Security
c69d6eabc61c1fd3163e56c3382fe1a1,How Australia became hostage to fuel imports,https://www.abc.net.au/news/2026-03-30/how-australia-became-hostage-to-fuel-imports/106508520,20260329T191500Z,abc.net.au,English,Australia,Strait of Hormuz,D1_초크포인트,2026-03-29,,0,HIGH,Australia fuel imports,5_EconFinance
294bdfc263c826ebd64ac99c06c6fa02,Two gas India - flagged gas tankers crossing the Strait of Hormuz,https://nypost.com/2026/03/29/business/two-gas-india-flagged-gas-tankers-crossing-the-strait-of-hormuz/,20260329T183000Z,nypost.com,English,United States,Strait of Hormuz,D1_초크포인트,2026-03-29,,0,HIGH,Hormuz strait transit,1_Security
5a0f447d3c598937e3e26022edfb5436,US considers Iran operation as Pakistan hosts regional peace talks focused on Ho,https://www.jpost.com/middle-east/article-891553,20260329T183000Z,jpost.com,English,Israel,Strait of Hormuz,D1_초크포인트,2026-03-29,,0,HIGH,Iran Hormuz security,1_Security
2d5d432beb999885801487b941b2132e,Pakistan hosts regional powers for Iran talks with focus on Hormuz proposals,https://economictimes.indiatimes.com/news/defence/pakistan-hosts-regional-powers-for-iran-talks-with-focus-on-hormuz-proposals/articleshow/129885424.cms,20260329T183000Z,economictimes.indiatimes.com,English,India,Strait of Hormuz,D1_초크포인트,2026-03-29,,0,HIGH,Hormuz chokepoint talks,1_Security
388b7f5ad24cbcd612c726d1e79fd095,Petrochem price surge hitting economy hard - The Economic Times,https://economictimes.indiatimes.com/opinion/et-editorial/petrochem-price-surge-hitting-economy-hard/articleshow/129885038.cms,20260329T183000Z,economictimes.indiatimes.com,English,India,Persian Gulf,D1_초크포인트,2026-03-29,,0,HIGH,Petrochemical price surge,10_OtherIndustry
c4a66f8f57737db9608e48df3e4c712e,Break the Strait : How the world can end Iran energy blackmail,https://www.jpost.com/israel-news/politics-and-diplomacy/article-891551,20260329T183000Z,jpost.com,English,Israel,Persian Gulf,D1_초크포인트,2026-03-29,,0,HIGH,Hormuz Strait control,1_Security
e68a658486dda8a9b248e789386da46d,Saudi Arabia Reroutes Oil via East - West Pipeline as Strait of Hormuz Disruption Hits Global Markets - Oil & Gas,https://naija247news.com/saudi-arabia-reroutes-oil-via-east-west-pipeline-as-strait-of-hormuz-disruption-hits-global-markets/,20260329T183000Z,naija247news.com,English,Nigeria,pipeline,D3_인프라,2026-03-29,,0,HIGH,Hormuz disruption reroute,1_Security
90b9dfd3bb05af0b4d047a2a56046b9b,"Nigerian Bonny Light Hits $7 . 50 Premium Over Brent Amid Strait of Hormuz Closure - Analysis , Oil & Gas",https://naija247news.com/nigerian-bonny-light-hits-7-50-premium-over-brent-amid-strait-of-hormuz-closure/,20260329T183000Z,naija247news.com,English,Nigeria,refinery,D3_인프라,2026-03-29,,0,HIGH,Hormuz closure oil premium,5_EconFinance
0b765adcf5e298cd01ada758f24c73a7,"  Strait of Hormuz regime will never return , Iran vows strategic transformation",https://www.moneycontrol.com/world/strait-of-hormuz-regime-will-never-return-iran-vows-strategic-transformation-article-13873791.html,20260329T181500Z,moneycontrol.com,English,India,Strait of Hormuz,D1_초크포인트,2026-03-29,,0,HIGH,Hormuz chokepoint,1_Security
d775177b47a77e05b5a5db5868f28c33,Indonesia coordinates for safety of its vessels in Strait of Hormuz,https://en.antaranews.com/news/410290/indonesia-coordinates-for-safety-of-its-vessels-in-strait-of-hormuz,20260329T174500Z,en.antaranews.com,English,Indonesia,Persian Gulf,D1_초크포인트,2026-03-29,,0,HIGH,Hormuz vessel safety,1_Security
db7c7438979520dd545de9ea64c54c8a,"Houthis open new front in Iran war : Will Yemeni group block Bab al - Mandeb ? - Dominican Republic Post – Caribbean News , Business , Travel & Culture",https://dominicanrepublicpost.com/houthis-open-new-front-in-iran-war-will-yemeni-group-block-bab-al-mandeb/,20260329T173000Z,dominicanrepublicpost.com,English,United States,Gulf of Aden,D1_초크포인트,2026-03-29,,0,HIGH,Houthi Bab el-Mandeb blockade,1_Security
1b41a00920887382dede10209563f6f5,Pentagon planning ground assault on Iran,https://srilankamirror.com/news/pentagon-planning-ground-assault-on-iran/,20260329T170000Z,srilankamirror.com,English,Sri Lanka,crude oil,D2_품목,2026-03-29,,0,HIGH,Iran military threat,1_Security
bf3e78dbf02eae55d7484233b92a1646,China is Detaining Panama - Flagged Ships Amid the Battle Over Port Control,https://newsroompanama.com/2026/03/29/china-is-detaining-panama-flagged-ships-amid-the-battle-over-port-control/,20260329T161500Z,newsroompanama.com,English,Panama,Panama Canal,D1_초크포인트,2026-03-29,,0,HIGH,Panama port control dispute,1_Security
3362722ab629e4a45feefe2145b30884,Houthis Strike Israel Again ; More US Marines Arrive In Gulf Region,http://www.britainnews.net/news/278951209/houthis-strike-israel-again-more-us-marines-arrive-in-gulf-region,20260329T161500Z,britainnews.net,English,United Kingdom,tanker,D4_운송,2026-03-29,,0,HIGH,Houthi attacks Gulf region,1_Security
f45cd444cccdccff9002e05f909ae412,Two more Indian LPG tankers transit Hormuz with 94K tonne cooking gas,https://www.rediff.com/news/report/two-more-indian-lpg-tankers-transit-hormuz-with-94k-tonne-cooking-gas/20260329.htm,20260329T154500Z,rediff.com,English,India,Strait of Hormuz,D1_초크포인트,2026-03-29,,0,HIGH,LNG Hormuz Transit,1_Security
a01816ffa70b1a1f4f8a2a309dc4ff59,UK Mulls Sending Landing Ship Into Strait of Hormuz Crisis – Report,https://sputnikglobe.com/20260329/uk-mulls-sending-landing-ship-into-strait-of-hormuz-crisis-report-1123915797.html,20260329T154500Z,sputnikglobe.com,English,,Persian Gulf,D1_초크포인트,2026-03-29,,0,HIGH,Hormuz strait military,1_Security
3d1a5563550c22209515c796034e4fd0,"Iran evolving attack strategy aims for interceptor shortage , report reveals",http://www.jpost.com/middle-east/iran-news/article-891527,20260329T154500Z,jpost.com,English,Israel,carrier,D4_운송,2026-03-29,,0,HIGH,Iran attack strategy,1_Security
e544c2830f543289e33dc7db72961cd8,Yemen Houthis Enter Iran War With Attack on Israel,https://en.tempo.co/read/2095087/yemens-houthis-enter-iran-war-with-attack-on-israel,20260329T154500Z,en.tempo.co,English,,Houthi,D7_행위자,2026-03-29,,0,HIGH,Houthi-Israel escalation,1_Security
abc49f7f34738a2c1779a46ec520dd01,"End of Middle East war seems further than ever as Pentagon prepares ground operations , Iran increases attacks",https://www.perthnow.com.au/news/middle-east/end-of-middle-east-war-seems-further-than-ever-as-pentagon-prepares-ground-operations-iran-increases-attacks-c-22064884,20260329T153000Z,perthnow.com.au,English,Australia,Strait of Hormuz,D1_초크포인트,2026-03-29,,0,HIGH,Iran military escalation,1_Security
734807d6d4a43ba430f6b4f1a3ac9896,"Pentagon preparing for US ground assault in Iran , says report",https://www.middleeasteye.net/live-blog/live-blog-update/pentagon-preparing-us-ground-assault-iran-says-report,20260329T153000Z,middleeasteye.net,English,Israel,Strait of Hormuz,D1_초크포인트,2026-03-29,,0,HIGH,US-Iran military posture,1_Security
ccb99692e7e180268df13be154a3d167,Houthis enter Iran war with attacks on Israel ; US Marines arrive in region,https://tradearabia.com:443/News/390644/Houthis-enter-Iran-war-with-attacks-on-Israel%3b-US-Marines-arrive-in-region,20260329T153000Z,tradearabia.com,English,United Arab Emirates,Suez Canal,D1_초크포인트,2026-03-29,,0,HIGH,Houthi-Iran coordination,1_Security
e2e2048d09b67f4610500964eceaba88,"Is USS Abraham Lincoln Moving Closer To Iran border ? Iran Navy Commander Issues Fresh Warning , Says  Will Target Carrier If It Moves Within Range  ",https://www.newsx.com/world/is-uss-abraham-lincoln-moving-closer-to-iran-border-irans-navy-commander-issues-fresh-warning-says-will-target-carrier-if-it-moves-within-range-190644/,20260329T153000Z,newsx.com,English,India,Persian Gulf,D1_초크포인트,2026-03-29,,0,HIGH,USS Abraham Lincoln Iran threat,1_Security
b72188e28fac11ecf402ddc6b229c858,Closure of Bab al - Mandeb  likely  amid Iran - US war : Houthi official,https://www.aa.com.tr/en/middle-east/closure-of-bab-al-mandeb-likely-amid-iran-us-war-houthi-official/3883838,20260329T151500Z,aa.com.tr,English,Turkey,Gulf of Aden,D1_초크포인트,2026-03-29,,0,HIGH,Bab el-Mandeb closure,1_Security
51ff654c99effb060319204c9c12af44,"South Korea Halts Naphtha Exports , Weighs Resumption of Russian Imports",https://meobserver.org/trade/2026/03/29/south-korea-halts-naphtha-exports-weighs-resumption-of-russian-imports/,20260329T151500Z,meobserver.org,English,Egypt,crude oil,D2_품목,2026-03-29,,0,HIGH,Korea naphtha exports,4_PortCargo
2ded63483bd0f607aa7244f6a7f1c194,Zelensky meets UAE President ; US - Israeli strike kills 5 in Iran near Strait of Hormuz,https://www.ibtimes.co.in/zelensky-meets-uae-president-us-israeli-strike-kills-5-iran-near-strait-hormuz-900180,20260329T144500Z,ibtimes.co.in,English,India,Strait of Hormuz,D1_초크포인트,2026-03-29,,0,HIGH,Iran military conflict near Hormuz,1_Security
2b423d77afeb09c5842180d6851bf2cb,20 Indian - flagged vessels with 540 seafarers remain in Persian Gulf region : Centre,https://www.sentinelassam.com/more-news/international/20-indian-flagged-vessels-with-540-seafarers-remain-in-persian-gulf-region-centre,20260329T144500Z,sentinelassam.com,English,India,Persian Gulf,D1_초크포인트,2026-03-29,,0,HIGH,Vessels stranded Persian Gulf,1_Security
22db8bd9f133ae7fc7dfe84103562c7a,"Two India - bound LPG tankers clear Strait of Hormuz , government says",https://tribune.com.pk/story/2599942/two-india-bound-lpg-tankers-clear-strait-of-hormuz-government-says,20260329T141500Z,tribune.com.pk,English,Pakistan,Strait of Hormuz,D1_초크포인트,2026-03-29,,0,HIGH,LPG transit Hormuz,3_Freight
9de93510e0706cd8632071cf752c2d71,Iran War Chokes Off Helium Supplies,https://politicalwire.com/2026/03/29/iran-war-chokes-off-helium-supplies/,20260329T141500Z,politicalwire.com,English,United States,natural gas,D2_품목,2026-03-29,,0,HIGH,Helium supply disruption,10_OtherIndustry
c6bb1067a1bd3540cfb5b3684c551bcc,Australia Cyclone Red Sky : 3 Port Realities Expose Strain on Global LNG Flows,https://www.el-balad.com/16895882,20260329T141500Z,el-balad.com,English,Egypt,iron ore,D2_품목,2026-03-29,,0,HIGH,Australia LNG port disruption,4_PortCargo
ebbf1ef469440d073fedda7159a39e9f,Shipping ministry says two more India - bound tankers pass Strait of Hormuz,https://www.newindianexpress.com/nation/2026/Mar/29/shipping-ministry-says-two-more-india-bound-tankers-pass-strait-of-hormuz,20260329T133000Z,newindianexpress.com,English,India,Strait of Hormuz,D1_초크포인트,2026-03-29,,0,HIGH,Hormuz tanker transit,3_Freight
bee3e3bca0b0a34526eb04680164dba7,Houthis attack Israel again as Iran allows  non - hostile states  access to Hormuz,https://www.gazetaexpress.com/en/Houthis-attack-Israel-again-as-Iran-allows-non-hostile-states-access-to-Hormuz/,20260329T131500Z,gazetaexpress.com,English,Kosovo,Strait of Hormuz,D1_초크포인트,2026-03-29,,0,HIGH,Hormuz access threat,1_Security
fb5a69b3986317561a1d42566350a7d9,US deploys Additional Warships to Middle East for possible Ground Assault Inside Iran,https://en.dailypakistan.com.pk/29-Mar-2026/us-deploys-additional-warships-to-middle-east-for-possible-ground-assault-inside-iran,20260329T131500Z,en.dailypakistan.com.pk,English,Pakistan,Strait of Hormuz,D1_초크포인트,2026-03-29,,0,HIGH,US military deployment,1_Security
9beab1a183be241de6ae25ee5d4af637,UN Secretary - General forms special task force to address humanitarian crisis in Strait of Hormuz,https://timesofoman.com/article/170020-un-secretary-general-forms-special-task-force-to-address-humanitarian-crisis-in-strait-of-hormuz,20260329T130000Z,timesofoman.com,English,Oman,Strait of Hormuz,D1_초크포인트,2026-03-29,,0,HIGH,Hormuz humanitarian crisis,1_Security
1cbcef05a5a4042603b503ed4ef3ec00,Saudi pipeline that bypasses Strait of Hormuz hits 7 million barrel capacity,https://www.straitstimes.com/world/middle-east/saudi-pipeline-that-bypasses-strait-of-hormuz-hits-7-million-barrel-capacity,20260329T130000Z,straitstimes.com,English,Singapore,Strait of Hormuz,D1_초크포인트,2026-03-29,,0,HIGH,Hormuz bypass capacity,3_Freight
e5b50828ad19b95dfe82acd68b9066cd,Fears of a prolonged oil shock grow as Iran war lurches into its second month,https://finance.yahoo.com/sectors/energy/articles/fears-prolonged-oil-shock-grow-113000015.html,20260329T130000Z,finance.yahoo.com,English,United States,crude oil,D2_품목,2026-03-29,,0,HIGH,Oil price shock Iran conflict,5_EconFinance
0f493470d975bb1f876a0049fd5c2f39,Iran vows to target USS Abraham Lincoln carrier if it moves within range,https://www.middleeasteye.net/live-blog/live-blog-update/iran-vows-target-uss-abraham-lincoln-carrier-if-it-moves-within-range,20260329T130000Z,middleeasteye.net,English,Israel,carrier,D4_운송,2026-03-29,,0,HIGH,Iran Naval Threat,1_Security
2c0882b913a1260eec13dee75e0d32cb,Navy fits ship with minehunting drones ahead of possible Hormuz deployment,https://www.lancashiretelegraph.co.uk/news/national/25977740.navy-fits-ship-minehunting-drones-ahead-possible-hormuz-deployment/,20260329T121500Z,lancashiretelegraph.co.uk,English,United Kingdom,Strait of Hormuz,D1_초크포인트,2026-03-29,,0,HIGH,Hormuz security deployment,1_Security
52ecb1b963205587cca57e0cecb6c6e4,Two more Indian LPG tankers carrying day cooking gas cross Strait of Hormuz,https://www.thehindubusinessline.com/news/two-more-indian-lpg-tankers-carrying-days-cooking-gas-cross-strait-of-hormuz/article70799239.ece,20260329T121500Z,thehindubusinessline.com,English,India,Strait of Hormuz,D1_초크포인트,2026-03-29,,0,HIGH,Hormuz LPG transit,3_Freight
e7580124ca7d272a7f3ff8ba946ada56,"US , Israeli strikes hit Iran port city near Hormuz strait : state media",https://www.bssnews.net/international/372445,20260329T121500Z,bssnews.net,English,Bangladesh,Strait of Hormuz,D1_초크포인트,2026-03-29,,0,HIGH,Hormuz military strikes,1_Security
17df2104419fd2ee4fff7bac6620723c,Iran war : Houthis escalate Middle East conflict - The Business Times,https://www.businesstimes.com.sg/international/risk-escalation-grows-houthis-enter-iran-war,20260329T121500Z,businesstimes.com.sg,English,Singapore,Suez Canal,D1_초크포인트,2026-03-29,,0,HIGH,Houthi Middle East conflict,1_Security
1afd91c74fa451c9c00629809f648e61,Escalation of US - Iran War : How Iran is Strategically Important to the united states and why President Trump Wants to Gain Control of the Strait of Hormuz . – dbsjeyaraj . com,https://dbsjeyaraj.com/dbsj/?p=87548,20260329T121500Z,dbsjeyaraj.com,English,Sri Lanka,Persian Gulf,D1_초크포인트,2026-03-29,,0,HIGH,Hormuz Strait Control,1_Security
57ae5834acf0381d3ad735622afced80,"Government ramps up measures to ensure fuel , LPG supplies amid Hormuz disruption",https://www.thehindu.com/news/national/government-ramps-up-measures-to-ensure-fuel-lpg-supplies-amid-hormuz-disruption/article70799281.ece,20260329T121500Z,thehindu.com,English,India,natural gas,D2_품목,2026-03-29,,0,HIGH,Hormuz Disruption Response,1_Security
04bbf97dbf5bfaee3110195920dcd835,Oil on track for record monthly surge as Iran war disrupts markets,https://www.theguardian.com/business/2026/mar/29/oil-monthly-surge-record-iran-war-markets-gold,20260329T120000Z,theguardian.com,English,United Kingdom,Strait of Hormuz,D1_초크포인트,2026-03-29,,0,HIGH,Oil price surge Iran,5_EconFinance
ba607da8b21e323f08a5bcdd8f0e45c5,Iran claims aluminium plant attacks in Gulf as Houthis join war,https://www.guampdn.com/news/national/iran-claims-aluminium-plant-attacks-in-gulf-as-houthis-join-war/article_77e19f36-f09b-51a0-9ee5-6fbddb0a5b14.html,20260329T111500Z,guampdn.com,English,Guam,Gulf of Aden,D1_초크포인트,2026-03-29,,0,HIGH,Houthi Iran chokepoint threats,1_Security
2a7a0a226e3aba8b1df215a00b4edde7,"Govt shares key updates on oil , gas shortage , shipping & more amid Israel - Iran war",https://economictimes.indiatimes.com/industry/energy/oil-gas/govt-shares-key-updates-on-oil-gas-supply-lpg-shortage-png-infra-shipping-more-amid-israel-iran-war/articleshow/129879065.cms,20260329T111500Z,economictimes.indiatimes.com,English,India,natural gas,D2_품목,2026-03-29,,0,HIGH,Israel-Iran supply disruption,1_Security
bbbe576cdd0b7d5e5a45749f05f761e2,Iran agreed to allow 20 Pakistani vessels through Strait of Hormuz : Islamabad,https://www.dailyexcelsior.com/iran-agreed-to-allow-20-pakistani-vessels-through-strait-of-hormuz-islamabad/,20260329T104500Z,dailyexcelsior.com,English,India,Strait of Hormuz,D1_초크포인트,2026-03-29,,0,HIGH,Hormuz transit approval,1_Security
a6c4fc639feab03030cb2f78104e18e7,Blockage of Strait of Hormuz - Compulsions for Alternatives,https://paktribune.com/blockage-of-strait-of-hormuz-compulsions-for-alternatives/,20260329T104500Z,paktribune.com,English,Pakistan,Strait of Hormuz,D1_초크포인트,2026-03-29,,0,HIGH,Hormuz blockade scenario,1_Security
7c7d5ba5a937184bea5e42438867bac5,How can Houthis threaten US interests ? Why Bab el - Mandeb Strait matters and what happens if it blocked ? ,https://www.livemint.com/news/world/iran-war-news-how-can-houthis-threaten-us-interests-why-bab-el-mandeb-strait-matters-and-what-happens-if-its-blocked-11774764236246.html,20260329T104500Z,livemint.com,English,India,Suez Canal,D1_초크포인트,2026-03-29,,0,HIGH,Bab el-Mandeb chokepoint threat,1_Security
