url,url_hash,title,seendate,domain,language,sourcecountry,query_keyword,query_group,collect_date
https://tribune.com.pk/story/2608589/iran-vows-enemy-weapons-shipments-cannot-cross-strait-of-hormuz,1c167e289e050a243f156c2ddd21c4b8,Iran vows  enemy  weapons shipments cannot cross Strait of Hormuz,20260517T070000Z,tribune.com.pk,English,Pakistan,Strait of Hormuz,D1_초크포인트,2026-05-17
https://www.middleeasteye.net/live-blog/live-blog-update/tehran-asserts-sovereignty-over-strait-hormuz-shipping,d15871cdfe239b0d66cd7f3b3749071f,Tehran asserts sovereignty over Strait of Hormuz shipping,20260517T041500Z,middleeasteye.net,English,Israel,Strait of Hormuz,D1_초크포인트,2026-05-17
https://timesofindia.indiatimes.com/india/unacceptable-india-condemns-attacks-on-ships-in-strait-of-hormuz-at-un/articleshow/131150384.cms,629e96e7b02ef9b7348f69ad64ffb5c1,  Unacceptable : India condemns attacks on ships in Strait of Hormuz at UN,20260517T084500Z,timesofindia.indiatimes.com,English,India,Strait of Hormuz,D1_초크포인트,2026-05-17
https://www.wnd.com/2026/05/as-britain-france-try-prying-hormuz-open-their/,6db1558d8bc932b6403cf6dbdd6a456f,"As Britain , France try prying Hormuz open with their own crowbars , Uncle Sam forms new coalition * WorldNetDaily * by Francis Kapper , Daily Caller News Foundation",20260517T163000Z,wnd.com,English,United States,Strait of Hormuz,D1_초크포인트,2026-05-17
https://www.moneycontrol.com/world/lpg-tanker-symi-reaches-kandla-after-safe-passage-through-strait-of-hormuz-article-13921327.html,38de4ed4aae5081b00d1fb70f53a4f37,LPG tanker Symi reaches Kandla after safe passage through Strait of Hormuz,20260517T043000Z,moneycontrol.com,English,India,Strait of Hormuz,D1_초크포인트,2026-05-17
https://www.khaama.com/iran-says-it-will-block-enemy-arms-shipments-through-hormuz/,29aaeaef007dd21a6022ac4a9771a72c,Iran Says It Will Block Enemy Arms Shipments Through Hormuz,20260517T113000Z,khaama.com,English,Afghanistan,Strait of Hormuz,D1_초크포인트,2026-05-17
https://timesofindia.indiatimes.com/city/rajkot/vessel-carrying-20000-tonnes-of-lpg-reaches-kandla-crossing-strait-of-hormz/articleshow/131154642.cms,cc48f815182cb9453979be1db60af3cd,"Vessel carrying 20 , 000 tonnes of LPG reaches Kandla crossing Strait of Hormz | Rajkot News",20260517T174500Z,timesofindia.indiatimes.com,English,India,Strait of Hormuz,D1_초크포인트,2026-05-17
https://www.tribuneindia.com/news/india/west-asia-war-vessel-carrying-20000-tonnes-of-lpg-reaches-gujarat-crossing-strait-of-hormuz/,10862d9a1ec7757270c2f37178c69ad4,"West Asia war : Vessel carrying 20 , 000 tonnes of LPG reaches Gujarat crossing Strait of Hormuz",20260517T123000Z,tribuneindia.com,English,India,Strait of Hormuz,D1_초크포인트,2026-05-17
https://www.patheos.com/blogs/kermitzarleyblog/2026/05/could-iran-force-creation-of-a-palestinian-state/,2301285f18f57e9b4114c881708accf5,Could Iran Force Creation Of A Palestinian State ? ,20260517T070000Z,patheos.com,English,United States,Strait of Hormuz,D1_초크포인트,2026-05-17
https://www.hindustantimes.com/world-news/tanker-carrying-iraqi-crude-crosses-strait-reaches-india-101779000227765.html,cdb8400ca7cb2e2dc47978c2d48c8eed,"Tanker carrying Iraqi crude crosses Strait of Hormuz , reaches India",20260517T100000Z,hindustantimes.com,English,India,Strait of Hormuz,D1_초크포인트,2026-05-17
https://www.globalsecurity.org/wmd/library/news/iran/2026/05/iran-260516-presstv04.htm,ec61602f34ecfca08a6248c75b0a8ecf,"Iran to unveil new mechanism for Strait of Hormuz , will collect tolls : Senior MP",20260517T154500Z,globalsecurity.org,English,Syria,Strait of Hormuz,D1_초크포인트,2026-05-17
https://www.hurriyetdailynews.com/tehran-signals-plan-to-impose-fee-on-hormuz-subsea-internet-cables-222228,0073ea3496054e7b12800a848ac0e97e,Tehran signals plan to impose fee on Hormuz subsea internet cables,20260517T141500Z,hurriyetdailynews.com,English,Turkey,Strait of Hormuz,D1_초크포인트,2026-05-17
https://www.okaz.com.sa/politics/na/2249097,c73053a20e4559e434d4b90af13a5818,بزشكيان يلتقي وزير داخلية باكستان .. وعملية أمريكية مرتقبة لإعادة فتح « هرمز » ,20260517T170000Z,okaz.com.sa,English,Saudi Arabia,Strait of Hormuz,D1_초크포인트,2026-05-17
https://www.bankingnews.gr/diethni/articles/875621/european-states-accept-iranian-control-over-hormuz-and-discuss-plan-for-fees-exceeding-10-billion-dollars-in-stunning-development,d99b797aa8062584aa479d75c65e52b0,European states accept Iranian control over Hormuz and discuss plan for fees exceeding 10 billion dollars in stunning development,20260517T103000Z,bankingnews.gr,English,Greece,Strait of Hormuz,D1_초크포인트,2026-05-17
https://dunyanews.tv/en/Business/952100-oil-prices-climb-more-than-3-on-fears-of-new-usiran-combat,b988d9cd0fe2647c5216c47cc130097c,Oil prices climb more than 3 % on fears of new US - Iran combat,20260517T121500Z,dunyanews.tv,English,Pakistan,Strait of Hormuz,D1_초크포인트,2026-05-17
https://www.thehindu.com/news/national/at-un-india-flags-concerns-over-targeting-of-vessels-in-strait-of-hormuz/article70989596.ece,2b4aa619d1adfccd0a583bf2751c0950,"At UN , India flags concerns over targeting of vessels in Strait of Hormuz",20260517T054500Z,thehindu.com,English,India,Strait of Hormuz,D1_초크포인트,2026-05-17
https://www.thehindubusinessline.com/news/at-un-india-flags-concerns-over-targeting-of-vessels-in-strait-of-hormuz/article70989580.ece,8ccc92685d964b482fb66e0e34932141,"At UN , India flags concerns over targeting of vessels in Strait of Hormuz",20260517T051500Z,thehindubusinessline.com,English,India,Strait of Hormuz,D1_초크포인트,2026-05-17
https://www.middleeasteye.net/live-blog/live-blog-update/bloomberg-reports-tanker-resumes-voyage-after-us-detention,0817c3a2245fb61b7c8ad48193bd7e8a,Bloomberg reports tanker resumes voyage after US detention,20260517T064500Z,middleeasteye.net,English,Israel,Strait of Hormuz,D1_초크포인트,2026-05-17
https://aninews.in/news/world/asia/marshall-islands-flagged-lpg-tanker-symi-arrives-at-kandla-port-after-crossing-strait-of-hormuz20260517095402/,9e4210704435217eb74d9556b089b0e4,Marshall Islands - flagged LPG tanker Symi arrives at Kandla Port after crossing Strait of Hormuz,20260517T061500Z,aninews.in,English,India,Strait of Hormuz,D1_초크포인트,2026-05-17
https://us.cnn.com/2026/05/17/middleeast/iran-hormuz-undersea-cables-intl,72d47d4ebab2e9c4f27d6854f656531a,Iran eyes a new source of power deep beneath the Strait of Hormuz,20260517T051500Z,us.cnn.com,English,United States,Strait of Hormuz,D1_초크포인트,2026-05-17
https://edition.cnn.com/2026/05/17/middleeast/iran-hormuz-undersea-cables-intl,a0ed50edbcb3c1bd3352c12402ac610b,Iran eyes a new source of power deep beneath the Strait of Hormuz,20260517T060000Z,edition.cnn.com,English,United States,Strait of Hormuz,D1_초크포인트,2026-05-17
https://idrw.org/at-un-india-flags-concerns-over-targeting-of-commercial-ships-in-hormuz/,5ae9e221a3919ed04eb5798561477790,"At UN , India flags concerns over targeting of commercial ships in Hormuz",20260517T130000Z,idrw.org,English,India,Strait of Hormuz,D1_초크포인트,2026-05-17
https://www.dailyexcelsior.com/at-un-india-flags-concerns-over-targeting-of-vessels-in-strait-of-hormuz/,c93717d79302ea472596c18ec574b078,"At UN , India Flags Concerns Over Targeting Of Vessels In Strait Of Hormuz",20260517T053000Z,dailyexcelsior.com,English,India,Strait of Hormuz,D1_초크포인트,2026-05-17
https://www.rediff.com/news/report/iran-to-unveil-new-hormuz-traffic-plan-says-us-linked-vessels-may-be-barred/20260517.htm,4193e40cfffa5d0282608341252ade74,"Iran to unveil new Hormuz traffic plan , says US - linked vessels may be barred",20260517T060000Z,rediff.com,English,India,Strait of Hormuz,D1_초크포인트,2026-05-17
https://www.newindianexpress.com/india/2026/May/17/targeting-commercial-shipsimpeding-navigation-in-strait-of-hormuz-unacceptable-indias-un-envoy,0c30f2d7411e1181fffd3b1641cdb005,"Targeting commercial ships , impeding navigation in Strait of Hormuz unacceptable : India UN envoy",20260517T073000Z,newindianexpress.com,English,India,Strait of Hormuz,D1_초크포인트,2026-05-17
https://www.independent.ie/world-news/middle-east/israel-kills-hamas-armed-wing-leader-haddad-in-gaza-strike-and-how-iran-could-continue-a-shadow-war-with-the-us/a1326853175.html,c81b249b676eae6d73a69493fb619c6c,Israel kills Hamas armed wing leader Haddad in Gaza strike - and how Iran could continue a  shadow war  with the US,20260517T101500Z,independent.ie,English,Ireland,Strait of Hormuz,D1_초크포인트,2026-05-17
https://www.aljazeera.com/news/2026/5/17/iran-war-day-79-tehran-to-unveil-hormuz-toll-plan-israel-bombs-lebanon,1460e0fd9170c3bd241028174db80876,Iran war day 79 : Tehran to unveil Hormuz toll plan ; Israel bombs Lebanon | US - Israel war on Iran News,20260517T103000Z,aljazeera.com,English,United States,Strait of Hormuz,D1_초크포인트,2026-05-17
https://dailypioneer.com/news/india-condemns-attacks-on-ships-in-strait-of-hormuz-at-un,e54f9bdec4e805e55b504d16d185926b,India Condemns Attacks on Ships in Strait of Hormuz at United Nations,20260517T100000Z,dailypioneer.com,English,India,Strait of Hormuz,D1_초크포인트,2026-05-17
https://www.hindustantimes.com/india-news/lpg-tanker-carrying-20-000-tonnes-of-gas-reaches-gujarat-after-crossing-strait-of-hormuz-us-iran-war-101779000837826.html,12124789d2edae677817f9d495e7d53e,"LPG tanker carrying 20 , 000 tonnes of gas reaches Gujarat after crossing Strait of Hormuz , says report",20260517T080000Z,hindustantimes.com,English,India,Strait of Hormuz,D1_초크포인트,2026-05-17
https://dailypost.ng/2026/05/17/iran-considers-strait-of-hormuz-toll-amid-rising-middle-east-tensions/,9bf9cc601e1728468d466c53eb21c18e,Iran considers Strait of Hormuz toll amid rising Middle East tensions,20260517T121500Z,dailypost.ng,English,Nigeria,Strait of Hormuz,D1_초크포인트,2026-05-17
https://aa.com.tr/en/americas/us-outlines-5-conditions-for-iran-deal-report/3940137,69a2047ba420c3799694b4832feffd9f,US outlines 5 conditions for Iran deal : Report,20260517T130000Z,aa.com.tr,English,Turkey,Strait of Hormuz,D1_초크포인트,2026-05-17
https://www.businesstimes.com.sg/international/global/us-iran-stall-hormuz-strait-reopening-oil-supplies-tighten,28d3a523d01e9b44338e57159ab81c1e,"US , Iran stall on Hormuz strait reopening as oil supplies tighten",20260517T030000Z,businesstimes.com.sg,English,Singapore,Strait of Hormuz,D1_초크포인트,2026-05-17
https://economictimes.indiatimes.com/news/india/targeting-commercial-shipping-impeding-navigation-in-strait-of-hormuz-unacceptable-indias-un-envoy/articleshow/131147858.cms,d85080f61e5d884273e24e0af1ea998b,"Targeting commercial shipping , impeding navigation in Strait of Hormuz unacceptable : India UN envoy",20260517T023000Z,economictimes.indiatimes.com,English,India,Strait of Hormuz,D1_초크포인트,2026-05-17
https://www.khaama.com/us-israel-preparing-for-new-strikes-on-iran/,409543aed527f2c57c7e59bbaadda5a7,"US , Israel Preparing for New Strikes on Iran",20260517T113000Z,khaama.com,English,Afghanistan,Strait of Hormuz,D1_초크포인트,2026-05-17
https://news.webindia123.com/news/Articles/World/20260517/4451143.html,a5498917d0937590443cb700b4304bcf,Iran prepares a  professional mechanism  to manage Hormuz traffic,20260517T103000Z,news.webindia123.com,English,India,Strait of Hormuz,D1_초크포인트,2026-05-17
https://pragativadi.com/lpg-shipment-through-hormuz-20000-tonnes-reach-gujarats-kandla-port/,a8fc677d18c3d78db9757df1f16af04a,"20 , 000 Tonnes of LPG Arrive at Kandla Port - Pragativadi I Latest Odisha News in English I Breaking News",20260517T130000Z,pragativadi.com,English,India,Strait of Hormuz,D1_초크포인트,2026-05-17
https://timesofoman.com/article/171882-iran-prepares-a-professional-mechanism-to-manage-hormuz-traffic,8f552a7d176860ba6028d7780af32a29,Iran prepares a,20260517T043000Z,timesofoman.com,English,Oman,Strait of Hormuz,D1_초크포인트,2026-05-17
https://aninews.in/news/world/us/targeting-commercial-shipping-impeding-navigation-in-strait-of-hormuz-unacceptable-indias-permenant-representative-at-un20260517065141/,5f12b9410d93b8bbda11486cc86f43a8,"Targeting commercial shipping , impeding navigation in Strait of Hormuz unacceptable : India Permanent Representative at UN",20260517T034500Z,aninews.in,English,India,Strait of Hormuz,D1_초크포인트,2026-05-17
https://www.middleeasteye.net/live-blog/live-blog-update/morning-update-536,6c72d7d9f38e8452b30c9c5062ae9753,Morning update,20260517T091500Z,middleeasteye.net,English,Israel,Strait of Hormuz,D1_초크포인트,2026-05-17
https://www.nbcnews.com/world/rcna341374,40a2a0ee6c45a688cd61ab27aed55854,"As Hormuz crisis rattles the world , eyes are on another key waterway",20260517T171500Z,nbcnews.com,English,United States,Strait of Hormuz,D1_초크포인트,2026-05-17
https://www.rawstory.com/iran-war-2676905925/,993ab72d30ff9eaa85152bc4d983c876,  Critical point  for consumer shortages flagged as  emergency buffers fail simultaneously  ,20260517T170000Z,rawstory.com,English,United States,Strait of Hormuz,D1_초크포인트,2026-05-17
https://www.moneycontrol.com/world/how-the-iran-war-has-crippled-one-of-world-s-richest-nations-article-13921599.html,e38aa2f32c5fa12d37c9b202416a13df,How the Iran war has crippled one of world richest nations,20260517T150000Z,moneycontrol.com,English,India,Strait of Hormuz,D1_초크포인트,2026-05-17
http://thepeninsulaqatar.com/article/17/05/2026/oil-prices-climb-over-3-on-fears-of-new-us-iran-combat,8bdf4556a414c3f5dc680953e064be11,Oil prices climb over 3 % on fears of new US - Iran combat,20260517T103000Z,thepeninsulaqatar.com,English,Qatar,Strait of Hormuz,D1_초크포인트,2026-05-17
https://www.thehindubusinessline.com/economy/india-eyes-oman-reroute-to-rescue-118-billion-food-exports-to-west-asia/article70990277.ece,f0a04be9826de64770c4cfc5a6bfc358,India taps Oman to rescue $11 . 8 billion food exports to West Asia,20260517T193000Z,thehindubusinessline.com,English,India,Strait of Hormuz,D1_초크포인트,2026-05-17
https://www.moneycontrol.com/world/trump-and-netanyahu-discuss-iran-war-as-us-israel-strike-fears-intensify-article-13921645.html,a9cca516180170b3f62f6888bb3cc278,Trump and Netanyahu discuss Iran war as US - Israel strike fears intensify,20260517T174500Z,moneycontrol.com,English,India,Strait of Hormuz,D1_초크포인트,2026-05-17
https://www.prokerala.com/news/articles/a1764039.html,bba73f71d4f791efa01a054fbbcd0c5d,South Korean FM urges Tehran to clarify stance on attack on HMM Namu vessel,20260517T163000Z,prokerala.com,English,India,Strait of Hormuz,D1_초크포인트,2026-05-17
https://fortune.com/2026/05/16/us-trump-iran-war-ceasefire-strait-of-hormuz-reopening-oil-supplies-china-summit/,dadd0b18ab67756ecce7885a0b7dd69c,"U . S ., Iran stall on Hormuz reopening as oil supplies tighten",20260517T004500Z,fortune.com,English,United States,Strait of Hormuz,D1_초크포인트,2026-05-17
https://kaieteurnewsonline.com/2026/05/17/iran-has-no-trust-in-u-s-will-negotiate-only-if-it-is-serious-araqchi-says/,86d581be95bab1b04da6869ca3d7f4f3,"Iran has  no trust  in U . S ., will negotiate only if it is serious , Araqchi says",20260517T071500Z,kaieteurnewsonline.com,English,Guyana,Strait of Hormuz,D1_초크포인트,2026-05-17
https://www.zerohedge.com/economics/why-one-bank-thinks-its-magical-thinking-hormuz-reopens-june,7be2de823d0197b85c837caeeaef897b,Why One Bank Thinks It  Magical Thinking  That Hormuz Reopens In June,20260517T040000Z,zerohedge.com,English,United States,Strait of Hormuz,D1_초크포인트,2026-05-17
https://timesofindia.indiatimes.com/business/india-business/20000-tonne-lpg-carrier-symi-arrives-in-gujarat-after-crossing-strait-of-hormuz/articleshow/131148631.cms,d270b6e26a76bbb2384c8d731b7aa37a,"20 , 000 - tonne LPG carrier Symi arrives in Gujarat after crossing Strait of Hormuz",20260517T054500Z,timesofindia.indiatimes.com,English,India,Strait of Hormuz,D1_초크포인트,2026-05-17
https://economictimes.indiatimes.com/news/international/world-news/a-drone-strike-causes-fire-outside-a-nuclear-power-plant-in-abu-dhabi/articleshow/131152619.cms,1a919d017b98ec32f092436bda390152,A drone strike causes fire outside a nuclear power plant in Abu Dhabi,20260517T113000Z,economictimes.indiatimes.com,English,India,Strait of Hormuz,D1_초크포인트,2026-05-17
https://www.thehindu.com/news/international/calm-before-storm-donald-trumps-warning-sparks-alarm-over-possible-iran-strikes-signals-escalation-in-west-asia/article70990035.ece,44d94c11919495d31b752a213cb8e8c7,"  Calm before storm : Donald Trump warning sparks alarm over possible Iran strikes , signals escalation in West Asia",20260517T101500Z,thehindu.com,English,India,Strait of Hormuz,D1_초크포인트,2026-05-17
https://www.prokerala.com/news/articles/a1763860.html,f57257302ae32b2f8b21c5a8bd6db5e6,"US - Iran tensions , crude oil spike , Q4 earnings among key factors likely to drive Dalal Street",20260517T060000Z,prokerala.com,English,India,Strait of Hormuz,D1_초크포인트,2026-05-17
https://www.lbc.co.uk/article/uae-drone-strike-nuclear-power-plant-5HjdZHr_2/,5a4d7cdacebdb3c958d9e12efc101953,UAE reports drone strike at nuclear power plant as Iran war deadlock endures,20260517T163000Z,lbc.co.uk,English,United Kingdom,Strait of Hormuz,D1_초크포인트,2026-05-17
https://www.koreatimes.co.kr/foreignaffairs/20260517/leaders-of-korea-japan-likely-to-discuss-implications-of-us-china-summit,f71ed6b1c53e86ffad0b74c27d2a4b0e,"Leaders of Korea , Japan likely to discuss implications of US - China summit",20260517T090000Z,koreatimes.co.kr,English,South Korea,Strait of Hormuz,D1_초크포인트,2026-05-17
https://www.middleeasteye.net/live-blog/live-blog-update/iran-warns-it-ready-renewed-war-if-talks-fail,b7b24b68071ed3a6972e81b306ba52c6,Iran warns it is ready for renewed war if talks fail,20260517T041500Z,middleeasteye.net,English,Israel,Strait of Hormuz,D1_초크포인트,2026-05-17
https://finance.yahoo.com/markets/stocks/articles/stocks-bonds-swept-selloff-trump-205700151.html,242b04df126b2586a26a5b539a49928f,"Stocks and bonds get swept up in a selloff , as Trump China visit fails to pry open the Strait of Hormuz",20260517T041500Z,finance.yahoo.com,English,United States,Strait of Hormuz,D1_초크포인트,2026-05-17
https://finance.yahoo.com/sectors/energy/articles/uae-double-oil-export-capacity-084434921.html,320be01246ab9b2ad9b3ed2d10e72396,UAE Will Double Oil Export Capacity Bypassing Hormuz by 2027,20260517T000000Z,finance.yahoo.com,English,United States,Strait of Hormuz,D1_초크포인트,2026-05-17
https://www.fool.com/investing/2026/05/17/heres-why-venture-global-stock-soared-243-this-wee/?source=iedfolrf0000001,14ffebe9a688fd42ff2119fd7f628738,Here Why Venture Global Stock Soared 24 . 3 % This Week,20260517T110000Z,fool.com,English,United States,Strait of Hormuz,D1_초크포인트,2026-05-17
https://www.hindustantimes.com/world-news/drone-strike-causes-fire-at-uae-barakah-nuclear-power-plant-in-abu-dhabi-us-iran-war-101779013182458.html,87fee3b8acd177d9d61db7c33a1746c2,Drone strike causes fire at UAE Barakah Nuclear Power Plant in Abu Dhabi,20260517T111500Z,hindustantimes.com,English,India,Strait of Hormuz,D1_초크포인트,2026-05-17
https://www.ibtimes.co.in/calm-before-storm-trumps-warning-sparks-alarm-over-possible-iran-strikes-signals-escalation-902117,509033ea9a0786cb0e33f63c691111b0,"  Calm before storm : Trump warning sparks alarm over possible Iran strikes , signals escalation in Middle East",20260517T120000Z,ibtimes.co.in,English,India,Strait of Hormuz,D1_초크포인트,2026-05-17
https://www.theepochtimes.com/world/us-allows-sanctions-waiver-on-russian-oil-to-expire-6026965,eee3f8b55c1571be97ff31b77ecb7809,US Allows Sanctions Waiver on Russian Oil to Expire,20260517T150000Z,theepochtimes.com,English,United States,Strait of Hormuz,D1_초크포인트,2026-05-17
https://www.moneycontrol.com/world/not-politics-strategy-uae-explains-why-it-walked-out-of-opec-article-13921341.html,8cdf133fa8bfbcbb4e9a87284baab740,"Not politics , strategy : UAE explains why it walked out of OPEC",20260517T054500Z,moneycontrol.com,English,India,Strait of Hormuz,D1_초크포인트,2026-05-17
https://www.middleeasteye.net/live-blog/live-blog-update/us-centcom-says-78-vessels-redirected-under-iran-blockade,f5c42417eb601f6ffc78366d36d18d69,US Centcom says 78 vessels redirected under Iran blockade,20260517T041500Z,middleeasteye.net,English,Israel,Strait of Hormuz,D1_초크포인트,2026-05-17
https://finance.yahoo.com/markets/articles/louis-navellier-sends-message-markets-194657422.html,36ab10e5abe30626916845c65ab42888,"Louis Navellier sends message as markets stumble , bond rates surge",20260517T023000Z,finance.yahoo.com,English,United States,Strait of Hormuz,D1_초크포인트,2026-05-17
https://www.prokerala.com/news/articles/a1763834.html,c2d03336e932c074ee2d54a0376cc4f3,"  Calm before storm : Trump warning sparks alarm over possible Iran strikes , signals escalation in Middle East",20260517T060000Z,prokerala.com,English,India,Strait of Hormuz,D1_초크포인트,2026-05-17
https://www.freepressjournal.in/world/calm-before-the-storm-us-president-trumps-warning-sparks-alarm-over-possible-iran-strikes-signals-escalation-in-middle-east,d9ce2c0c1a05803baa0e0d76c0cb0b6c,"  Calm Before The Storm : US President Trump Warning Sparks Alarm Over Possible Iran Strikes , Signals Escalation In Middle East",20260517T070000Z,freepressjournal.in,English,India,Strait of Hormuz,D1_초크포인트,2026-05-17
https://www.freepressjournal.in/business/india-may-negotiate-oil-transit-routes-with-iran-moodys-warns-brent-crude-could-stay-between-90-110,3b2b13999fc36ea51088e7880a85f33d,"India May Negotiate Oil Transit Routes With Iran , Moody Warns Brent Crude Could Stay Between $90 - $110",20260517T103000Z,freepressjournal.in,English,India,Strait of Hormuz,D1_초크포인트,2026-05-17
https://timesofoman.com/article/171885-rupee-depreciation-can-wipe-out-gains-from-fuel-price-hike-sbi-research,2c46198b9eccea7fab64799f8ceb3738,Rupee depreciation can wipe out gains from fuel price hike : SBI Research,20260517T043000Z,timesofoman.com,English,Oman,Strait of Hormuz,D1_초크포인트,2026-05-17
https://www.fox5atlanta.com/news/iran-latest-may-17,5b8252766c0680e938ff099dbb2bcff0,Iran latest : Trump suggests fighting could resume as Iran prepares public for war,20260517T190000Z,fox5atlanta.com,English,United States,Strait of Hormuz,D1_초크포인트,2026-05-17
https://www.thestar.com.my/aseanplus/aseanplus-news/2026/05/17/pakistan-makes-fresh-bid-to-revive-us-iran-talks,5cc5c7f8a5c986f9625a90ea3431f3dd,Pakistan makes fresh bid to revive US - Iran talks,20260517T084500Z,thestar.com.my,English,Malaysia,Strait of Hormuz,D1_초크포인트,2026-05-17
https://www.winnipegfreepress.com/business/2026/05/17/a-drone-strike-causes-fire-outside-a-nuclear-power-plant-in-abu-dhabi,6d92c1320cd18f4a5bb114b80485837c,A drone strike causes fire outside a nuclear power plant in Abu Dhabi – Winnipeg Free Press,20260517T110000Z,winnipegfreepress.com,English,Canada,Strait of Hormuz,D1_초크포인트,2026-05-17
https://www.fox10phoenix.com/news/iran-latest-may-17,7303a76b6ceb41efa5421576ffbc23ea,Iran latest : Trump suggests fighting could resume as Iran prepares public for war,20260517T174500Z,fox10phoenix.com,English,United States,Strait of Hormuz,D1_초크포인트,2026-05-17
https://www.fox29.com/news/iran-latest-may-17,2e78350ca8316e7cdff5b46ef82e4378,Iran latest : Trump suggests fighting could resume as Iran prepares public for war,20260517T153000Z,fox29.com,English,United States,Strait of Hormuz,D1_초크포인트,2026-05-17
https://malawi24.com/2026/05/17/no-international-waters-on-strait-of-hormuz-iran/,87b662e53ab843dcaa303f3e118b8b89,  No international waters on Strait of Hormuz  Iran,20260517T020000Z,malawi24.com,English,Malawi,Strait of Hormuz,D1_초크포인트,2026-05-17
https://www.siasat.com/trump-warns-iran-of-very-bad-time-if-no-peace-deal-is-reached-3472340/,437996b44fdbfd2d88f046b5894fd4a4,Trump warns Iran of  very bad time  if no peace deal is reached,20260517T034500Z,siasat.com,English,India,Strait of Hormuz,D1_초크포인트,2026-05-17
https://finance.yahoo.com/sectors/energy/articles/oil-markets-could-month-away-190842717.html,9ded253da3615dc5a6cc70a3a6e2984f,"Oil markets could be a month away from the moment of truth . Brace for a  non - linear  price spike and panic buying , analysts warn",20260517T010000Z,finance.yahoo.com,English,United States,Strait of Hormuz,D1_초크포인트,2026-05-17
https://finance.yahoo.com/markets/stocks/articles/heres-why-venture-global-stock-083926660.html,c289d8659613e00bec1e6fce0a0517e9,Here Why Venture Global Stock Soared 24 . 3 % This Week,20260517T091500Z,finance.yahoo.com,English,United States,Strait of Hormuz,D1_초크포인트,2026-05-17
https://www.samaa.tv/2087350751-iran-warns-it-is-ready-for-war-if-us-talks-collapse,fad0e32c181e9d7b55039e7905417f34,Iran warns it is ready for war If US talks collapse,20260517T073000Z,samaa.tv,English,Pakistan,Strait of Hormuz,D1_초크포인트,2026-05-17
https://nationalpost.com/news/u-s-iran-war-hormuz-uae-drone-nuclear-plant,faeefaae2fa427c7f368c4352af08c31,"U . S ., Iran still far apart on war end , Hormuz as drone hits UAE",20260517T153000Z,nationalpost.com,English,Canada,Strait of Hormuz,D1_초크포인트,2026-05-17
https://www.philstar.com/nation/2026/05/18/2528660/2-philippine-seafarers-drone-hit-ship-back-home,e6620e8d1ba0527adabe4d3a7d8036b1,2 Philippine seafarers on drone - hit ship back home,20260517T163000Z,philstar.com,English,Philippines,Strait of Hormuz,D1_초크포인트,2026-05-17
