url,url_hash,title,seendate,domain,language,sourcecountry,query_keyword,query_group,collect_date
https://www.irvinetimes.com/news/national/26113640.police-call-discussions-officers-injured-celtic-celebrations/,67f9045fa8dc5069602e6343448303a9,Police call for discussions after officers injured during Celtic celebrations,20260517T053000Z,irvinetimes.com,English,United Kingdom,disruption,D6_교란행위,2026-05-17
https://www.thisiswiltshire.co.uk/news/national/26113640.police-call-discussions-officers-injured-celtic-celebrations/,041b046ea8b781c9e2a81cf635bde03d,Police call for discussions after officers injured during Celtic celebrations,20260517T060000Z,thisiswiltshire.co.uk,English,United Kingdom,disruption,D6_교란행위,2026-05-17
https://www.heraldseries.co.uk/news/national/26113640.police-call-discussions-officers-injured-celtic-celebrations/,6a849bbb8669a7cbf150156c6350d1d3,Police call for discussions after officers injured during Celtic celebrations,20260517T061500Z,heraldseries.co.uk,English,United Kingdom,disruption,D6_교란행위,2026-05-17
https://www.milfordmercury.co.uk/news/national/26113640.police-call-discussions-officers-injured-celtic-celebrations/,b1ada20a54a0ffec78f88a5a452620aa,Police call for discussions after officers injured during Celtic celebrations,20260517T054500Z,milfordmercury.co.uk,English,United Kingdom,disruption,D6_교란행위,2026-05-17
https://www.wiltshiretimes.co.uk/news/national/26113640.police-call-discussions-officers-injured-celtic-celebrations/,a1dd31936d665e11bf3f07fe83b84d9a,Police call for discussions after officers injured during Celtic celebrations,20260517T054500Z,wiltshiretimes.co.uk,English,United Kingdom,disruption,D6_교란행위,2026-05-17
https://www.gazetteseries.co.uk/news/national/26113640.police-call-discussions-officers-injured-celtic-celebrations/,1e9d59c2979d500239764a0bb0fd45f8,Police call for discussions after officers injured during Celtic celebrations,20260517T054500Z,gazetteseries.co.uk,English,United Kingdom,disruption,D6_교란행위,2026-05-17
https://www.watfordobserver.co.uk/news/national/26113640.police-call-discussions-officers-injured-celtic-celebrations/,28e1bce05b36c61b58a44076bbb4b9d2,Police call for discussions after officers injured during Celtic celebrations,20260517T061500Z,watfordobserver.co.uk,English,United Kingdom,disruption,D6_교란행위,2026-05-17
https://www.ledburyreporter.co.uk/news/national/26113640.police-call-discussions-officers-injured-celtic-celebrations/,489ffc45bc0484cbccc032e66126e117,Police call for discussions after officers injured during Celtic celebrations,20260517T070000Z,ledburyreporter.co.uk,English,United Kingdom,disruption,D6_교란행위,2026-05-17
https://www.readingchronicle.co.uk/news/national/26113640.police-call-discussions-officers-injured-celtic-celebrations/,f335e4a23aa05c93cef593e408e4f5ef,Police call for discussions after officers injured during Celtic celebrations,20260517T070000Z,readingchronicle.co.uk,English,United Kingdom,disruption,D6_교란행위,2026-05-17
https://timesofindia.indiatimes.com/city/ranchi/jamshedpur-fuel-shortage-rumors-spark-panic-buying-administration-intervenes/articleshow/131154168.cms,b46c3063d825f947a7dd96add3e4039a,"Jamshedpur Fuel Shortage Rumors Spark Panic Buying , Administration Intervenes | Ranchi News",20260517T130000Z,timesofindia.indiatimes.com,English,India,shortage,D6_교란행위,2026-05-17
https://timesofindia.indiatimes.com/technology/tech-news/nvidia-billionaire-mark-stevens-donates-175-million-to-build-silicon-valleys-first-medical-school-in-100-years/articleshow/131145151.cms,b551fa76ac6fb98d4ec6eb7f792ebc6c,Nvidia billionaire Mark Stevens donates $175 million to build Silicon Valley first medical school in 100 years,20260517T054500Z,timesofindia.indiatimes.com,English,India,shortage,D6_교란행위,2026-05-17
https://www.freepressjournal.in/pune/pune-maharashtra-government-to-announce-farm-loan-waiver-before-june-30-says-cm-devendra-fadnavis,b524f120c5afc91eb3a28ef8831d5ddc,"Pune : Maharashtra Government To Announce Farm Loan Waiver Before June 30 , Says CM Devendra Fadnavis",20260517T150000Z,freepressjournal.in,English,India,shortage,D6_교란행위,2026-05-17
https://www.trend.az/azerbaijan/society/4187186.html,71179eb055c8b480b6ea7a4fa0ff9518,Closing statement on results of WUF13 first day delivered,20260517T150000Z,trend.az,English,Azerbaijan,shortage,D6_교란행위,2026-05-17
https://www.kake.com/home/wichita-swim-business-says-more-awareness-could-fix-citys-lifeguard-shortage/article_7570bf47-a710-4f2c-886f-b38174ae9c43.html,c811cd025a0e9bb9e58dcbfaf16bb7f6,Wichita swim business says more awareness could fix city lifeguard shortage,20260517T041500Z,kake.com,English,United States,shortage,D6_교란행위,2026-05-17
https://www.ewn.co.za/2026/05/17/anti-gbv-group-demands-accountability-over-delayed-distribution-of-rape-kits-to-western-cape-saps,d1b2829bfed63516e9f17c5e4599f2a5,Anti - GBV group demands accountability over delayed distribution of rape kits to Western Cape SAPS,20260517T080000Z,ewn.co.za,English,South Africa,shortage,D6_교란행위,2026-05-17
https://www.trend.az/azerbaijan/4186881.html,5b84bc1e6b1813e573dd1e1e2a01e820,WUF13 coordinator names housing key theme of sustainable development,20260517T070000Z,trend.az,English,Azerbaijan,shortage,D6_교란행위,2026-05-17
https://www.boredpanda.com/funny-animal-behaviors/?cexp_id=153313&cexp_var=24&_f=homepage_featured,9a3bdda60b3ec5eeed4a5fd94f885727,81 Funny And Wholesome Animal Memes To Help You Ignore All The Chaos Around You,20260517T060000Z,boredpanda.com,English,United States,shortage,D6_교란행위,2026-05-17
https://www.boredpanda.com/funny-animal-behaviors/,fe09440f91d4f13837f39b4263efd368,81 Funny And Wholesome Animal Memes To Help You Ignore All The Chaos Around You,20260517T000000Z,boredpanda.com,English,United States,shortage,D6_교란행위,2026-05-17
https://www.boredpanda.com/funny-animal-behaviors/?cexp_id=153314&cexp_var=0&_f=homepage_featured,f8931c24cccf9c4e8096375e5b7a9189,81 Funny And Wholesome Animal Memes To Help You Ignore All The Chaos Around You,20260517T000000Z,boredpanda.com,English,United States,shortage,D6_교란행위,2026-05-17
https://www.boredpanda.com/funny-animal-behaviors/?cexp_id=153314&cexp_var=2&_f=homepage_featured,ca5ae6c1ac1f4caf668852e807d8a296,81 Funny And Wholesome Animal Memes To Help You Ignore All The Chaos Around You,20260517T034500Z,boredpanda.com,English,United States,shortage,D6_교란행위,2026-05-17
https://www.boredpanda.com/funny-animal-behaviors/?cexp_id=153313&cexp_var=1&_f=homepage_featured,9ff25b4cbfed41957ad9f0ef7ff07d47,81 Funny And Wholesome Animal Memes To Help You Ignore All The Chaos Around You,20260517T094500Z,boredpanda.com,English,United States,shortage,D6_교란행위,2026-05-17
https://www.boredpanda.com/funny-animal-behaviors/?cexp_id=153314&cexp_var=9&_f=homepage_featured,4b31d9738101a25a1e1effbe4c073b4c,81 Funny And Wholesome Animal Memes To Help You Ignore All The Chaos Around You,20260517T090000Z,boredpanda.com,English,United States,shortage,D6_교란행위,2026-05-17
https://www.tribuneindia.com/news/haryana/hospitals-without-doctors-are-just-buildings-high-court-orders-haryana-ayush-overhaul/,23ff4200200f76191c3cc9477fe57de7,  Hospitals without doctors are just building : High Court orders Haryana AYUSH overhaul,20260517T164500Z,tribuneindia.com,English,India,shortage,D6_교란행위,2026-05-17
https://www.freepressjournal.in/bhopal/beyond-the-galleries-staff-crunch-plagues-bhopals-vibrant-museum-hub,a23adcdea886bfaf9a3ab2b06530435c,Beyond The Galleries : Staff Crunch Plagues Bhopal Vibrant Museum Hub,20260517T184500Z,freepressjournal.in,English,India,shortage,D6_교란행위,2026-05-17
https://www.fijivillage.com/news/bernard-and-dr-naisele-to-appear-on-fijivillage-straight-talk-on-national-skills-gap-survey-report-2d94ce/,7a75180682ad247699d99788ccaaf489,Bernard and Dr Naisele to appear on fijivillage Straight Talk on National Skills Gap Survey Report,20260517T090000Z,fijivillage.com,English,Fiji,shortage,D6_교란행위,2026-05-17
https://www.thehindu.com/news/national/kerala/kerala-state-electricity-board-eyes-power-procurement-to-meet-peak-demand-during-mid-june-to-december/article70990053.ece,08d8727726293bb4ec2d7d00255afe48,Kerala State Electricity Board eyes power procurement to meet peak demand during mid - June to December,20260517T123000Z,thehindu.com,English,India,shortage,D6_교란행위,2026-05-17
https://www.newindianexpress.com/states/andhra-pradesh/2026/May/17/lanka-expresses-concern-over-deaths-at-nephroplus-dialysis-unit-in-kakinada,0f7a15832f369bf62953207deea13c15,Lanka expresses concern over deaths at Nephroplus Dialysis Unit in Kakinada,20260517T073000Z,newindianexpress.com,English,India,shortage,D6_교란행위,2026-05-17
https://www.jamaicaobserver.com/2026/05/17/20-bed-boost-mandeville-regionals-paediatric-ward/,32509b64106717dcd8a870f25241343a,20 - bed boost for Mandeville Regional paediatric ward,20260517T094500Z,jamaicaobserver.com,English,Jamaica,shortage,D6_교란행위,2026-05-17
https://www.heraldscotland.com/news/26113814.proposed-housing-development-near-airdrie-refused-planning-permission/,73688bc5b14b1b9544ce75d92c6207d3,Proposed housing development near Airdrie refused planning permission,20260517T130000Z,heraldscotland.com,English,United Kingdom,shortage,D6_교란행위,2026-05-17
https://www.standardmedia.co.ke/business/business/article/2001548043/kenyas-cybersecurity-skills-gap-persists-despite-training-efforts,f61af88ce791398745cbc88e3c4a259c,Kenya cybersecurity skills gap persists despite training efforts,20260517T121500Z,standardmedia.co.ke,English,Kenya,shortage,D6_교란행위,2026-05-17
https://www.deccanchronicle.com/southern-states/andhra-pradesh/increased-fuel-prices-disrupt-international-flights-from-ap-1957405,54f7b4c60e96d8cdfb3a1de6c4496787,Increased Fuel Prices Disrupt International Flights From AP,20260517T184500Z,deccanchronicle.com,English,India,shortage,D6_교란행위,2026-05-17
https://www.tribuneindia.com/news/punjab/ravi-beas-waters-tribunal-to-meet-punjab-cm-bhagwant-mann-in-amritsar-today/,93792798927f10801fbe8fea98770186,Ravi - Beas Waters Tribunal to meet Punjab CM Bhagwant Mann in Amritsar today,20260517T040000Z,tribuneindia.com,English,India,shortage,D6_교란행위,2026-05-17
https://www.theadvocate.com.au/story/9246285/tasmanian-foster-care-system-under-strain-children-in-shift-care/,4f099f43c17bc268f033c8bbee613d55,"Tasmanian foster care system under strain , children in shift care | The Advocate",20260517T193000Z,theadvocate.com.au,English,Australia,shortage,D6_교란행위,2026-05-17
https://news.webindia123.com/news/Articles/India/20260517/4451209.html,4639c1befcde55639b07dba0e901b2bc,  There is no fertiliser : Congress leader Bhupesh Baghel slams Centre,20260517T070000Z,news.webindia123.com,English,India,shortage,D6_교란행위,2026-05-17
https://news.webindia123.com/news/Articles/World/20260517/4451264.html,c5f3287e03505f169b8d53e4c932759b,Pakistan : Hyderabad water collapse deepens as heatwave pushes residents to brink,20260517T103000Z,news.webindia123.com,English,India,shortage,D6_교란행위,2026-05-17
https://www.reviewjournal.com/opinion/letters/letter-paying-lip-service-to-traffic-safety-3825385/,6615f75b8ee36a81751c9a75d0846cdf,LETTER : Paying lip service to traffic safety,20260517T061500Z,reviewjournal.com,English,United States,shortage,D6_교란행위,2026-05-17
https://aninews.in/news/world/asia/pakistan-hyderabads-water-collapse-deepens-as-heatwave-pushes-residents-to-brink20260517143136/,ea6262b3b27496f5778091536144727b,Pakistan : Hyderabad water collapse deepens as heatwave pushes residents to brink,20260517T094500Z,aninews.in,English,India,shortage,D6_교란행위,2026-05-17
https://www.derbytelegraph.co.uk/news/derby-news/new-use-significant-refurbishment-planned-10968738,b2b0fd408f5c3182d17189f7fd3170fb,New use and  significant refurbishment  planned for Derby care home,20260517T100000Z,derbytelegraph.co.uk,English,United Kingdom,shortage,D6_교란행위,2026-05-17
https://timesofindia.indiatimes.com/blogs/voices/construction-4-0-shaping-the-future-of-smart-and-sustainable-infrastructure/,02e6e0596fa39e93a04febb8694b4c74,Construction 4 . 0 : Shaping the future of smart and sustainable infrastructure,20260517T121500Z,timesofindia.indiatimes.com,English,India,shortage,D6_교란행위,2026-05-17
https://www.businessinsider.com/apple-iphone-17-sales-rise-amid-samsung-galaxy-s26-delay-2026-5,da2891a51b8b4a0e8931c61526cf6168,Apple iPhone 17 Sales Rise Amid Samsung Galaxy S26 Delay,20260517T111500Z,businessinsider.com,English,United States,shortage,D6_교란행위,2026-05-17
https://www.mlbtraderumors.com/2026/05/reds-announce-five-roster-moves.html/email,c9c41db216904f284f6b7fd66e4adb1c,Reds Announce Five Roster Moves,20260517T183000Z,mlbtraderumors.com,English,United States,shortage,D6_교란행위,2026-05-17
https://bleacherreport.com/articles/25428476-ronda-rousey-vs-gina-carano-judges-scorecards-fight-stats-and-prize-money,b84e027d548f7231ccebabf1abcd2379,"Ronda Rousey vs . Gina Carano Judge Scorecards , Fight Stats and Prize Money",20260517T063000Z,bleacherreport.com,English,United States,shortage,D6_교란행위,2026-05-17
https://fortune.com/2026/05/16/ai-job-market-leverage-older-workers-entry-level-positions/,d5db137257e8d5ef3ded8c06ccb28d8b,AI poised to tilt job market leverage toward older workers,20260517T004500Z,fortune.com,English,United States,shortage,D6_교란행위,2026-05-17
https://trinidadexpress.com/news/local/no-prosecutors-for-new-courts/article_ce57024d-7f5c-40a7-bfdd-55da0a09792e.html,1963e88de5cc9de374b6f2a9ae6dc2dd,No prosecutors for new courts,20260517T111500Z,trinidadexpress.com,English,Trinidad and Tobago,shortage,D6_교란행위,2026-05-17
https://www.manilatimes.net/2026/05/18/world/americas-emea/bolivian-police-clash-with-protesters-blocking-roads/2345653,b6a8526e1f786f327d7616f45345b6a6,Bolivian police clash with protesters blocking roads,20260517T194500Z,manilatimes.net,English,Philippines,shortage,D6_교란행위,2026-05-17
https://www.newindianexpress.com/thesundaystandard/2026/May/17/hal-iaf-tejas-mk-1a-review-pushed-to-june-iaf-weighing-further-relaxations,8a2dc5cc4dd3cf67133e0168934aa139,HAL - IAF Tejas Mk - 1A review pushed to June ; IAF weighing further relaxations,20260517T030000Z,newindianexpress.com,English,India,shortage,D6_교란행위,2026-05-17
https://www.theborneopost.com/2026/05/17/rebranding-construction-to-attract-young-talents/,4afc1001a13cfc6340fff910e161068c,Rebranding construction to attract young talents,20260517T030000Z,theborneopost.com,English,Malaysia,shortage,D6_교란행위,2026-05-17
https://www.koreatimes.co.kr/business/companies/20260517/korail-chief-signals-1st-fare-hike-in-15-years-amid-mounting-debt,6bbc6cb7cdf38e97e3c3d5dbd20b6168,KORAIL chief signals 1st fare hike in 15 years amid mounting debt,20260517T040000Z,koreatimes.co.kr,English,South Korea,shortage,D6_교란행위,2026-05-17
https://www.theborneopost.com/2026/05/17/sabah-oil-palms-second-wind-part-1/,ccd07bae2f364fabdf988c084696ff80,Sabah oil palm second wind ( Part 1 ) | Borneo Post Online,20260517T030000Z,theborneopost.com,English,Malaysia,shortage,D6_교란행위,2026-05-17
https://www.hindustantimes.com/india-news/why-cbse-made-3-language-study-compulsory-in-class-9-and-10-what-students-can-choose-as-third-option-101778993270623.html,91531cbe11373008989af1101bd88fc1,  2 must be Indian : Why CBSE made 3 - language study compulsory in class 9 and 10,20260517T060000Z,hindustantimes.com,English,India,shortage,D6_교란행위,2026-05-17
https://www.irishtimes.com/health/2026/05/17/patient-on-trolley-in-hospital-corridor-for-15-hours-felt-invisible/,2670b516870eb81c55d5d06e213468e0,Patient on trolley in hospital corridor for 15 hours felt  invisible  – The Irish Times,20260517T110000Z,irishtimes.com,English,Ireland,shortage,D6_교란행위,2026-05-17
https://www.hindustantimes.com/india-news/centre-notifies-ordinance-to-add-four-judges-to-supreme-court-101778991407982.html,a1ed4a4d90d20a87882d9ec0c10061c0,Centre notifies ordinance to add four judges to Supreme Court,20260517T060000Z,hindustantimes.com,English,India,shortage,D6_교란행위,2026-05-17
https://www.guampdn.com/opinion/columnists/opinion-yamashita-beyond-muddy-waters/article_a03b651e-c2a5-4e71-9bad-0bdb06e0447f.html,0371927a46ec5e149201b8fb77f42ea7,OPINION Yamashita : Beyond muddy waters,20260517T190000Z,guampdn.com,English,Guam,shortage,D6_교란행위,2026-05-17
https://timesofindia.indiatimes.com/etimes/wellness/canada-confirms-first-hantavirus-case-linked-to-mv-hondius-cruise-ship-outbreak-passenger-in-british-columbia-in-isolation/articleshow/131148047.cms,b114d2fe95adb166a0e6680803e882f2,Canada confirms first hantavirus case linked to MV Hondius cruise ship outbreak : Passenger in British Columbia in isolation,20260517T041500Z,timesofindia.indiatimes.com,English,India,shortage,D6_교란행위,2026-05-17
https://www.echo-news.co.uk/news/26087180.basildon-send-provision-needs-work-despite-2-6m-boost/,0845dc897f1d945f30dc2b921762e413,Basildon SEND provision needs work despite £2 . 6m boost,20260517T053000Z,echo-news.co.uk,English,United Kingdom,shortage,D6_교란행위,2026-05-17
https://economictimes.indiatimes.com/news/india/hobby-to-hustle-six-years-ago-the-pandemic-and-lockdowns-sparked-a-wave-of-micro-entrepreneurs-heres-how-some-built-to-last/articleshow/131148131.cms,16fcdae901803aa6c54ebab3d08e88fb,"Hobby to hustle : Six years ago , the pandemic and lockdowns sparked a wave of micro - entrepreneurs . Here how some built to last",20260517T034500Z,economictimes.indiatimes.com,English,India,shortage,D6_교란행위,2026-05-17
https://www.israelnationalnews.com/news/427211,6665950664002dfe6e7cf57244848f2a,"IDF reports shortage of 12 , 000 troops",20260517T184500Z,israelnationalnews.com,English,Israel,shortage,D6_교란행위,2026-05-17
https://fortune.com/2026/05/17/ai-boom-cheap-offshore-call-center-labor-employment-jevons-paradox/,c09cad01b362a93f3008b8c4e58daf9a,The AI boom hasnt stopped U . S . companies from hiring cheap offshore workers,20260517T150000Z,fortune.com,English,United States,shortage,D6_교란행위,2026-05-17
https://freerepublic.com/focus/f-news/4379653/posts,6c2c6e38a7a342ceb52b0a5ceefbd96a,Sunday Morning Talk Show Thread 17 May 2026,20260517T130000Z,freerepublic.com,English,United States,shortage,D6_교란행위,2026-05-17
https://www.koreaherald.com/article/10739465,e9923f6b3d8be573e2e18f09a4943c55,Misinformation on May 18 Democracy Uprising rises despite law,20260517T053000Z,koreaherald.com,English,South Korea,shortage,D6_교란행위,2026-05-17
https://www.clickorlando.com/entertainment/2026/05/16/the-10-best-performances-at-the-2026-eurovision-song-contest/,533767090072e9b977c169cff994dbf3,The 10 best performances at the 2026 Eurovision Song Contest,20260517T000000Z,clickorlando.com,English,United States,shortage,D6_교란행위,2026-05-17
https://www.lmtonline.com/local/article/gma13-water-planning-laredo-response-legal-dispute-22261171.php,15f5f7b35f7ae6693814c67b1ed6663f,Laredo challenges GMA - 13 groundwater allocation decisions,20260517T184500Z,lmtonline.com,English,United States,shortage,D6_교란행위,2026-05-17
https://www.rte.ie/news/analysis-and-comment/2026/0517/1573748-uk-starmer-analysis/,0485f72af3172702d7c8edf6eb8a0a2b,Why Britain has turned on its cautious prime minister,20260517T080000Z,rte.ie,English,Ireland,shortage,D6_교란행위,2026-05-17
https://www.abqjournal.com/news/new-mexico-cancer-center-urology-department-faces-possible-closure/3040590,d51b80edb4c35b6160ad300144917a6d,New Mexico Cancer Center urology department faces possible closure amid doctor shortage,20260517T163000Z,abqjournal.com,English,United States,shortage,D6_교란행위,2026-05-17
https://www.bostonglobe.com/2026/05/17/metro/boys-boosted-by-technical-schools-gaps-in-education/,7a983bbc70dc02db6436061a85528001,Gender and education : the role of vocational schools for boys,20260517T153000Z,bostonglobe.com,English,United States,shortage,D6_교란행위,2026-05-17
https://www.thedailystar.net/business/economy/national-budget/news/improve-climate-planning-access-more-global-funds-4177341,1d5297669bdbd3714c42a59b9b2055ab,Bangladesh Climate Budgeting | Improve climate planning to access more global funds,20260517T071500Z,thedailystar.net,English,Bangladesh,shortage,D6_교란행위,2026-05-17
https://home.nzcity.co.nz/news/article.aspx?id=446027,734491c616ed85c39a23cf0147c1b4d4,Gazan families are still unable to bury dead trapped under rubble - 18 - May - 2026,20260517T194500Z,home.nzcity.co.nz,English,New Zealand,shortage,D6_교란행위,2026-05-17
https://www.theage.com.au/world/europe/how-this-city-s-young-people-are-fighting-back-one-derelict-home-at-a-time-20260513-p5zwm1.html,d789813aaf74e95a580f60d7fbc26cc9,"Over - tourism in Venice : How urban guerillas are tackling the canal city housing crisis , one home at a time",20260517T004500Z,theage.com.au,English,Australia,shortage,D6_교란행위,2026-05-17
https://www.theage.com.au/national/victoria/how-this-regional-town-became-a-caravan-community-20260513-p5zwcj.html,13dcc4489a435661c4f703f51d1734e3,Longwood fire aftermath : How the Ruffy community is navigating the long road to recovery after losing homes,20260517T064500Z,theage.com.au,English,Australia,shortage,D6_교란행위,2026-05-17
https://www.thedailystar.net/weekend-read/news/thirst-the-land-water-4176661,1bca88e0593e0ae0f77ce8f95b689d9f,Coastal Water Crisis Bangladesh | Thirst in the land of water | Salinity Intrusion in Cox Bazar,20260517T071500Z,thedailystar.net,English,Bangladesh,shortage,D6_교란행위,2026-05-17
https://en.apa.az/wuf13/congolese-minister-83-of-households-in-kinshasa-lack-land-ownership-documents-506308,4c7f3fa505c104c48f60dc57ad239773,Congolese minister : 83 % of households in Kinshasa lack land ownership documents,20260517T101500Z,en.apa.az,English,Azerbaijan,shortage,D6_교란행위,2026-05-17
https://www.yakimaherald.com/news/nation_and_world/entertainment/the-10-best-performances-at-the-2026-eurovision-song-contest/article_d653cf82-0be3-58b5-96ae-b1fb238f9c7e.html,59ff48065966edb0a2a15725fad5d9df,The 10 best performances at the 2026 Eurovision Song Contest,20260517T010000Z,yakimaherald.com,English,United States,shortage,D6_교란행위,2026-05-17
https://www.finanzen.ch/nachrichten/aktien/en_press-releasechina-xlx-announces-2026-q1-results-1036166414,3bda755003172c03b0497ee65bf0561d,EN _? Press Release ? China XLX Announces 2026 Q1 Results,20260517T070000Z,finanzen.ch,English,Switzerland,shortage,D6_교란행위,2026-05-17
https://www.macombdaily.com/2026/05/17/fouts-goats-hantavirus-and-elections-all-issues-in-the-forefront/,8eecec883827b7a2e5ebcb82f3497832,"FOUTS : Goats , hantavirus and elections all issues in the forefront",20260517T163000Z,macombdaily.com,English,United States,shortage,D6_교란행위,2026-05-17
https://www.hollywoodreporter.com/movies/movie-reviews/paper-tiger-review-scarlett-johansson-james-gray-1236596242/,522dda09c856d3ef5c0d69a07781f3cc,  Paper Tiger  Review : Adam Driver in James Gray Bruising Drama,20260517T020000Z,hollywoodreporter.com,English,United States,shortage,D6_교란행위,2026-05-17
https://www.finanznachrichten.de/nachrichten-2026-05/68517071-china-xlx-fertiliser-ltd-china-xlx-announces-2026-q1-results-200.htm,817d03d8a0048e4bf59b243e5f15a2bb,China XLX Fertiliser Ltd .: China XLX Announces 2026 Q1 Results,20260517T153000Z,finanznachrichten.de,English,Germany,shortage,D6_교란행위,2026-05-17
https://www.goodhousekeeping.com/home/decorating-ideas/a65354815/best-vintage-brands-to-buy/,22b0405371e073a384f15fd96d07d0f9,"18 Best Vintage Brands to Buy Secondhand , Designers Say",20260517T153000Z,goodhousekeeping.com,English,United States,shortage,D6_교란행위,2026-05-17
https://www.cubaheadlines.com/articles/329487,b62a0b73f3c6a314627ae9ee4af2be05,  Fire Hazards Highlight Waste Crisis in Central Havana  ,20260517T043000Z,cubaheadlines.com,English,Cuba,shortage,D6_교란행위,2026-05-17
https://carbuzz.com/used-suv-prices-punishing-first-time-buyers/,36cd7ad28d9afe08adf59c3abacb026c,Why Used SUV Prices Are Quietly Punishing First - Time Buyers,20260517T070000Z,carbuzz.com,English,United States,shortage,D6_교란행위,2026-05-17
https://www.pr-inside.com/china-xlx-announces-2026-q1-results-r5186493.htm,a950963f162ca97c168efca365d64e60,China XLX Announces 2026 Q1 Results,20260517T150000Z,pr-inside.com,English,United States,shortage,D6_교란행위,2026-05-17
https://www.theweek.in/theweek/cover/2026/05/16/the-techade-begins-how-india-is-building-its-semiconductor-future.html,fe8ee006e37355b09aaab9db18d1792a,The  Techade  begins : How India is building its semiconductor future - The Week,20260517T070000Z,theweek.in,English,India,shortage,D6_교란행위,2026-05-17
https://www.keranews.org/government/2026-05-17/tarrant-county-judge-touts-economic-growth-ahead-of-the-world-cup-in-state-of-the-county-address,1aca54b3940e4942ddb757702d208a5d,Tarrant County judge touts economic growth ahead of the World Cup in State of the County address,20260517T170000Z,keranews.org,English,United States,shortage,D6_교란행위,2026-05-17
https://www.wctrib.com/america-250-50-years-ago-today-may-17-1976,b40e62718952fee90d095be6f3526a88,"America 250 : 50 years ago today - May 17 , 1976",20260517T101500Z,wctrib.com,English,United States,shortage,D6_교란행위,2026-05-17
https://varsitarian.net/college-of-education-a-testament-to-truth-in-charity-says-ust-rector/,ad4d602ac2cecc65709261f0dbece8bd,"College of Education a testament to  truth in charity , says UST Rector",20260517T110000Z,varsitarian.net,English,Philippines,shortage,D6_교란행위,2026-05-17
