url_hash,title,url,seendate,domain,language,sourcecountry,query_keyword,query_group,collect_date,kg_entities,kg_match_count,relevance,topic,category
462f1c87eaee83fa10c0cd25e21205ea,Saudi Aramco CEO warns oil markets may not recover until 2027 due to Strait of Hormuz disruptions,https://www.fox29.com/news/saudi-aramco-ceo-oil-markets-hormuz-disruptions,20260512T183000Z,fox29.com,English,United States,terminal,D3_인프라,2026-05-12,,0,HIGH,Hormuz disruption,1_Security
6f83a4c23902a44ce8ff615ff98437ce,Strait of Hormuz tensions threaten to push gas past $5 a gallon by June,https://www.wptv.com/politics/economy/strait-of-hormuz-tensions-threaten-to-push-gas-past-5-by-june,20260512T183000Z,wptv.com,English,United States,blockade,D6_교란행위,2026-05-12,,0,HIGH,Hormuz tensions gas prices,1_Security
27abd235ac48fb1cfb80d31c1412a1f3,Iran Just Redrew Its Map of the Strait of Hormuz,https://www.newser.com/story/388984/iran-just-redrew-its-map-of-the-strait-of-hormuz.html,20260512T173000Z,newser.com,English,United States,blockade,D6_교란행위,2026-05-12,,0,HIGH,Hormuz Strait mapping,1_Security
6b3d2960dc2ccaa53e78a06196f10e88,VLGC rates hit record highs as Hormuz shutdown reshapes global LPG trade flows ( FRO : NYSE ) ,https://seekingalpha.com/news/4591381-vlgc-rates-hit-record-highs-as-hormuz-shutdown-reshapes-global-lpg-trade-flows,20260512T171500Z,seekingalpha.com,English,United States,freight,D4_운송,2026-05-12,,0,HIGH,Hormuz LPG Disruption,3_Freight
00b31cf216aaac6319804edbb3ae8da5,US sees Hormuz shutdown lasting through May as fuel prices surge,https://www.moneycontrol.com/world/us-sees-hormuz-shutdown-lasting-through-may-as-fuel-prices-surge-article-13917110.html,20260512T170000Z,moneycontrol.com,English,India,crude oil,D2_품목,2026-05-12,,0,HIGH,Hormuz shutdown,1_Security
e55fc6597d10ae2e8c7986284b7b221e,US government energy arm assumes Strait of Hormuz will stay shut through late May,https://www.marketscreener.com/news/us-government-s-energy-arm-assumes-strait-of-hormuz-will-stay-shut-through-late-may-ce7f5bdede8ef027,20260512T163000Z,marketscreener.com,English,,crude oil,D2_품목,2026-05-12,,0,HIGH,Hormuz closure,1_Security
9aa636de6b2d4eca5575d91b54b0865f,Sultan Al Jaber warns world 1 billion barrels short as Strait of Hormuz closure triggers global oil supply shock,https://gulfnews.com/business/sultan-al-jaber-warns-world-is-1-billion-barrels-of-oil-short-because-of-hormuz-closure-1.500538111,20260512T153000Z,gulfnews.com,English,United Arab Emirates,closure,D6_교란행위,2026-05-12,,0,HIGH,Hormuz Closure Oil Shock,1_Security
bd9bb5252022213c8364630aa75299ab,"Iran now defines Strait of Hormuz as far larger zone , IRGC officer says",https://www.al-monitor.com/originals/2026/05/iran-now-defines-strait-hormuz-far-larger-zone-irgc-officer-says,20260512T141500Z,al-monitor.com,English,Israel,natural gas,D2_품목,2026-05-12,,0,HIGH,Hormuz zone expansion,1_Security
4780cbbaf6aa0457e6b0b6a267ea1fba,"Oil Slides , Metals Jump as Hormuz Impacts China Imports",http://www.maritimeprofessional.com/news/slides-metals-jump-hormuz-impacts-419017,20260512T140000Z,maritimeprofessional.com,English,United States,iron ore,D2_품목,2026-05-12,,0,HIGH,Hormuz disruption,1_Security
591a380666dae8252de56cbc060171ef,US says 65 commercial vessels redirected under naval blockade of Iran,https://aa.com.tr/en/americas/us-says-65-commercial-vessels-redirected-under-naval-blockade-of-iran/3935111,20260512T131500Z,aa.com.tr,English,Turkey,blockade,D6_교란행위,2026-05-12,,0,HIGH,Naval blockade Iran,1_Security
e84efa4184345756fd86cb0b5c03e005,India bound urea shipment pulled after Iran link concerns : Report,https://www.businesstoday.in/latest/economy/story/india-bound-urea-shipment-pulled-after-iran-link-concerns-report-531062-2026-05-12,20260512T124500Z,businesstoday.in,English,India,petrochemical,D2_품목,2026-05-12,,0,HIGH,Urea supply disruption,10_OtherIndustry
8a21ab6e278ae60c705551c9a886d4ea,Shipping industry fears fuel shortages that could drive up prices worldwide,https://www.euronews.com/business/2026/05/12/shipping-industry-fears-fuel-shortages-that-could-drive-up-prices-worldwide,20260512T114500Z,euronews.com,English,United States,crude oil,D2_품목,2026-05-12,,0,HIGH,Fuel shortage risk,10_OtherIndustry
53680805c3854db706e31ae4fe7b18c6,IAE : Iran War Undermines Confidence in Strait of Hormuz,https://english.aawsat.com/business/5272244-iae-iran-war-undermines-confidence-strait-hormuz,20260512T100000Z,english.aawsat.com,English,Syria,natural gas,D2_품목,2026-05-12,,0,HIGH,Iran Hormuz confidence,1_Security
d8ac9813e7ea94f5c8cb8136fcec9dc9,"Natl security chief blasts attack on vessel Namu , pledges action : Korea . net : The official website of the Republic of Korea",https://www.korea.net/NewsFocus/policies/view?articleId=292155,20260512T091500Z,korea.net,English,South Korea,vessel,D4_운송,2026-05-12,,0,HIGH,Vessel attack Korea,1_Security
a91770a873fa77f0104743e31960258d,"oil prices today : Why are oil prices up today , and will Brent crude futures and US WTI rates rise sharply in near future ? Oil rises as supply fears return",https://economictimes.indiatimes.com/news/international/us/why-are-oil-prices-up-today-and-will-brent-crude-futures-and-us-wti-rates-rise-sharply-in-near-future-oil-rises-as-supply-fears-return/articleshow/131033133.cms,20260512T084500Z,economictimes.indiatimes.com,English,India,natural gas,D2_품목,2026-05-12,,0,HIGH,Oil price supply fears,5_EconFinance
2946460ef02be9664da94b6f7ab0cdc7,Oil rises as fragile US - Iran talks sustain supply worries,https://www.rte.ie/news/business/2026/0512/1572899-world-oil-prices/,20260512T081500Z,rte.ie,English,Ireland,natural gas,D2_품목,2026-05-12,,0,HIGH,Oil price Iran talks,5_EconFinance
b5a1865b5506fe243ccd144e4fb614e7,"Iran war threatens long - term confidence in Hormuz oil flows , IEA says",https://worldoil.com/news/2026/5/11/iran-war-threatens-long-term-confidence-in-hormuz-oil-flows-iea-says/,20260512T081500Z,worldoil.com,English,United States,trade disruption,D6_교란행위,2026-05-12,,0,HIGH,Hormuz oil flows,1_Security
4fbedc5f16f4dac25f4d85a91b479331,UN : Fertiliser disruption due to Hormuz crises may spark humanitarian emergency,https://www.middleeasteye.net/live-blog/live-blog-update/un-fertiliser-disruption-due-hormuz-crises-may-spark-humanitarian,20260512T080000Z,middleeasteye.net,English,Israel,disruption,D6_교란행위,2026-05-12,,0,HIGH,Fertilizer supply crisis,10_OtherIndustry
784a586fc9ee045b4c0b447ebe35a4af,Adnoc gas expects Strait of Hormuz closure to hit full - year profit,https://www.livemint.com/global/adnoc-gas-expects-strait-of-hormuz-closure-to-hit-full-year-profit-11778568673953.html,20260512T080000Z,livemint.com,English,India,natural gas,D2_품목,2026-05-12,,0,HIGH,Hormuz closure risk,1_Security
4b87ca40a502a306c8de652e67329cc7,Hell once again : The scorpion in the ring of fire – Iran ready for full - scale war with US … at Hormuz,https://www.bankingnews.gr/diethni/articles/874493/hell-once-again-the-scorpion-in-the-ring-of-fire-iran-ready-for-full-scale-war-with-us-at-hormuz%20title=,20260512T074500Z,bankingnews.gr,English,Greece,blockade,D6_교란행위,2026-05-12,,0,HIGH,Iran-US Hormuz conflict,1_Security
f57aded41c684944ec75a20f8983341a,Oil Prices Surge Amid Hormuz Tensions,https://athens-times.com/oil-prices-surge-amid-fears-of-escalation-in-the-strait-of-hormuz/,20260512T073000Z,athens-times.com,English,Greece,Brent crude,D5_시장지표,2026-05-12,,0,HIGH,Oil surge Hormuz,5_EconFinance
daca40c647ec246f5472cb3a4d0836d9,Trump Weighs Renewed Military Action Against Iran Amid Strait of Hormuz Crisis,http://www.econotimes.com/Trump-Weighs-Renewed-Military-Action-Against-Iran-Amid-Strait-of-Hormuz-Crisis-1741426,20260512T061500Z,econotimes.com,English,United States,shipping,D4_운송,2026-05-12,,0,HIGH,Iran military tensions,1_Security
f2f48664d2453019f5b770f348bf68d8,S . Korea to participate in defense minister meeting on Hormuz after ship blast,https://www.koreaherald.com/article/10735927,20260512T051500Z,koreaherald.com,English,South Korea,fertilizer,D2_품목,2026-05-12,,0,HIGH,Hormuz Security,1_Security
8e66b51708d08141d4b5f567a7f2c9e6,US issues new sanctions over Iran oil shipments to China,https://arynews.tv/us-issues-new-sanctions-over-irans-oil-shipments-to-china,20260512T044500Z,arynews.tv,English,Pakistan,disruption,D6_교란행위,2026-05-12,,0,HIGH,Iran oil sanctions,1_Security
5d620cca162c86261f4fe856c4c813ba,CNN : Trump More Seriously Considering Resuming Combat Operations in Iran Than He Has in Weeks,https://www.haaretz.com/israel-news/israel-security/2026-05-12/ty-article-live/cnn-trump-more-seriously-considering-resuming-combat-operations-in-iran/0000019e-19d8-dfbd-affe-3ddaa89a0000,20260512T040000Z,haaretz.com,English,Israel,blockade,D6_교란행위,2026-05-12,,0,HIGH,Iran military operations,1_Security
2e28cf2953585b617308ea90bad2d5c0,"Sitting near the Strait of Hormuz , seafarers are in limbo as Iran war drags on",https://www.abc.net.au/news/2026-05-12/strait-of-hormuz-drone-strike-kills-indian-sailor/106639990,20260512T033000Z,abc.net.au,English,Australia,vessel,D4_운송,2026-05-12,,0,HIGH,Hormuz Strait Disruption,1_Security
bcedde5f810f10e9569a4c0c284f1b83,"Sitting near the Strait of Hormuz , seafarers are in limbo as Iran war drags on - 12 - May - 2026","https://home.nzcity.co.nz/news/article.aspx?id=445717&fm=psp,tsf",20260512T030000Z,home.nzcity.co.nz,English,New Zealand,vessel,D4_운송,2026-05-12,,0,HIGH,Hormuz Strait Disruption,1_Security
b8d6846c0fe365914e40bb2eb9c5a8df,Oman calls for UN maritime action on stranded Gulf vessels,https://www.freemalaysiatoday.com/category/world/2026/05/12/oman-calls-for-maritime-action-on-stranded-gulf-vessels,20260512T024500Z,freemalaysiatoday.com,English,Malaysia,disruption,D6_교란행위,2026-05-12,,0,HIGH,Gulf vessel stranding,9_PortCongestion
72396f55abf7e3f4220f7c5dfa22f474,Oil prices today : Brent crude jumps to $105 per barrel as US - Iran ceasefire hangs on  life support  ,https://timesofindia.indiatimes.com/business/international-business/oil-prices-today-on-may-12-2026-brent-crude-jumps-to-105-per-barrel-as-us-iran-ceasefire-hangs-on-life-support/articleshow/131026757.cms,20260512T024500Z,timesofindia.indiatimes.com,English,India,natural gas,D2_품목,2026-05-12,,0,HIGH,Oil price spike Iran,5_EconFinance
d523f7a6af600b50a41aadf91e2e4c09,Debris from strike on S . Korean ship in Hormuz to arrive in Seoul soon : FM Cho,https://www.koreaherald.com/article/10735730,20260512T011500Z,koreaherald.com,English,South Korea,shipping,D4_운송,2026-05-12,,0,HIGH,Korean ship strike Hormuz,1_Security
cccdd5e77daadef56d1ec7cdbd0c84f3,Hunger lurks as Hormuz standoff blocks fertiliser,https://tribune.com.pk/story/2607613/hunger-lurks-as-hormuz-standoff-blocks-fertiliser,20260512T001500Z,tribune.com.pk,English,Pakistan,blockade,D6_교란행위,2026-05-12,,0,HIGH,Hormuz fertilizer blockade,1_Security
7ed4bc0f66519068e484b33368f1efb1,"Stocks Set for Muted Open as Oil Rises After Trump Rejects Iran Response to Peace Proposal , U . S . Inflation Data Awaited",https://finance.yahoo.com/markets/stocks/articles/stocks-set-muted-open-oil-104047351.html,20260512T194500Z,finance.yahoo.com,English,United States,semiconductor,D2_품목,2026-05-12,,0,MEDIUM,Oil Trump Iran,5_EconFinance
0ade111748f0d4c97c0c3af030632cd5,"Naphtha shortage puts Calbee chips , snacks in monochrome packaging",https://english.kyodonews.net:443/articles/-/75816,20260512T193000Z,english.kyodonews.net,English,Japan,naphtha,D2_품목,2026-05-12,,0,MEDIUM,Iran naphtha shortage,10_OtherIndustry
9c864c2c093173b81ec7c8429d7fcf68,Crude Oil Futures Climb Over 3 %; Brent breaches $107,https://www.rediff.com/business/report/crude-oil-futures-climb-over-3-brent-breaches-107/20260512.htm,20260512T191500Z,rediff.com,English,India,crude oil,D2_품목,2026-05-12,,0,MEDIUM,Crude oil price surge,5_EconFinance
e353d9f5813da453bba1ec7453a5441d,Qatari LNG Tanker Headed For Pakistan Successfully,https://www.marinelink.com/news/qatari-lng-tanker-headed-pakistan-539114,20260512T190000Z,marinelink.com,English,United States,natural gas,D2_품목,2026-05-12,,0,MEDIUM,LNG tanker transit,4_PortCargo
a449b3c52923606a72e3f47ec8af31ec,Lithuania Considers Contributing Minesweeping Efforts,https://www.marinelink.com/news/lithuania-considers-contributing-539111,20260512T190000Z,marinelink.com,English,United States,shipping,D4_운송,2026-05-12,,0,MEDIUM,Hormuz minesweeping,1_Security
6f0c5bcf031e56a2fe5d4bdd98d24568,UK To Contribute Mine - Hunting Resources To Strait Of,https://www.marinelink.com/news/uk-contribute-minehunting-resources-539113,20260512T190000Z,marinelink.com,English,United States,shipping,D4_운송,2026-05-12,,0,MEDIUM,Hormuz mine-hunting,1_Security
0831155df61c1e59ebcddee64b8b8ca0,West Asia crisis a wake - up call for self - reliance : Commerce and industry minister Piyush Goyal,https://economictimes.indiatimes.com/news/economy/policy/west-asia-crisis-a-wake-up-call-for-self-reliance-commerce-and-industry-minister-piyush-goyal/articleshow/131048149.cms,20260512T190000Z,economictimes.indiatimes.com,English,India,petrochemical,D2_품목,2026-05-12,,0,MEDIUM,West Asia supply crisis,1_Security
c5700414d58664b0003aae41272de752,Woodside Says Browse Could Add Over $100 Billion to Australian Economy,https://finance.yahoo.com/sectors/energy/articles/woodside-says-browse-could-add-091818218.html,20260512T183000Z,finance.yahoo.com,English,United States,pipeline,D3_인프라,2026-05-12,,0,MEDIUM,LNG export expansion,10_OtherIndustry
8b8ea370fb0e9751b5147728a89d53db,"Iran war has cost US $29bn so far , White House reveals",https://www.lbc.co.uk/article/iran-war-cost-usa-29-billion-5HjdZ2K_2/,20260512T183000Z,lbc.co.uk,English,United Kingdom,carrier,D4_운송,2026-05-12,,0,MEDIUM,Iran conflict costs,1_Security
7497bf5a2e43d83f26b407e938574bea,  The market is behaving as it should : Correcting the record on war risk cover in the gulf,https://www.insurancebusinessmag.com/us/news/marine/the-market-is-behaving-as-it-should-correcting-the-record-on-war-risk-cover-in-the-gulf-574920.aspx,20260512T183000Z,insurancebusinessmag.com,English,United States,vessel,D4_운송,2026-05-12,,0,MEDIUM,War risk insurance,5_EconFinance
4d15f61f46c5d837e96322487f2519b1,"UK to send drones , jets and warship to join defensive mission securing Strait of Hormuz",https://www.al-monitor.com/originals/2026/05/uk-send-drones-jets-and-warship-join-defensive-mission-securing-strait-hormuz,20260512T183000Z,al-monitor.com,English,Israel,shipping,D4_운송,2026-05-12,,0,MEDIUM,Hormuz defensive mission,1_Security
3b5ceb6c52609eaab5440333f662d465,Stocks wilt as oil rallies ; Iran ceasefire  on life support  ,https://www.channelnewsasia.com/business/stocks-oil-prices-iran-ceasefire-us-war-life-support-trump-hormuz-6114946,20260512T181500Z,channelnewsasia.com,English,United States,semiconductor,D2_품목,2026-05-12,,0,MEDIUM,Oil rally Iran ceasefire,5_EconFinance
395c81c3f2d0ebf66fc0ffa7702ffebd,Protecting Taiwan cables at sea - Taipei Times,https://www.taipeitimes.com/News/editorials/archives/2026/05/13/2003857226,20260512T181500Z,taipeitimes.com,English,Taiwan,vessel,D4_운송,2026-05-12,,0,MEDIUM,Taiwan infrastructure,1_Security
9a80db82f4acdc96db287fdcaf5ddd93,Indian Prime Minister Demands Pandemic - Era  Work from Home  over Strait of Hormuz Fuel Crisis,https://www.breitbart.com/national-security/2026/05/11/indian-prime-minister-demands-pandemic-era-work-home-over-strait-hormuz-fuel-crisis/,20260512T181500Z,breitbart.com,English,United States,fertilizer,D2_품목,2026-05-12,,0,MEDIUM,Hormuz Fuel Crisis,1_Security
4f68bfc9485afe6f46a8fbb30c988bcf,Iran Faces Death by a Thousand Cuts,https://townhall.com/tipsheet/dmitri-bolt/2026/05/12/president-trumps-iran-strategy-death-by-1000-cuts-n2675958,20260512T180000Z,townhall.com,English,United States,blockade,D6_교란행위,2026-05-12,,0,MEDIUM,Iran sanctions,1_Security
bb104812c30a620ca18374e77a30c82b,Donald Trump asserts Iran will stop enriching uranium and hand it over to the US,http://www.jpost.com/middle-east/iran-news/article-895937,20260512T180000Z,jpost.com,English,Israel,blockade,D6_교란행위,2026-05-12,,0,MEDIUM,Iran uranium negotiations,1_Security
0d622a94bbda46e4dafe3c2f54fa4935,"European Markets Close Weak As Rising Oil Prices , U . S .- Iran Concerns Weigh",https://www.finanzen.ch/nachrichten/aktien/european-markets-close-weak-as-rising-oil-prices-u-s-iran-concerns-weigh-1036144391,20260512T180000Z,finanzen.ch,English,Switzerland,Brent crude,D5_시장지표,2026-05-12,,0,MEDIUM,European markets oil,5_EconFinance
a8da9cd4363ee9ad027f78473b99b2c2,EU weighs expanding naval mission to Strait of Hormuz to secure key global shipping routes,https://www.moneycontrol.com/world/eu-weighs-expanding-naval-mission-to-strait-of-hormuz-to-secure-key-global-shipping-routes-article-13917169.html,20260512T173000Z,moneycontrol.com,English,India,natural gas,D2_품목,2026-05-12,,0,MEDIUM,Hormuz naval mission,1_Security
59fc8002135011e4e3e1cabfe07ac132,"Wall St falls as hot inflation , Iran tensions weigh",https://www.marketscreener.com/news/wall-st-falls-as-hot-inflation-iran-tensions-weigh-ce7f5bded18df527,20260512T171500Z,marketscreener.com,English,,semiconductor,D2_품목,2026-05-12,,0,MEDIUM,Iran tensions,5_EconFinance
401e59395c70f6a26dfbf65c0533abb4,Trump Reportedly Closer to Resuming War With Iran Than in Recent Weeks,https://www.haaretz.com/middle-east-news/iran/2026-05-12/ty-article/trump-reportedly-closer-to-resuming-war-with-iran-than-in-recent-weeks/0000019e-1aa9-d14f-abfe-1bad3aaa0000,20260512T171500Z,haaretz.com,English,Israel,blockade,D6_교란행위,2026-05-12,,0,MEDIUM,US-Iran tensions,1_Security
c389d338be960fa9879df274bc1bc378,Ship operator and employee are charged in crash that caused the deadly collapse of Baltimore bridge,https://www.newsday.com/news/nation/baltimore-key-bridge-collapse-charges-dali-ship-r81681,20260512T171500Z,newsday.com,English,United States,shipping,D4_운송,2026-05-12,,0,MEDIUM,Bridge Collapse,2_Safety
4b404c93cd0cfa46f032b0ac73b21310,Charges Filed In Baltimore Bridge Collapse | News Radio 920 AM & 104 . 7 FM,https://newsradiori.iheart.com/content/2026-05-12-charges-filed-in-baltimore-bridge-collapse/,20260512T171500Z,newsradiori.iheart.com,English,United States,container ship,D4_운송,2026-05-12,,0,MEDIUM,Bridge collapse,2_Safety
da97c20cfe7a1091f9bb99f3e38a527f,Charges Filed In Baltimore Bridge Collapse | News Radio 103 . 1 and 810 WGY,https://wgy.iheart.com/content/2026-05-12-charges-filed-in-baltimore-bridge-collapse/,20260512T171500Z,wgy.iheart.com,English,United States,container ship,D4_운송,2026-05-12,,0,MEDIUM,Bridge collapse,2_Safety
644210ea9cd31b270142e412d9649b86,"World News : Lithuania could contribute minesweeping capabilities in Hormuz , defence chief says","https://www.gdnonline.com:443/Details/1394493/Lithuania-could-contribute-minesweeping-capabilities-in-Hormuz,-defence-chief-says-",20260512T163000Z,gdnonline.com,English,United States,shipping,D4_운송,2026-05-12,,0,MEDIUM,Hormuz minesweeping capability,1_Security
e64b80acc740537db5a62e1dc90db5a4,Japan biggest crisp maker swaps colourful packaging for black - and - white as Iran war triggers shortages,https://www.independent.co.uk/asia/east-asia/japan-calbee-black-and-white-packaging-iran-war-b2974946.html,20260512T163000Z,independent.co.uk,English,United Kingdom,naphtha,D2_품목,2026-05-12,,0,MEDIUM,Iran ink shortage,10_OtherIndustry
f6fe6e413c723cab12eb9dce7d606108,U . S . Stocks Move Mostly Lower As Oil Surges Back Above $100 A Barrel,https://www.finanzen.ch/nachrichten/aktien/u-s-stocks-move-mostly-lower-as-oil-surges-back-above-$100-a-barrel-1036143789,20260512T160000Z,finanzen.ch,English,Switzerland,crude oil,D2_품목,2026-05-12,,0,MEDIUM,Oil price surge,5_EconFinance
e5b164a301fa7abb3f2d0de9a46d02ea,Geopolitical oil shocks could create severe headwinds for oil - importing economies : WB report,https://www.thedailystar.net/business/news/geopolitical-oil-shocks-could-create-severe-headwinds-oil-importing-economies-wb-report-4174086,20260512T160000Z,thedailystar.net,English,Bangladesh,natural gas,D2_품목,2026-05-12,,0,MEDIUM,Oil shock impacts,5_EconFinance
cdeadcf64564f9f3eeba1a8fcedc059e,"US and Iran avoid renewed war , but peace remains elusive",https://www.stripes.com/theaters/middle_east/2026-05-12/iran-war-next-steps-trump-21647796.html,20260512T160000Z,stripes.com,English,United States,blockade,D6_교란행위,2026-05-12,,0,MEDIUM,US-Iran conflict,1_Security
2c8cd10c6fc9caf456d23e63e354b05d,Govt launches Bharat Maritime Insurance Pool to provide cover to Indian vessels amid West Asia crisis,https://www.moneycontrol.com/news/india/govt-launches-bharat-maritime-insurance-pool-to-provide-cover-to-indian-vessels-amid-west-asia-crisis-13917070.html,20260512T160000Z,moneycontrol.com,English,India,shipping,D4_운송,2026-05-12,,0,MEDIUM,Maritime Insurance,1_Security
26409f7ca0596b73380217640f760ab9,Prices Skyrocket To Highest Level In Years As Fallout From Iran War Continues Ravaging Economy,https://dailycaller.com/2026/05/12/prices-skyrocket-to-highest-level-in-years-as-fallout-from-iran-war-continues-ravaging-economy/,20260512T160000Z,dailycaller.com,English,United States,fertilizer,D2_품목,2026-05-12,,0,MEDIUM,Price surge Iran,5_EconFinance
a9223ce464b04877c4f1ac15fa6aad52,Trump heads to China weakened by Iran war as Xi gains leverage,https://www.moneycontrol.com/world/trump-heads-to-china-weakened-by-iran-war-as-xi-gains-leverage-article-13917050.html,20260512T160000Z,moneycontrol.com,English,India,rare earth,D2_품목,2026-05-12,,0,MEDIUM,Iran war geopolitics,1_Security
33bbf512ca1982ae8610ce984e106e38,Charges Filed In Baltimore Bridge Collapse,https://55krc.iheart.com/content/2026-05-12-charges-filed-in-baltimore-bridge-collapse/,20260512T160000Z,55krc.iheart.com,English,United States,container ship,D4_운송,2026-05-12,,0,MEDIUM,Bridge collapse,2_Safety
d6c97e77ba7e7e0bcda9aa80e4210a02,Iran Guards hold military drills in capital as ceasefire teeters,https://www.arabnews.com/node/2643307/middle-east,20260512T153000Z,arabnews.com,English,Saudi Arabia,fertilizer,D2_품목,2026-05-12,,0,MEDIUM,Iran military drills,1_Security
524b189c4521a2a1234f0c0452b4748d,"Oil prices rise as tensions flare in Middle East , Trump says US - Iran ceasefire is  on life support  ",https://finance.yahoo.com/markets/article/oil-prices-rise-as-tensions-flare-in-middle-east-trump-says-us-iran-ceasefire-is-on-life-support-143133553.html,20260512T153000Z,finance.yahoo.com,English,United States,Brent crude,D5_시장지표,2026-05-12,,0,MEDIUM,Oil price surge,5_EconFinance
649089404009f4a019dc4b7171b13592,U . S . inflation jumps 3 . 8 % as Iran war sends energy prices higher,https://www.nbcsandiego.com/news/national-international/inflation-consumer-prices-rise-iran-war-energy-prices-higher/4022534/,20260512T151500Z,nbcsandiego.com,English,United States,natural gas,D2_품목,2026-05-12,,0,MEDIUM,Iran war energy prices,5_EconFinance
69c37a79bdf3b3a26a820fee1a6d2500,US - Iran negotiations falter over unresolved issues,https://www.omanobserver.om/article/1189506/world/asia/us-iran-negotiations-falter-over-unresolved-issues,20260512T151500Z,omanobserver.om,English,Oman,blockade,D6_교란행위,2026-05-12,,0,MEDIUM,US-Iran talks,1_Security
6438b3fcc581f48c8a28db40e5f735a5,"Sensex crashes 1 , 456 points , Nifty slips below 23 , 400 as West Asia tensions rattle markets",https://www.ibtimes.co.in/sensex-crashes-1456-points-nifty-slips-below-23400-west-asia-tensions-rattle-markets-901985,20260512T150000Z,ibtimes.co.in,English,India,crude oil,D2_품목,2026-05-12,,0,MEDIUM,West Asia tensions,1_Security
5e7ec6b586fa72c02c1b58757d82f061,Baltic Dry Index climbs to 3063 up 62 points | Hellenic Shipping News Worldwide,https://www.hellenicshippingnews.com/baltic-dry-index-climbs-to-3063-up-62-points/,20260512T150000Z,hellenicshippingnews.com,English,China,iron ore,D2_품목,2026-05-12,,0,MEDIUM,Freight rates,3_Freight
20f8f130c123e039c3188934bfd2d1ba,US to release 53 million barrels of oil from Strategic Petroleum Reserve,https://www.10tv.com/article/news/nation-world/united-states-energy-department-oil-barrels-strategic-patroleum-reserve-release/507-f8ab65ec-b3a3-424d-9228-075e377cf43c,20260512T144500Z,10tv.com,English,United States,crude oil,D2_품목,2026-05-12,,0,MEDIUM,US SPR release,5_EconFinance
cf085a4870ca45f8ed51cb5b43f0a588,"Oil Slides , Metals Jump As Hormuz Impacts China",https://www.marinelink.com/news/oil-slides-metals-jump-hormuz-impacts-539066,20260512T144500Z,marinelink.com,English,United States,crude oil,D2_품목,2026-05-12,,0,MEDIUM,Hormuz disruption,5_EconFinance
7cab5674eac31bdb8823d05db3d28e0c,Qatar says Iran should not use Hormuz to  blackmail  Gulf,https://arynews.tv/qatar-says-iran-not-use-hormuz-blackmail-gulf,20260512T144500Z,arynews.tv,English,Pakistan,natural gas,D2_품목,2026-05-12,,0,MEDIUM,Hormuz geopolitics,1_Security
ee1589a443a618ae1354cd041d05e1ea,US consumer inflation hits a three - year high in April,https://punchng.com/us-consumer-inflation-hits-three-year-high/,20260512T140000Z,punchng.com,English,Nigeria,natural gas,D2_품목,2026-05-12,,0,MEDIUM,US inflation surge,5_EconFinance
ce2e9aba919876939c4e37a17ba7410c,US Consumer Inflation Hits Three - Year High Fuelled By Iran War,https://www.channelstv.com/2026/05/12/us-consumer-inflation-hits-three-year-high-fuelled-by-iran-war/,20260512T140000Z,channelstv.com,English,Nigeria,natural gas,D2_품목,2026-05-12,,0,MEDIUM,Inflation Iran war,5_EconFinance
9879f82386292dfcef88ff34d2731695,US consumer prices rise 3 . 8 % as Iran war sends energy prices higher,https://mynorthwest.com/national/us-consumer-prices-rise-3-8-as-iran-war-sends-energy-prices-higher/4237360,20260512T140000Z,mynorthwest.com,English,United States,natural gas,D2_품목,2026-05-12,,0,MEDIUM,Iran war energy prices,5_EconFinance
